,id,alias,name,image_url,is_closed,url,review_count,categories,rating,coordinates,transactions,price,location,phone,display_phone,distance,rev1,rev2,rev3
0,a3O2KzK6rh8VZNq1jhz81Q,the-delancey-new-york,The Delancey,https://s3-media4.fl.yelpcdn.com/bphoto/vwuUrsZJlCQXHG7uv1FrnA/o.jpg,False,https://www.yelp.com/biz/the-delancey-new-york?adjust_creative=xC4n-h7ZGIsND4SXpQ_Fzg&utm_campaign=yelp_api_v3&utm_medium=api_v3_business_search&utm_source=xC4n-h7ZGIsND4SXpQ_Fzg,586,"[{'alias': 'lounges', 'title': 'Lounges'}, {'alias': 'danceclubs', 'title': 'Dance Clubs'}]",3.0,"{'latitude': 40.71803, 'longitude': -73.98528}",[],$$,"{'address1': '168 Delancey St', 'address2': '', 'address3': '', 'city': 'New York', 'zip_code': '10002', 'country': 'US', 'state': 'NY', 'display_address': ['168 Delancey St', 'New York, NY 10002']}",+12122549920,(212) 254-9920,158.10919796568047,"I went on a Saturday night with some girlfriends,  to just dance and have a good time. 

Pro: eclectic music, nice rooftop, interesting crowd.

Cons: very...","- Right by the Williamsburg bridge so it's further away from the popping bars on the LES
- The free glass of house champagne is only for weekdays
- 2...","3 stars for venue
3.5 stars for music.

This is my safety net for partying. When all else fails, or when I cant decide on where to go, this is my go to..."
1,iM3zYjjmnJ06VVmxvTo9eQ,nitecap-new-york,Nitecap,https://s3-media1.fl.yelpcdn.com/bphoto/ebbPQuhqhshVZXPynSJfIw/o.jpg,False,https://www.yelp.com/biz/nitecap-new-york?adjust_creative=xC4n-h7ZGIsND4SXpQ_Fzg&utm_campaign=yelp_api_v3&utm_medium=api_v3_business_search&utm_source=xC4n-h7ZGIsND4SXpQ_Fzg,339,"[{'alias': 'cocktailbars', 'title': 'Cocktail Bars'}]",4.0,"{'latitude': 40.719125, 'longitude': -73.985732}",[],$$,"{'address1': '151 Rivington St', 'address2': '', 'address3': '', 'city': 'New York', 'zip_code': '10002', 'country': 'US', 'state': 'NY', 'display_address': ['151 Rivington St', 'New York, NY 10002']}",,,278.75168723522944,Came here on a Saturday night with a friend. Great place to come for a date or with a small group of friends! Drinks are a bit on the expensive side but...,My friends and I went to this place last week and it was good. The store is located downstairs. I love the decoration and the design of their menu. Their...,"Very cool bar hidden around the corner. Went their with my 6 friends last week. We ordered different drinks and all good. 
It's a little bit noisy with the..."
2,aiRctIzCj9J3UqBHd-Z3HQ,please-dont-tell-new-york-2,Please Don't Tell,https://s3-media4.fl.yelpcdn.com/bphoto/S7CROtdNqk2OnNBOZU1U1w/o.jpg,False,https://www.yelp.com/biz/please-dont-tell-new-york-2?adjust_creative=xC4n-h7ZGIsND4SXpQ_Fzg&utm_campaign=yelp_api_v3&utm_medium=api_v3_business_search&utm_source=xC4n-h7ZGIsND4SXpQ_Fzg,1801,"[{'alias': 'lounges', 'title': 'Lounges'}, {'alias': 'speakeasies', 'title': 'Speakeasies'}]",4.0,"{'latitude': 40.727098, 'longitude': -73.983763}",[],$$$,"{'address1': '113 St Marks Pl', 'address2': '', 'address3': '', 'city': 'New York', 'zip_code': '10009', 'country': 'US', 'state': 'NY', 'display_address': ['113 St Marks Pl', 'New York, NY 10009']}",+12126140386,(212) 614-0386,1174.4008606516536,"I went to this famous speakeasy when I first moved to NYC so my memories are a bit blurry at the moment, but from what I remember, the drinks were indeed...",Great low key place to have a few drinks. I say low key because its tiny inside and they do NOT let it get packed. They only allow enough people in the bar...,PDT is a wonderful cocktail bar.  The atmosphere is very unique and that alone makes it worth the visit.  The amazing selection of craft cocktails will be...
3,H7S7-vF2z_HfaLo6BGPetw,attaboy-new-york,Attaboy,https://s3-media2.fl.yelpcdn.com/bphoto/Uh7vEEKxPvgw3kexFzuz9Q/o.jpg,False,https://www.yelp.com/biz/attaboy-new-york?adjust_creative=xC4n-h7ZGIsND4SXpQ_Fzg&utm_campaign=yelp_api_v3&utm_medium=api_v3_business_search&utm_source=xC4n-h7ZGIsND4SXpQ_Fzg,551,"[{'alias': 'cocktailbars', 'title': 'Cocktail Bars'}, {'alias': 'speakeasies', 'title': 'Speakeasies'}]",4.0,"{'latitude': 40.7188874, 'longitude': -73.9913351}",[],$$,"{'address1': '134 Eldridge St', 'address2': '', 'address3': '', 'city': 'New York', 'zip_code': '10002', 'country': 'US', 'state': 'NY', 'display_address': ['134 Eldridge St', 'New York, NY 10002']}",,,549.6273500131274,"Attaboy was the Aladdin to my Jasmine because it showed me a whole new world. I used to be just a Moscow mule or a gin and tonic guy, but after going to...","I had such high expectations for Attaboy as every time I come to New York, it's been on my list, but timing was never right.

We finally got in, and they...","Attaboy is always packed. 
I came here on a TUESDAY night and after multiple attempts knocking the doors and obviaoujy my knuckles turned purple the next..."
4,yjmedpxGM2RlCRbOafOU7Q,rumpus-room-new-york,Rumpus Room,https://s3-media2.fl.yelpcdn.com/bphoto/NhPxt26JPy3vYNrLZS9jMg/o.jpg,False,https://www.yelp.com/biz/rumpus-room-new-york?adjust_creative=xC4n-h7ZGIsND4SXpQ_Fzg&utm_campaign=yelp_api_v3&utm_medium=api_v3_business_search&utm_source=xC4n-h7ZGIsND4SXpQ_Fzg,85,"[{'alias': 'danceclubs', 'title': 'Dance Clubs'}]",3.5,"{'latitude': 40.722972, 'longitude': -73.989657}",[],$$,"{'address1': '249 Eldridge St', 'address2': '', 'address3': '', 'city': 'New York', 'zip_code': '10002', 'country': 'US', 'state': 'NY', 'display_address': ['249 Eldridge St', 'New York, NY 10002']}",+12127775153,(212) 777-5153,787.2246184032215,Best bar ever! Great drinks great music! Fun for groups! Love it here everyone should come literally so convenient and awrsome,"In regards to all the people complaining of 15 - 20% gratuity

NYS LAW  section 6 RCNY §5-59(b)

Restaurants/clubs cannot charge a surcharge or other fees...",Nice and roomy at 11:30. Quick bad service. There is a cover. Seems to be the go to for 30 year old birthdays lol nothing to be ashamed about
5,X0f9UYHoE4OxnuUq801vMg,the-upstairs-at-66-new-york,The Upstairs at 66,https://s3-media2.fl.yelpcdn.com/bphoto/rAFkogN1Jpl-stxKwtep4Q/o.jpg,False,https://www.yelp.com/biz/the-upstairs-at-66-new-york?adjust_creative=xC4n-h7ZGIsND4SXpQ_Fzg&utm_campaign=yelp_api_v3&utm_medium=api_v3_business_search&utm_source=xC4n-h7ZGIsND4SXpQ_Fzg,15,"[{'alias': 'lounges', 'title': 'Lounges'}, {'alias': 'arcades', 'title': 'Arcades'}, {'alias': 'speakeasies', 'title': 'Speakeasies'}]",5.0,"{'latitude': 40.70418, 'longitude': -74.01048}",[],$$,"{'address1': '46 Stone St', 'address2': None, 'address3': '', 'city': 'New York', 'zip_code': '10004', 'country': 'US', 'state': 'NY', 'display_address': ['46 Stone St', 'New York, NY 10004']}",+12129431602,(212) 943-1602,2517.174299448045,This place is absolutely wonderful. I threw a baby shower here for my sister and her husband. Everyone had a GREAT time. We were allowed to play our own...,We came on a Friday night and we didn't have to wait for a table which was awesome! I ordered the bison burger and it was delicious. The best part is the...,"I've been coming to Stone Street for a while, as it offers a good choice of bars and it's easy to bounce around. The Upstairs gives me the best reason to..."
6,xDELCKWk0sjaSFw8CeQkPA,club-cumming-new-york,Club Cumming,https://s3-media1.fl.yelpcdn.com/bphoto/__jR_B75aK1m8sI3Er5EBg/o.jpg,False,https://www.yelp.com/biz/club-cumming-new-york?adjust_creative=xC4n-h7ZGIsND4SXpQ_Fzg&utm_campaign=yelp_api_v3&utm_medium=api_v3_business_search&utm_source=xC4n-h7ZGIsND4SXpQ_Fzg,41,"[{'alias': 'danceclubs', 'title': 'Dance Clubs'}, {'alias': 'lounges', 'title': 'Lounges'}]",4.0,"{'latitude': 40.72535, 'longitude': -73.98342}",[],$$,"{'address1': '505 E 6th St', 'address2': '', 'address3': None, 'city': 'New York', 'zip_code': '10009', 'country': 'US', 'state': 'NY', 'display_address': ['505 E 6th St', 'New York, NY 10009']}",+19172658006,(917) 265-8006,989.5522357778752,"I've been to a few drag cabaret shows here (featuring Tina Burner) and absolutely have fallen in love with the place. The drinks are well made, the wait...","Ok, I feel terrible because I want to give it a 3.5 but not a 4... and here is the thing. I have been here only twice, once for drinks on  regular day...","Club Cumming is a East Village gay bar backed by Alan of the same name, hosting shows most every night.

I came last night for Cat Cohen's weekly Cabernet..."
7,DfGVOGrlTQtkx2zdNM-Zbw,mr-purple-new-york,Mr. Purple,https://s3-media1.fl.yelpcdn.com/bphoto/SpfGqgrJtoQTWABJuJPYlw/o.jpg,False,https://www.yelp.com/biz/mr-purple-new-york?adjust_creative=xC4n-h7ZGIsND4SXpQ_Fzg&utm_campaign=yelp_api_v3&utm_medium=api_v3_business_search&utm_source=xC4n-h7ZGIsND4SXpQ_Fzg,665,"[{'alias': 'lounges', 'title': 'Lounges'}, {'alias': 'cocktailbars', 'title': 'Cocktail Bars'}]",3.0,"{'latitude': 40.72175, 'longitude': -73.98802}",[],$$$,"{'address1': '180 Orchard St', 'address2': '', 'address3': 'Hotel Indigo', 'city': 'New York', 'zip_code': '10002', 'country': 'US', 'state': 'NY', 'display_address': ['180 Orchard St', 'Hotel Indigo', 'New York, NY 10002']}",+12122371790,(212) 237-1790,625.0228182707132,Wonderful time with a group of friends in the roof terrace bar early evening. Very comfortable seating at our sofa-chair table area. Fabulous wine and truly...,"great spot to hangout with your friends 
even the elevator light was purple 
chill hangout spot and there are games like a pool table 
dark, ambient, and...",Security is always on edge. They refuse to help with finding my reservation. They got mad at my brother because he didn't know what side of his wrist to...
8,fzN8PuCQ1l2sAvCyiMWC8g,old-man-hustle-new-york-5,Old Man Hustle,https://s3-media4.fl.yelpcdn.com/bphoto/P8J-Raf_jlPJn4_QvkTT7A/o.jpg,False,https://www.yelp.com/biz/old-man-hustle-new-york-5?adjust_creative=xC4n-h7ZGIsND4SXpQ_Fzg&utm_campaign=yelp_api_v3&utm_medium=api_v3_business_search&utm_source=xC4n-h7ZGIsND4SXpQ_Fzg,182,"[{'alias': 'cocktailbars', 'title': 'Cocktail Bars'}, {'alias': 'divebars', 'title': 'Dive Bars'}, {'alias': 'comedyclubs', 'title': 'Comedy Clubs'}]",4.5,"{'latitude': 40.716267, 'longitude': -73.989698}",[],$$,"{'address1': '39 Essex St', 'address2': '', 'address3': '', 'city': 'New York', 'zip_code': '10002', 'country': 'US', 'state': 'NY', 'display_address': ['39 Essex St', 'New York, NY 10002']}",+12122537747,(212) 253-7747,352.78385442105895,Random walk by and met Rachel is the comic edgy bartender who with Mark (a regular) helped me settle in on the HIBIKI scotch. Great place - can't catch the...,You don't come here for the speciality drinks or  sleek NYC ambiance ! It's your favorite dive bar with one exception-the talent. You may get lucky and...,There are very few places in the city I enjoy as much as I enjoy this place. It gets loud sometimes but most of the times it's in a good way. They have some...
9,4nZlMrDw-mrvmfEVT-cQrw,the-village-underground-new-york,The Village Underground,https://s3-media1.fl.yelpcdn.com/bphoto/EhxG5ikrun8saPi-cNO-Ig/o.jpg,False,https://www.yelp.com/biz/the-village-underground-new-york?adjust_creative=xC4n-h7ZGIsND4SXpQ_Fzg&utm_campaign=yelp_api_v3&utm_medium=api_v3_business_search&utm_source=xC4n-h7ZGIsND4SXpQ_Fzg,312,"[{'alias': 'danceclubs', 'title': 'Dance Clubs'}, {'alias': 'lounges', 'title': 'Lounges'}, {'alias': 'comedyclubs', 'title': 'Comedy Clubs'}]",4.0,"{'latitude': 40.7306935670033, 'longitude': -74.0009226385494}",[],$$,"{'address1': '130 W 3rd St', 'address2': '', 'address3': '', 'city': 'New York', 'zip_code': '10012', 'country': 'US', 'state': 'NY', 'display_address': ['130 W 3rd St', 'New York, NY 10012']}",+12127777745,(212) 777-7745,2031.9528336046699,I was so excited to see comedy in NYC! The best thing about visiting a big city is the abundance of comedy available on so many nights of the week! I was...,Had a great time here. Reserved my ticket online for just me. Showed up to the venue and got my pouch for my phone. The guy came through the line to make...,"Highly recommend - we had a great time here! I came with a friend on Thursday night while visiting the city. 

We loved our experience but I gave a minus 1..."
10,gNA_ZxAd5xvBuqc0AIfheA,the-dancer-new-york,The Dancer,https://s3-media2.fl.yelpcdn.com/bphoto/mHHBzlZCWWJcis6t_r-QwA/o.jpg,False,https://www.yelp.com/biz/the-dancer-new-york?adjust_creative=xC4n-h7ZGIsND4SXpQ_Fzg&utm_campaign=yelp_api_v3&utm_medium=api_v3_business_search&utm_source=xC4n-h7ZGIsND4SXpQ_Fzg,9,"[{'alias': 'cocktailbars', 'title': 'Cocktail Bars'}]",5.0,"{'latitude': 40.714, 'longitude': -73.98705}",[],,"{'address1': '202 Clinton St', 'address2': '', 'address3': None, 'city': 'New York', 'zip_code': '10002', 'country': 'US', 'state': 'NY', 'display_address': ['202 Clinton St', 'New York, NY 10002']}",+16468761174,(646) 876-1174,306.31712137133906,One of the most difficult things in NY is finding a place in the city that is cool but isn't overcrowded with people...especially annoying people.  I read...,"As a guy in his mid-30s who used to be cool (and still think's he's sort-of cool, but hates most bar goers in Lower East Side), I appreciate The Dancer...","What a great place for liquor, and a nice craft cocktail. Service is excellent and affordable prices make this a great neighborhood bar ! This place is..."
11,ajdv6_mWIkAXzn71CUdpkw,copper-and-oak-new-york-5,Copper & Oak,https://s3-media2.fl.yelpcdn.com/bphoto/9ZFmNHJcCxy_ABgaM4PClQ/o.jpg,False,https://www.yelp.com/biz/copper-and-oak-new-york-5?adjust_creative=xC4n-h7ZGIsND4SXpQ_Fzg&utm_campaign=yelp_api_v3&utm_medium=api_v3_business_search&utm_source=xC4n-h7ZGIsND4SXpQ_Fzg,101,"[{'alias': 'bars', 'title': 'Bars'}]",4.5,"{'latitude': 40.721065, 'longitude': -73.98986}",[],$$$,"{'address1': '157 Allen St', 'address2': '', 'address3': '', 'city': 'New York', 'zip_code': '10002', 'country': 'US', 'state': 'NY', 'display_address': ['157 Allen St', 'New York, NY 10002']}",+12124605546,(212) 460-5546,611.4993810587354,"Whiskies galore! Or maybe whiskeys since we're in the US... No matter the spelling, Copper & Oak has what you need. And with their bright orange lighting...","Hands down one of my favorite places to get a glass of whiskey. There is such a huge variety, shelves on shelves. The setting is very intimate, dim...","I came here with boyfriend to celebrate his birthday. He is a huge whiskey fan and we've been to multiple specialized whiskey bars in the past.

We walked..."
12,xO2qfPmCAZgv_Sx5ypaK2w,caveat-new-york,Caveat,https://s3-media2.fl.yelpcdn.com/bphoto/tz6xyy1cCtsBBThyx8yvZg/o.jpg,False,https://www.yelp.com/biz/caveat-new-york?adjust_creative=xC4n-h7ZGIsND4SXpQ_Fzg&utm_campaign=yelp_api_v3&utm_medium=api_v3_business_search&utm_source=xC4n-h7ZGIsND4SXpQ_Fzg,34,"[{'alias': 'comedyclubs', 'title': 'Comedy Clubs'}, {'alias': 'theater', 'title': 'Performing Arts'}, {'alias': 'musicvenues', 'title': 'Music Venues'}]",4.5,"{'latitude': 40.7206833, 'longitude': -73.984427}",[],,"{'address1': '21 A Clinton St', 'address2': 'Basement', 'address3': None, 'city': 'New York', 'zip_code': '10002', 'country': 'US', 'state': 'NY', 'display_address': ['21 A Clinton St', 'Basement', 'New York, NY 10002']}",+12122282100,(212) 228-2100,458.14285776726234,I'm not exaggerating when I say that Caveat is one of my favorite places in NY--you just can't find shows like theirs anywhere else. They have an incredible...,"I tell all my friends about this venue. It's INCREDIBLE. NYC has some of the world's best and brightest - science, arts, comedy, anything and everything in...","I got taken to a comedy show here that was objectively terrible. The venue itself was good, but the show was awful.

So, a caveat about that sentence above..."
13,neHrnNsYPpRZqdXiemV-sg,the-back-room-new-york,The Back Room,https://s3-media3.fl.yelpcdn.com/bphoto/s9wv51VGeSa4exnkI8G_vg/o.jpg,False,https://www.yelp.com/biz/the-back-room-new-york?adjust_creative=xC4n-h7ZGIsND4SXpQ_Fzg&utm_campaign=yelp_api_v3&utm_medium=api_v3_business_search&utm_source=xC4n-h7ZGIsND4SXpQ_Fzg,880,"[{'alias': 'lounges', 'title': 'Lounges'}, {'alias': 'speakeasies', 'title': 'Speakeasies'}]",3.5,"{'latitude': 40.71878, 'longitude': -73.98706}",[],$$,"{'address1': '102 Norfolk St', 'address2': None, 'address3': '', 'city': 'New York', 'zip_code': '10002', 'country': 'US', 'state': 'NY', 'display_address': ['102 Norfolk St', 'New York, NY 10002']}",+12122285098,(212) 228-5098,270.8658224716849,"Really fun, unique and awesome bar.

I definitely visit for the atmosphere but the drinks are cool too. They aren't cheap and are quite small but the tea...","This is one cool speak easy! I love the red velvet curtains, the tea cups in which my $$ cocktails are served in also makes the experience quite fun, though...","So I came back, but for an event called Poetry Brothel (amazing combination of poetry, burlesque, and music that's become one of my favorite monthly events..."
14,TZ4x0TUE5cIjwH2Qk6VJRQ,bembé-brooklyn-2,Bembé,https://s3-media3.fl.yelpcdn.com/bphoto/VNdTMd1ibVb07QumQSxTQg/o.jpg,False,https://www.yelp.com/biz/bemb%C3%A9-brooklyn-2?adjust_creative=xC4n-h7ZGIsND4SXpQ_Fzg&utm_campaign=yelp_api_v3&utm_medium=api_v3_business_search&utm_source=xC4n-h7ZGIsND4SXpQ_Fzg,497,"[{'alias': 'danceclubs', 'title': 'Dance Clubs'}]",4.0,"{'latitude': 40.7110261023422, 'longitude': -73.9651918794702}",[],$$,"{'address1': '81 S 6th St', 'address2': '', 'address3': '', 'city': 'Brooklyn', 'zip_code': '11249', 'country': 'US', 'state': 'NY', 'display_address': ['81 S 6th St', 'Brooklyn, NY 11249']}",+17183875389,(718) 387-5389,1824.2887486470845,What's not to love about Bembe? On a Tuesday night it's packed and everyone is dancing. With a mix of music from soca to reggaeton and African it's the...,"Hole in the way joint. Music was bumping when I went, might have been reggae night when I stepped in. A nice setup inside. Many comfortable couches,...","Great music but tiny space. 
I felt claustrophobic at some point.  I wish they had bigger space and more air."
15,WFfsu07M-XtVAcUebtpUdA,et-al-new-york-3,et al.,https://s3-media3.fl.yelpcdn.com/bphoto/61KrNsvJVfmWSwX5u80oXg/o.jpg,False,https://www.yelp.com/biz/et-al-new-york-3?adjust_creative=xC4n-h7ZGIsND4SXpQ_Fzg&utm_campaign=yelp_api_v3&utm_medium=api_v3_business_search&utm_source=xC4n-h7ZGIsND4SXpQ_Fzg,23,"[{'alias': 'lounges', 'title': 'Lounges'}]",4.0,"{'latitude': 40.72195, 'longitude': -73.99208}",[],$$$$,"{'address1': '191 Chrystie St', 'address2': None, 'address3': '', 'city': 'New York', 'zip_code': '10002', 'country': 'US', 'state': 'NY', 'display_address': ['191 Chrystie St', 'New York, NY 10002']}",+19173416856,(917) 341-6856,836.211133979927,"Suh-WEET venue.  Went there last night for Halloween and the costumes, music, and refreshment could not have been more on point.  Bar was a little...",Came here on a Saturday night for a friend's birthday party. Showed up around midnight and there was no line. It was pretty packed inside and the DJ music...,"Amazing! Great energy _ good crowd and drinks.
The door is tight but it is worth it.  The DJ's continue to bring it, never disappointed!"
16,w_9Z79bTe2_cmbbohrWPHQ,skin-contact-new-york,Skin Contact,https://s3-media2.fl.yelpcdn.com/bphoto/LMI1ye7P6CllZACut5eefQ/o.jpg,False,https://www.yelp.com/biz/skin-contact-new-york?adjust_creative=xC4n-h7ZGIsND4SXpQ_Fzg&utm_campaign=yelp_api_v3&utm_medium=api_v3_business_search&utm_source=xC4n-h7ZGIsND4SXpQ_Fzg,5,"[{'alias': 'wine_bars', 'title': 'Wine Bars'}]",5.0,"{'latitude': 40.717668, 'longitude': -73.990224}",[],,"{'address1': '76 Orchard St', 'address2': '', 'address3': None, 'city': 'New York', 'zip_code': '10002', 'country': 'US', 'state': 'NY', 'display_address': ['76 Orchard St', 'New York, NY 10002']}",+12129339398,(212) 933-9398,411.64967942348903,"This place is so cute, wine selection next level, the bar tenders are all so lovely and the lighting on point.  Really nice spot for a date!

Definitely...",Absolutely fantastic! Natural wine and a great vibe. They know their wine and would love to help you explore it.,"When the kindest, warmest and most knowledgeable people in the industry get together to start a new innovative concept, greatness is created!  If you're..."
17,LppKzOZ2ZGmD7GrP5JAh5Q,the-box-new-york,The Box,https://s3-media2.fl.yelpcdn.com/bphoto/cYg69vsPWJJgrhVdb4KjRw/o.jpg,False,https://www.yelp.com/biz/the-box-new-york?adjust_creative=xC4n-h7ZGIsND4SXpQ_Fzg&utm_campaign=yelp_api_v3&utm_medium=api_v3_business_search&utm_source=xC4n-h7ZGIsND4SXpQ_Fzg,402,"[{'alias': 'cocktailbars', 'title': 'Cocktail Bars'}]",3.0,"{'latitude': 40.72189, 'longitude': -73.99228}",[],$$$$,"{'address1': '189 Chrystie St', 'address2': '', 'address3': '', 'city': 'New York', 'zip_code': '10002', 'country': 'US', 'state': 'NY', 'display_address': ['189 Chrystie St', 'New York, NY 10002']}",+12129829301,(212) 982-9301,816.7592910355179,"We attended a ticketed event here (A Night of Opera at The Box), and it was a bit of a disappointment.  The space itself is great; it feels old and storied...","These people.......lol, when they think they have the power....
The doorman.... lol
They don't know....
Ugh...  enough!

Just don't go. I am who I am and I...","We went there just because our friends wanted to go as it was recommended by one of his wealthy client.
I read that it is very difficult to get in there..."
18,oopgHvduXbtgwNRmybEhgQ,sons-of-essex-new-york,Sons of Essex,https://s3-media4.fl.yelpcdn.com/bphoto/t4Yl0_baziAeMyFtMN0OQA/o.jpg,False,https://www.yelp.com/biz/sons-of-essex-new-york?adjust_creative=xC4n-h7ZGIsND4SXpQ_Fzg&utm_campaign=yelp_api_v3&utm_medium=api_v3_business_search&utm_source=xC4n-h7ZGIsND4SXpQ_Fzg,1240,"[{'alias': 'newamerican', 'title': 'American (New)'}, {'alias': 'bars', 'title': 'Bars'}, {'alias': 'breakfast_brunch', 'title': 'Breakfast & Brunch'}]",4.0,"{'latitude': 40.720315, 'longitude': -73.987774}","['delivery', 'pickup']",$$,"{'address1': '133 Essex St', 'address2': '', 'address3': '', 'city': 'New York', 'zip_code': '10002', 'country': 'US', 'state': 'NY', 'display_address': ['133 Essex St', 'New York, NY 10002']}",+12126747100,(212) 674-7100,451.75748141241,"This place is so bomb!!

I came here for the 1st time in 2016 for a Fathers Day brunch, and the food was amazing! 

The music played some dope hip hop/old...","We were there for a birthday brunch a few Saturdays ago.  We weren't prepared for, nor expecting it to be as LOUD as it was at 2PM.  We couldn't have a...",Great brunch playing some good r&b music. I got the special (shrimp tacos) and they were seasoned very nicely. My boyfriend got the burger and loved it. The...
19,w6Bk296A8rawMcezB7fU8g,boys-dont-cry-new-york-2,Boys Don't Cry,https://s3-media2.fl.yelpcdn.com/bphoto/LdRfyPavM_dG8ejavsMSPw/o.jpg,False,https://www.yelp.com/biz/boys-dont-cry-new-york-2?adjust_creative=xC4n-h7ZGIsND4SXpQ_Fzg&utm_campaign=yelp_api_v3&utm_medium=api_v3_business_search&utm_source=xC4n-h7ZGIsND4SXpQ_Fzg,49,"[{'alias': 'bars', 'title': 'Bars'}]",4.5,"{'latitude': 40.71534, 'longitude': -73.9914}","['delivery', 'pickup']",$$,"{'address1': '22 Orchard St', 'address2': '', 'address3': None, 'city': 'New York', 'zip_code': '10002', 'country': 'US', 'state': 'NY', 'display_address': ['22 Orchard St', 'New York, NY 10002']}",,,516.4138237022551,"Picture this: you've just around in NY, it's late, freezing rain coming down, your starving, and need a drink. What did I want to do? Cry. Did I? No....","After getting into New York pretty late around 11ish, we were all hungry and just trying to find a place near our hotel for that NY pizza. We found Scarr's...","Boys don't cry is cute for an evening with your friends, partner, or dog. Bar food is available but there isn't a large variety. We had the Mac and cheese..."
20,H8mnryiCI02N00g9vuFDLg,the-library-new-york,The Library,https://s3-media3.fl.yelpcdn.com/bphoto/a95NgrsukXWY47GTJEFrqQ/o.jpg,False,https://www.yelp.com/biz/the-library-new-york?adjust_creative=xC4n-h7ZGIsND4SXpQ_Fzg&utm_campaign=yelp_api_v3&utm_medium=api_v3_business_search&utm_source=xC4n-h7ZGIsND4SXpQ_Fzg,405,"[{'alias': 'divebars', 'title': 'Dive Bars'}]",3.5,"{'latitude': 40.7226142883301, 'longitude': -73.9863433837891}",[],$,"{'address1': '7 Ave A', 'address2': '', 'address3': '', 'city': 'New York', 'zip_code': '10009', 'country': 'US', 'state': 'NY', 'display_address': ['7 Ave A', 'New York, NY 10009']}",+12123751352,(212) 375-1352,670.696673240843,"Cool dive bar that provides everything you would imagine in such a place. Laid back vibe, grungy, local mixed with some tourists as well. Cheap booze which...",Had the opportunity to visit The Library after a friend suggested it as a casual dive bar in LES that's good to hang out at. I met my friend there for...,"We came here because it was dog friendly.

I'm gonna be honest and say I wasn't impressed with this place, the service was definitely geared more towards..."
