,id,alias,name,image_url,is_closed,url,review_count,categories,rating,coordinates,transactions,price,location,phone,display_phone,distance,rev1,rev2,rev3
0,BPrpZ4bfwq_ohGK8nCFjpg,bamcafe-brooklyn-2,BAMCafe,https://s3-media3.fl.yelpcdn.com/bphoto/7lglWKW7BfLjLlYzO7pdyg/o.jpg,False,https://www.yelp.com/biz/bamcafe-brooklyn-2?adjust_creative=xC4n-h7ZGIsND4SXpQ_Fzg&utm_campaign=yelp_api_v3&utm_medium=api_v3_business_search&utm_source=xC4n-h7ZGIsND4SXpQ_Fzg,86,"[{'alias': 'musicvenues', 'title': 'Music Venues'}, {'alias': 'venues', 'title': 'Venues & Event Spaces'}, {'alias': 'dinnertheater', 'title': 'Dinner Theater'}]",4.0,"{'latitude': 40.68673, 'longitude': -73.97775}",[],$$,"{'address1': '30 Lafayette Ave', 'address2': ""BAM's Building Lepercq Space at Peter Jay Sharp Building"", 'address3': '', 'city': 'Brooklyn', 'zip_code': '11217', 'country': 'US', 'state': 'NY', 'display_address': ['30 Lafayette Ave', ""BAM's Building Lepercq Space at Peter Jay Sharp Building"", 'Brooklyn, NY 11217']}",+17186237811,(718) 623-7811,4199.470538321078,"Very nice! Spacious. Great bar, dance floor, and seating area. A variety of dj's and great sound system. I definitely recommend!","BAMCafe is super cool....Actually, I just really like coming to BAM (movie theater, auditoriums to see live shows etc.) and their cafe is just another one...","I've been to BAM several times for movies, concerts and shows, but never made it to the BAM Cafe. Finally had a reason to go for a free BAMCafe Live..."
1,s-pzdE7ZE5X1WQ2fDaqJgg,tatanka-tincture-bar-brooklyn,Tatanka Tincture Bar,https://s3-media1.fl.yelpcdn.com/bphoto/T9IEHONnSg-HR7IxMU0kCQ/o.jpg,False,https://www.yelp.com/biz/tatanka-tincture-bar-brooklyn?adjust_creative=xC4n-h7ZGIsND4SXpQ_Fzg&utm_campaign=yelp_api_v3&utm_medium=api_v3_business_search&utm_source=xC4n-h7ZGIsND4SXpQ_Fzg,4,"[{'alias': 'bars', 'title': 'Bars'}, {'alias': 'coffee', 'title': 'Coffee & Tea'}, {'alias': 'newamerican', 'title': 'American (New)'}]",5.0,"{'latitude': 40.68146, 'longitude': -73.95838}","['pickup', 'delivery']",,"{'address1': '557 Classon Ave', 'address2': None, 'address3': '', 'city': 'Brooklyn', 'zip_code': '11238', 'country': 'US', 'state': 'NY', 'display_address': ['557 Classon Ave', 'Brooklyn, NY 11238']}",+17185006217,(718) 500-6217,2808.505230938777,"Okay so I wasn't exactly sure what a tincture was before I came in here, but apparently it's the healthiest thing you can do to your food. I was starving...","Damn, amazing food, super nice people. I wish the rest of our city could be as kind and offer good food. I'm patronizing this place on the reg. So happy it...","Great drinks, tasty food, great company! A gem of the neighborhood. Check it out before Tatanka's blows up!"
2,8lHTKVJyiK9V8WiJq9-khQ,midwood-flats-prospect-lefferts-gardens,Midwood Flats,https://s3-media3.fl.yelpcdn.com/bphoto/EJAbvyuGRqILT1e4A5-_0Q/o.jpg,False,https://www.yelp.com/biz/midwood-flats-prospect-lefferts-gardens?adjust_creative=xC4n-h7ZGIsND4SXpQ_Fzg&utm_campaign=yelp_api_v3&utm_medium=api_v3_business_search&utm_source=xC4n-h7ZGIsND4SXpQ_Fzg,268,"[{'alias': 'cocktailbars', 'title': 'Cocktail Bars'}, {'alias': 'pubs', 'title': 'Pubs'}, {'alias': 'bartenders', 'title': 'Bartenders'}]",4.0,"{'latitude': 40.6596512, 'longitude': -73.9603844}","['pickup', 'delivery']",$$,"{'address1': '577 Flatbush Ave', 'address2': '', 'address3': '', 'city': 'Prospect Lefferts Gardens', 'zip_code': '11225', 'country': 'US', 'state': 'NY', 'display_address': ['577 Flatbush Ave', 'Prospect Lefferts Gardens, NY 11225']}",+17184844466,(718) 484-4466,4557.574403280108,"I've never been here, but it's definitely on my list. The reason I write this review is to say thank you to Midwood Flats for remaining open to feed our...","Hipsterish locals joint with a woodsy look and good tunes being played.

Dropped in here for a bite and celebratory beer after a race in Prospect Park not...","It was great until....... a roach crawled across the bar where we were sitting

The drinks were great. I had the pretzel with the dips, that was really..."
3,e_hmhxJbpSPAGEfim86PVQ,gentle-perch-brooklyn,Gentle Perch,https://s3-media1.fl.yelpcdn.com/bphoto/6NjW0WpkopEaJydy_MqnYw/o.jpg,False,https://www.yelp.com/biz/gentle-perch-brooklyn?adjust_creative=xC4n-h7ZGIsND4SXpQ_Fzg&utm_campaign=yelp_api_v3&utm_medium=api_v3_business_search&utm_source=xC4n-h7ZGIsND4SXpQ_Fzg,67,"[{'alias': 'korean', 'title': 'Korean'}, {'alias': 'cocktailbars', 'title': 'Cocktail Bars'}, {'alias': 'asianfusion', 'title': 'Asian Fusion'}]",4.5,"{'latitude': 40.705106, 'longitude': -73.942587}","['pickup', 'delivery']",$$,"{'address1': '112 Graham Ave', 'address2': '', 'address3': None, 'city': 'Brooklyn', 'zip_code': '11206', 'country': 'US', 'state': 'NY', 'display_address': ['112 Graham Ave', 'Brooklyn, NY 11206']}",+19292980041,(929) 298-0041,1814.9303524905451,Really amazing! Food and cocktails. Really interested in the meal program they are offering mid pandemic. I wish I had checked them out earlier because I...,I've started going to Gentle Perch for about a week now. I like the Brunch menu but favor the Dinner menu more. I highly suggest the Hungover Seoul and a...,"Ordered the ""Hungover Seoul"" and thoroughly enjoyed it. It's basically a Korean take on ramen. 
Also loved the macaroni salad and kimchi that was served as..."
4,IIcKE40roY_GYSMS7Io4Nw,bushwick-country-club-brooklyn,Bushwick Country Club,https://s3-media1.fl.yelpcdn.com/bphoto/mOhzFrj2KyyQ0I3li6NbOA/o.jpg,False,https://www.yelp.com/biz/bushwick-country-club-brooklyn?adjust_creative=xC4n-h7ZGIsND4SXpQ_Fzg&utm_campaign=yelp_api_v3&utm_medium=api_v3_business_search&utm_source=xC4n-h7ZGIsND4SXpQ_Fzg,172,"[{'alias': 'bars', 'title': 'Bars'}, {'alias': 'mini_golf', 'title': 'Mini Golf'}]",4.0,"{'latitude': 40.711063, 'longitude': -73.947418}",[],$,"{'address1': '618 Grand St', 'address2': None, 'address3': '', 'city': 'Brooklyn', 'zip_code': '11211', 'country': 'US', 'state': 'NY', 'display_address': ['618 Grand St', 'Brooklyn, NY 11211']}",+17183882114,(718) 388-2114,2589.055021927438,Great dive bar. Awesome bartender John holding down the fort. One man show and he did an incredible job. Came here for my friend's 31st birthday and we had...,I think I've been meaning to come here for the better part of a decade. Shows how long this place and myself have stuck around. But I never really had an...,"What a fun, cheap mess! The ""Country Club"" part is definitely ironic.

My friend dragged me to Bushwick Country Club on a Sunday night during my visit to..."
5,v4d2TBqxMmNzWNvShkvRrA,freehold-brooklyn,FREEHOLD,https://s3-media2.fl.yelpcdn.com/bphoto/ft3wwWxNUofq_0T3e2t1Jg/o.jpg,False,https://www.yelp.com/biz/freehold-brooklyn?adjust_creative=xC4n-h7ZGIsND4SXpQ_Fzg&utm_campaign=yelp_api_v3&utm_medium=api_v3_business_search&utm_source=xC4n-h7ZGIsND4SXpQ_Fzg,517,"[{'alias': 'coffee', 'title': 'Coffee & Tea'}, {'alias': 'bars', 'title': 'Bars'}, {'alias': 'newamerican', 'title': 'American (New)'}]",3.5,"{'latitude': 40.7136054, 'longitude': -73.965905}","['pickup', 'restaurant_reservation', 'delivery']",$$,"{'address1': '45 S 3rd St', 'address2': '', 'address3': '', 'city': 'Brooklyn', 'zip_code': '11249', 'country': 'US', 'state': 'NY', 'display_address': ['45 S 3rd St', 'Brooklyn, NY 11249']}",+17183887591,(718) 388-7591,3911.4903196449477,"I recently came in here after looking up bars with outdoor space as it was such a nice day outside- we were not disappointed!

The space itself is quite...",I love this local spot. It's always a party at Freehold. I especially love the happy hour menu prices. What could possibly prevent you from enjoying an...,"Came here when everything else in Williamsburg was overpacked for Sunday brunch, predictably. There was plenty of seating here, but now I know why - service..."
6,OrDUF3q9WNttIslLXKx0Aw,concrete-brooklyn,Concrete,https://s3-media1.fl.yelpcdn.com/bphoto/sZjqZBfK_ZYWFzd0bCWGbg/o.jpg,False,https://www.yelp.com/biz/concrete-brooklyn?adjust_creative=xC4n-h7ZGIsND4SXpQ_Fzg&utm_campaign=yelp_api_v3&utm_medium=api_v3_business_search&utm_source=xC4n-h7ZGIsND4SXpQ_Fzg,92,"[{'alias': 'bars', 'title': 'Bars'}, {'alias': 'breakfast_brunch', 'title': 'Breakfast & Brunch'}, {'alias': 'sicilian', 'title': 'Sicilian'}]",4.5,"{'latitude': 40.6977, 'longitude': -73.9368}","['pickup', 'delivery']",$$,"{'address1': '906 Broadway', 'address2': None, 'address3': '', 'city': 'Brooklyn', 'zip_code': '11206', 'country': 'US', 'state': 'NY', 'display_address': ['906 Broadway', 'Brooklyn, NY 11206']}",+19179668440,(917) 966-8440,892.0103854943316,"I love Concrete. This restaurant is a gem. Excellent service, delicious food and fun drinks. We've dined at Concrete a handful of times and it is one of...",I have been wanting to go here for my boyfriend because he can't have gluten. we then got sick from the food the next day and the manager called me but...,"I have been for brunch and thoroughly enjoyed it, however I did a take order for dinner and it left a lot to be desired. We ordered the burger and chicken..."
7,RbMC9zD11aB3kgrXi6O3BQ,the-narrows-brooklyn,The Narrows,https://s3-media4.fl.yelpcdn.com/bphoto/qftb7B82M2fWp6zm270BaA/o.jpg,False,https://www.yelp.com/biz/the-narrows-brooklyn?adjust_creative=xC4n-h7ZGIsND4SXpQ_Fzg&utm_campaign=yelp_api_v3&utm_medium=api_v3_business_search&utm_source=xC4n-h7ZGIsND4SXpQ_Fzg,178,"[{'alias': 'bars', 'title': 'Bars'}, {'alias': 'newamerican', 'title': 'American (New)'}]",4.0,"{'latitude': 40.704114, 'longitude': -73.930878}",[],$$,"{'address1': '1037 Flushing Ave', 'address2': '', 'address3': '', 'city': 'Brooklyn', 'zip_code': '11237', 'country': 'US', 'state': 'NY', 'display_address': ['1037 Flushing Ave', 'Brooklyn, NY 11237']}",,,1279.8157566280236,"Keith & Joe are very friendly and professional guys! 
I was enjoyed my evening because them .

Great cocktails! 
Great atmosphere! 
Everything you need for...",Went on a Saturday early evening around 5:30pm. Not at all crowded but there were quiet a few people there at the bar. chill place to hang out with a drink....,The kitchen closes at 12. Cute bar with a cozy vibe if you can hear over some the bushwick bro's lol. Friendly bartender with prompt service . Interior is...
8,vDv-07ezvJZz4ZwazEa7JQ,q-tavern-brooklyn,Q Tavern,https://s3-media3.fl.yelpcdn.com/bphoto/HatOri6CVQBcQgfooloo6A/o.jpg,False,https://www.yelp.com/biz/q-tavern-brooklyn?adjust_creative=xC4n-h7ZGIsND4SXpQ_Fzg&utm_campaign=yelp_api_v3&utm_medium=api_v3_business_search&utm_source=xC4n-h7ZGIsND4SXpQ_Fzg,4,"[{'alias': 'bars', 'title': 'Bars'}]",4.0,"{'latitude': 40.67124, 'longitude': -73.95023}",[],$,"{'address1': '761 Nostrand Ave', 'address2': '', 'address3': '', 'city': 'Brooklyn', 'zip_code': '11216', 'country': 'US', 'state': 'NY', 'display_address': ['761 Nostrand Ave', 'Brooklyn, NY 11216']}",,,3004.6241354834738,"I guess I came in at the wrong time... But I went in on a Saturday at around 6:40 pm, however I didn't experience the party atmosphere that everyone seems...",Q's Tavern gives off that old-school laid-back vibe with cool as patrons. Went in for some karaoke with a friend. We had a drink or two. It was lit! When...,A-ok! I walked in with two friends when the place was totally dead over post-Thanksgiving weekend and they got out a laptop and put some tunes on. Friendly...
9,zHqDuMznom7CLp2lqV8q0g,forrest-point-brooklyn,Forrest Point,https://s3-media1.fl.yelpcdn.com/bphoto/1G9M426OYh5DxRwFiRumUw/o.jpg,False,https://www.yelp.com/biz/forrest-point-brooklyn?adjust_creative=xC4n-h7ZGIsND4SXpQ_Fzg&utm_campaign=yelp_api_v3&utm_medium=api_v3_business_search&utm_source=xC4n-h7ZGIsND4SXpQ_Fzg,358,"[{'alias': 'bars', 'title': 'Bars'}, {'alias': 'sandwiches', 'title': 'Sandwiches'}, {'alias': 'newamerican', 'title': 'American (New)'}]",4.0,"{'latitude': 40.70319, 'longitude': -73.93229}","['delivery', 'pickup']",$$,"{'address1': '970 Flushing Ave', 'address2': '', 'address3': '', 'city': 'Brooklyn', 'zip_code': '11206', 'country': 'US', 'state': 'NY', 'display_address': ['970 Flushing Ave', 'Brooklyn, NY 11206']}",+17183662742,(718) 366-2742,1201.4309145476561,We stopped here during the week based on a suggestion from a coworker. It was a really nice day out so we wanted to sit outside. Their outdoor seati area...,Came for a great brunch which was rudely ended with the black female manager who's name I didn't get assuming we had to much to drink. Having 2 mimosas in a...,"This place has a really good vibe and some tasty food and drinks. Casual and relaxed enough for all types of gatherings, friendly or intimate. The menu has..."
10,tD2QlsEgXVH9lB-6snmcgQ,clydes-caribbean-brooklyn,Clyde's Caribbean,https://s3-media2.fl.yelpcdn.com/bphoto/8rjIfEl2ZGXnk6UyJaHBkA/o.jpg,False,https://www.yelp.com/biz/clydes-caribbean-brooklyn?adjust_creative=xC4n-h7ZGIsND4SXpQ_Fzg&utm_campaign=yelp_api_v3&utm_medium=api_v3_business_search&utm_source=xC4n-h7ZGIsND4SXpQ_Fzg,8,"[{'alias': 'tikibars', 'title': 'Tiki Bars'}, {'alias': 'caribbean', 'title': 'Caribbean'}]",3.5,"{'latitude': 40.717883, 'longitude': -73.95677}",[],,"{'address1': '178 N 8th St', 'address2': '', 'address3': None, 'city': 'Brooklyn', 'zip_code': '11211', 'country': 'US', 'state': 'NY', 'display_address': ['178 N 8th St', 'Brooklyn, NY 11211']}",+19292763528,(929) 276-3528,3674.2311509054307,"Okay let's have a serious conversation. 


Let's talk about how Pearls has successfully marketed this place as its own separate entity.

Then let's talk...","This is a really cute Trini spot in Williamsburg! It's the lounge portion of their adjacent sister restaurant, Pearl's. The space is well-decorated where...","- Awesome spot
- Great date idea
- Music is on point
- Bartender was great
- They let you order food from Pearl's
- only problem is, it closes so early"
11,3Uzy1yp1SXq3FG-i2hEcyA,luckydog-brooklyn,Luckydog,https://s3-media3.fl.yelpcdn.com/bphoto/1pM2Zvmr_MTb-0pHsN68aw/o.jpg,False,https://www.yelp.com/biz/luckydog-brooklyn?adjust_creative=xC4n-h7ZGIsND4SXpQ_Fzg&utm_campaign=yelp_api_v3&utm_medium=api_v3_business_search&utm_source=xC4n-h7ZGIsND4SXpQ_Fzg,300,"[{'alias': 'bars', 'title': 'Bars'}]",4.0,"{'latitude': 40.71348, 'longitude': -73.96166}",[],$,"{'address1': '303 Bedford Ave', 'address2': '', 'address3': '', 'city': 'Brooklyn', 'zip_code': '11211', 'country': 'US', 'state': 'NY', 'display_address': ['303 Bedford Ave', 'Brooklyn, NY 11211']}",+13472944971,(347) 294-4971,3622.1783595964253,"Well any place you can bring dogs and hang out outside, I'm in. The drinks are cheap, the decor is divey, and the bartenders are great. I'm always on the...",Fun and dog friendly bar. If you don't like dogs then don't come here. Luckydog is one of the best bars in Williamsburg. Happy hour is a good deal. They let...,"When my friend call me to meet for our regular friend time, I had to come see her with my dog since I had him with me. She said, oh let's go to Lucky Dog,..."
12,3PxZTVc4bJmZS5wAh_fdIw,cafe-erzulie-brooklyn,Cafe Erzulie,https://s3-media4.fl.yelpcdn.com/bphoto/9dQUzJRFAKlpD8c8-Yx9RA/o.jpg,False,https://www.yelp.com/biz/cafe-erzulie-brooklyn?adjust_creative=xC4n-h7ZGIsND4SXpQ_Fzg&utm_campaign=yelp_api_v3&utm_medium=api_v3_business_search&utm_source=xC4n-h7ZGIsND4SXpQ_Fzg,61,"[{'alias': 'breakfast_brunch', 'title': 'Breakfast & Brunch'}, {'alias': 'coffee', 'title': 'Coffee & Tea'}, {'alias': 'cocktailbars', 'title': 'Cocktail Bars'}]",4.0,"{'latitude': 40.6979, 'longitude': -73.93716}",[],$,"{'address1': '894 Broadway', 'address2': '', 'address3': None, 'city': 'Brooklyn', 'zip_code': '11206', 'country': 'US', 'state': 'NY', 'display_address': ['894 Broadway', 'Brooklyn, NY 11206']}",+17184503255,(718) 450-3255,926.1169524378607,My friend and I were visiting Brooklyn and I happened to stumble into this little gem in Brooklyn. Be forewarned that there is a brilliant plant shop in the...,"This place might be good after noon or for night, but my review is for anyone who is looking for quick nice comfy breakfast.

I have a pet peeve, and it's...","Popped in on a weekday to get some work done and I was disappointed with this space. First, it was surprisingly loud for a Tuesday afternoon - not ideal..."
13,ohyBaY81Lwy49MffC7U7Zg,brooklyn-nights-brooklyn,Brooklyn Nights,https://s3-media2.fl.yelpcdn.com/bphoto/D8c2A3emUwLpJEO6mxt0zA/o.jpg,False,https://www.yelp.com/biz/brooklyn-nights-brooklyn?adjust_creative=xC4n-h7ZGIsND4SXpQ_Fzg&utm_campaign=yelp_api_v3&utm_medium=api_v3_business_search&utm_source=xC4n-h7ZGIsND4SXpQ_Fzg,28,"[{'alias': 'bars', 'title': 'Bars'}, {'alias': 'newamerican', 'title': 'American (New)'}]",2.5,"{'latitude': 40.6909255981445, 'longitude': -73.9570770263672}","['pickup', 'delivery']",$$,"{'address1': '497 Dekalb Ave', 'address2': '', 'address3': '', 'city': 'Brooklyn', 'zip_code': '11205', 'country': 'US', 'state': 'NY', 'display_address': ['497 Dekalb Ave', 'Brooklyn, NY 11205']}",+13472408988,(347) 240-8988,2409.9987692277023,"I finally found a bar that stole my heart like how Black Betty's used to in Williamsburg.. 

Came here for the first time roughly 3-4 months ago. The...","Make sure you wear a bullet proof vest at this establishment. Very ratchet, extremely ghetto crowd. They should try to implement a dress code to prevent the...","This was my very first time at the venue. I had read the previous  reviews so I had a good idea of what I was getting into. 

A friend was doing an artist..."
14,-5oK5IO9aPrAKuTf0kKpDg,lemons-new-york-2,Lemon's,https://s3-media1.fl.yelpcdn.com/bphoto/paq18QRqvNXiLBLEoZYTcg/o.jpg,False,https://www.yelp.com/biz/lemons-new-york-2?adjust_creative=xC4n-h7ZGIsND4SXpQ_Fzg&utm_campaign=yelp_api_v3&utm_medium=api_v3_business_search&utm_source=xC4n-h7ZGIsND4SXpQ_Fzg,25,"[{'alias': 'bars', 'title': 'Bars'}, {'alias': 'breakfast_brunch', 'title': 'Breakfast & Brunch'}]",4.0,"{'latitude': 40.721948, 'longitude': -73.958074}",[],,"{'address1': '80 Wythe Ave', 'address2': None, 'address3': '', 'city': 'New York', 'zip_code': '11249', 'country': 'US', 'state': 'NY', 'display_address': ['80 Wythe Ave', 'New York, NY 11249']}",+17184608006,(718) 460-8006,4077.3424698806857,What a beautiful space! Tall ceilings with full-length/width windows with a majestic view of Manhattan and beyond. The space itself is millennial and...,"Lemon's was the perfect spot for a chill Sunday, conveniently located right across from Brooklyn Bowl and Brooklyn Brewing. A restaurant with a rooftop in...","My friends and I really wanted to go to a rooftop bar in Williamsburg, and we came here after being deterred by two other bars that either had lines that..."
15,fX15Hx2YjiZx0Ut4eBHPKQ,el-manaba-lounge-ridgewood,El Manaba Lounge,https://s3-media4.fl.yelpcdn.com/bphoto/sC-FdO0xCF9P1_q6QC3iwg/o.jpg,False,https://www.yelp.com/biz/el-manaba-lounge-ridgewood?adjust_creative=xC4n-h7ZGIsND4SXpQ_Fzg&utm_campaign=yelp_api_v3&utm_medium=api_v3_business_search&utm_source=xC4n-h7ZGIsND4SXpQ_Fzg,18,"[{'alias': 'bars', 'title': 'Bars'}, {'alias': 'spanish', 'title': 'Spanish'}]",2.5,"{'latitude': 40.700889, 'longitude': -73.909249}",['pickup'],$$,"{'address1': '341 St  Nicholas Ave', 'address2': '', 'address3': '', 'city': 'Ridgewood', 'zip_code': '11385', 'country': 'US', 'state': 'NY', 'display_address': ['341 St  Nicholas Ave', 'Ridgewood, NY 11385']}",+13472277506,(347) 227-7506,1818.883879841757,"First time trying this place and  I'm so disappointed:
1- I could give this place -5 stars but there's not an option..First of all  the worse customer...",Good food and service Was good too. Nice music and great ambience. Food portions were just right and clean place .,Stopped here for lunch with a sales rep I was working with for lunch. The food was good and the ambience is a bit meh. The only negative I can mention is...
16,-SYHh9DWvYuBZxkA4gfzHg,calabrijes-margaritas-and-tacos-brooklyn,Calabrije's Margaritas & Tacos,https://s3-media4.fl.yelpcdn.com/bphoto/2WCNNrLEVxfEOgQcDKVFrA/o.jpg,False,https://www.yelp.com/biz/calabrijes-margaritas-and-tacos-brooklyn?adjust_creative=xC4n-h7ZGIsND4SXpQ_Fzg&utm_campaign=yelp_api_v3&utm_medium=api_v3_business_search&utm_source=xC4n-h7ZGIsND4SXpQ_Fzg,93,"[{'alias': 'tacos', 'title': 'Tacos'}, {'alias': 'cocktailbars', 'title': 'Cocktail Bars'}]",4.0,"{'latitude': 40.7055429619569, 'longitude': -73.9225539192783}","['pickup', 'delivery']",$$,"{'address1': '234 Starr St', 'address2': '', 'address3': None, 'city': 'Brooklyn', 'zip_code': '11237', 'country': 'US', 'state': 'NY', 'display_address': ['234 Starr St', 'Brooklyn, NY 11237']}",+17184842110,(718) 484-2110,1510.5254192450159,"Amazing margaritas place full of different flavors, small kitchen but food is pretty good and tasty",Went on a thursday note despite the pandemic and it was really cool. We pulled right up to a parking spot right out front. The place wasn't crowded altho...,"They have a pretty good 2 for 1deal on (Taco) Tuesdays, so you get 2 tacos for $4. Unfortunately they are tiny, but quite delicious. 

Great deals on happy..."
17,DKn7z4H9MzmqRlSeftIFag,brown-sugar-club-brooklyn-2,Brown Sugar Club,https://s3-media3.fl.yelpcdn.com/bphoto/CAeRt7q7LeQ5sH0mtfWYsw/o.jpg,False,https://www.yelp.com/biz/brown-sugar-club-brooklyn-2?adjust_creative=xC4n-h7ZGIsND4SXpQ_Fzg&utm_campaign=yelp_api_v3&utm_medium=api_v3_business_search&utm_source=xC4n-h7ZGIsND4SXpQ_Fzg,18,"[{'alias': 'danceclubs', 'title': 'Dance Clubs'}, {'alias': 'tradamerican', 'title': 'American (Traditional)'}, {'alias': 'venues', 'title': 'Venues & Event Spaces'}]",2.5,"{'latitude': 40.68225, 'longitude': -73.93776}",['pickup'],$,"{'address1': '433 Marcus Garvey Blvd', 'address2': '', 'address3': '', 'city': 'Brooklyn', 'zip_code': '11216', 'country': 'US', 'state': 'NY', 'display_address': ['433 Marcus Garvey Blvd', 'Brooklyn, NY 11216']}",+17185522705,(718) 552-2705,1403.2475330893892,"This is the worst venue to rent for an occassion.  Please do not ever give this place your business.  You will be disappointed like I was.

Although the...",I came here for the birthday party of my friend's aunt. I will admit that the music was good and it was nice to walk in without there being a required...,The AC don't work it's a shame people pay so much money for a baby shower and there's no AC and it's 87 degrees outside. The whole baby shower is outside
18,uMZam4F-baqSokjy7pw5ZA,rise-radio-brooklyn,Rise Radio,https://s3-media2.fl.yelpcdn.com/bphoto/hVg8wASkz8ZaKfHbm8Q4yg/o.jpg,False,https://www.yelp.com/biz/rise-radio-brooklyn?adjust_creative=xC4n-h7ZGIsND4SXpQ_Fzg&utm_campaign=yelp_api_v3&utm_medium=api_v3_business_search&utm_source=xC4n-h7ZGIsND4SXpQ_Fzg,4,"[{'alias': 'cafes', 'title': 'Cafes'}, {'alias': 'musicvenues', 'title': 'Music Venues'}, {'alias': 'pubs', 'title': 'Pubs'}]",5.0,"{'latitude': 40.7034462146096, 'longitude': -73.9427331010331}",[],,"{'address1': '57 Graham Ave', 'address2': '', 'address3': None, 'city': 'Brooklyn', 'zip_code': '11206', 'country': 'US', 'state': 'NY', 'display_address': ['57 Graham Ave', 'Brooklyn, NY 11206']}",,,1687.3895680552052,Excellent place all around. Perfect space to host an event or even just come for a cup of coffee. This is the home for creatives and the people that work...,After years of running a dj centered podcast and inter/national fashion stores  the owners decided to establish locally. Right there between Bushwick and...,"This place is 10/10 for staff, coffee, and vibes. The interior is so dope and has a great patio too. It works well for both day and night. Can't wait to go..."
19,B0e6kXT0doU-n6EvMVGzQQ,thai-me-brooklyn,Thai Me,https://s3-media1.fl.yelpcdn.com/bphoto/RWjHOwM54hBnQXV7G_ot-g/o.jpg,False,https://www.yelp.com/biz/thai-me-brooklyn?adjust_creative=xC4n-h7ZGIsND4SXpQ_Fzg&utm_campaign=yelp_api_v3&utm_medium=api_v3_business_search&utm_source=xC4n-h7ZGIsND4SXpQ_Fzg,100,"[{'alias': 'thai', 'title': 'Thai'}, {'alias': 'cocktailbars', 'title': 'Cocktail Bars'}, {'alias': 'asianfusion', 'title': 'Asian Fusion'}]",3.5,"{'latitude': 40.697306, 'longitude': -73.936091}","['pickup', 'delivery']",$$,"{'address1': '918 Broadway', 'address2': None, 'address3': '', 'city': 'Brooklyn', 'zip_code': '11206', 'country': 'US', 'state': 'NY', 'display_address': ['918 Broadway', 'Brooklyn, NY 11206']}",+17189755190,(718) 975-5190,813.7581525322771,"4/5 --TAKE OUT

Ordered dinner from here last night and I was pleasantly surprised at how delicious the food was! Ordered Thai ice tea, which tasted as it...",This is my favorite Thai place in the Broadway Triangle/Bed Stuy/Bushwick border zone. Tried it out recently when it popped up on Google Maps and was...,A diamond in the rough. Amazing authentic food in Brooklyn. Got the tofu appetizer it was amazing. Me and my wife got the pad see you I got peanut sauce on...
20,QrwObD0lKQsrBlDZzgzewA,d-antan-brooklyn,D'Antan,https://s3-media2.fl.yelpcdn.com/bphoto/rUAHaJMu7Xx9fwi-_hRYNw/o.jpg,False,https://www.yelp.com/biz/d-antan-brooklyn?adjust_creative=xC4n-h7ZGIsND4SXpQ_Fzg&utm_campaign=yelp_api_v3&utm_medium=api_v3_business_search&utm_source=xC4n-h7ZGIsND4SXpQ_Fzg,31,"[{'alias': 'italian', 'title': 'Italian'}, {'alias': 'wine_bars', 'title': 'Wine Bars'}]",4.5,"{'latitude': 40.6772982, 'longitude': -73.95882}",[],,"{'address1': '858 Bergen St', 'address2': '', 'address3': None, 'city': 'Brooklyn', 'zip_code': '11238', 'country': 'US', 'state': 'NY', 'display_address': ['858 Bergen St', 'Brooklyn, NY 11238']}",+17184843944,(718) 484-3944,3086.3126903036455,Corona got us stir crazy so we out here in central Brooklyn having dinner out. D'Antan is a very cute Italian spot on the border of crown heights and...,"Man, we almost didn't eat here. Which means we were almost stupid, because we immensely enjoyed our experience here! Really the whole meal was great. It was...",For this to be a new establishment I must say my experience was okay I was not overwhelmed yet I didn't dislike my experience. I went around 5 to this...
