,id,alias,name,image_url,is_closed,url,review_count,categories,rating,coordinates,transactions,price,location,phone,display_phone,distance,rev1,rev2,rev3
43,JV_ExaJu42R0Kk45zSb1Fg,blue-star-a-party-for-girls-who-like-girls-manhattan,Blue Star a Party For Girls Who Like Girls,https://s3-media1.fl.yelpcdn.com/bphoto/1tqwm4fFblTsQDcsLEbZnw/o.jpg,False,https://www.yelp.com/biz/blue-star-a-party-for-girls-who-like-girls-manhattan?adjust_creative=xC4n-h7ZGIsND4SXpQ_Fzg&utm_campaign=yelp_api_v3&utm_medium=api_v3_business_search&utm_source=xC4n-h7ZGIsND4SXpQ_Fzg,1,"[{'alias': 'gaybars', 'title': 'Gay Bars'}]",5.0,"{'latitude': 40.72575, 'longitude': -73.99179}",[],,"{'address1': 'The Bowery Electric', 'address2': '', 'address3': '327 Bowery', 'city': 'Manhattan', 'zip_code': '10003', 'country': 'US', 'state': 'NY', 'display_address': ['The Bowery Electric', '327 Bowery', 'Manhattan, NY 10003']}",+16467191178,(646) 719-1178,1143.5007329933098,I agree with the prior reviews of this very special place. Truly has a great vibe and really hot bi curious ladies all about making that special connection....,No Review,No Review
44,kLEx49YQZZYhtf57YEvQIg,basement-new-york-3,Basement,https://s3-media4.fl.yelpcdn.com/bphoto/36AYyuLu707I3VZCPBaIIg/o.jpg,False,https://www.yelp.com/biz/basement-new-york-3?adjust_creative=xC4n-h7ZGIsND4SXpQ_Fzg&utm_campaign=yelp_api_v3&utm_medium=api_v3_business_search&utm_source=xC4n-h7ZGIsND4SXpQ_Fzg,66,"[{'alias': 'bars', 'title': 'Bars'}]",4.0,"{'latitude': 40.71526, 'longitude': -73.99883}",[],$$,"{'address1': '45 Mott St', 'address2': '', 'address3': None, 'city': 'New York', 'zip_code': '10013', 'country': 'US', 'state': 'NY', 'display_address': ['45 Mott St', 'New York, NY 10013']}",,,1140.4746701150348,"You'd easily walk past if you didn't already know this place existed. Located in a Chinatown basement (hence the name), you'd have to pull an old Coke...","True to its name, this place is in the basement of a building in Chinatown. You'd probably pass by it a hundred times without noticing it. In fact, we had...","During a recent trip to NYC, the beau's friend hit up google and found this spot for us to check out and meet for a drink. 

Yes, the entrance is pretty..."
45,EDFfoyXTsHPBW6mNWLVoig,local-138-new-york,Local 138,https://s3-media2.fl.yelpcdn.com/bphoto/Q0EFiSixjeuORp3uF-yVPg/o.jpg,False,https://www.yelp.com/biz/local-138-new-york?adjust_creative=xC4n-h7ZGIsND4SXpQ_Fzg&utm_campaign=yelp_api_v3&utm_medium=api_v3_business_search&utm_source=xC4n-h7ZGIsND4SXpQ_Fzg,242,"[{'alias': 'bars', 'title': 'Bars'}]",4.0,"{'latitude': 40.72191, 'longitude': -73.98841}",[],$,"{'address1': '181 Orchard St', 'address2': '', 'address3': '', 'city': 'New York', 'zip_code': '10002', 'country': 'US', 'state': 'NY', 'display_address': ['181 Orchard St', 'New York, NY 10002']}",+12124770280,(212) 477-0280,648.0626205216458,Amazing bar and even better bartender. I think her name was Sabina but omg i have been looking for another lovely homey bar where i feel like a regular at...,"So...this is a gentrified dive bar...if you're into that sort of thing. As someone who is apart of the LBTQ community, I've  never felt more confused as to...","If you look up ""dive bar"" in the dictionary (or on Wikipedia for you civilized folk) you may see the 138 make a cameo appearance.

I'm normally not a fan of..."
46,YKfj-CUjgb9xQ1kN_bhNLg,forgtmenot-new-york-2,Forgtmenot,https://s3-media4.fl.yelpcdn.com/bphoto/jrbtdzmbila2bW6t1FV8cw/o.jpg,False,https://www.yelp.com/biz/forgtmenot-new-york-2?adjust_creative=xC4n-h7ZGIsND4SXpQ_Fzg&utm_campaign=yelp_api_v3&utm_medium=api_v3_business_search&utm_source=xC4n-h7ZGIsND4SXpQ_Fzg,178,"[{'alias': 'bars', 'title': 'Bars'}, {'alias': 'tradamerican', 'title': 'American (Traditional)'}]",4.0,"{'latitude': 40.714498871349, 'longitude': -73.9915559401866}","['delivery', 'pickup']",$$,"{'address1': '138 Division St', 'address2': '', 'address3': '', 'city': 'New York', 'zip_code': '10002', 'country': 'US', 'state': 'NY', 'display_address': ['138 Division St', 'New York, NY 10002']}",+16467073195,(646) 707-3195,552.8405016504834,"Love it here! 

Drinks are inexpensive, strong, and delicious. Highly recommend the pickle martini, it's like drinking a really good dill pickle. 

We came...","Came here for a light dinner and a drink on Christmas Day. The outside has no real name on it, though it may have been blocked by a Christmas tree. It looks...","I'm leaving the country soon so my friends thought this would be a good substitute for Kiki's, which had a 45-minute wait on a rainy Thursday night. Luckily..."
47,mqzRBbxys-OCzXK5QCG33Q,la-caverna-new-york,La Caverna,https://s3-media1.fl.yelpcdn.com/bphoto/VCBll_HVnRC1fOyNdCutQw/o.jpg,False,https://www.yelp.com/biz/la-caverna-new-york?adjust_creative=xC4n-h7ZGIsND4SXpQ_Fzg&utm_campaign=yelp_api_v3&utm_medium=api_v3_business_search&utm_source=xC4n-h7ZGIsND4SXpQ_Fzg,523,"[{'alias': 'newamerican', 'title': 'American (New)'}, {'alias': 'lounges', 'title': 'Lounges'}, {'alias': 'tapas', 'title': 'Tapas Bars'}]",3.0,"{'latitude': 40.7198, 'longitude': -73.98714}",[],$$,"{'address1': '122 Rivington St', 'address2': '', 'address3': '', 'city': 'New York', 'zip_code': '10002', 'country': 'US', 'state': 'NY', 'display_address': ['122 Rivington St', 'New York, NY 10002']}",+12124752126,(212) 475-2126,384.47707226402605,"Here's a place that's been here forever from what I gather we randomly decided to stop by since we were in the area. 
We came in & were able to get a table,...",This is the kind of place which should have disappeared forever with the last decade. Went here with a group of about 10 on a friday night. We took separate...,Stumbled across this place by accident and now it's definitely a regular place my boyfriend and I visit. Their happy hour goes till 10pm which is way later...
48,fltwdz8hBRr9kKulx3snoA,the-grand-delancey-new-york-2,The Grand Delancey,https://s3-media1.fl.yelpcdn.com/bphoto/v1eRnmJMLXkWDuRJfAUfSw/o.jpg,False,https://www.yelp.com/biz/the-grand-delancey-new-york-2?adjust_creative=xC4n-h7ZGIsND4SXpQ_Fzg&utm_campaign=yelp_api_v3&utm_medium=api_v3_business_search&utm_source=xC4n-h7ZGIsND4SXpQ_Fzg,30,"[{'alias': 'beerbar', 'title': 'Beer Bar'}, {'alias': 'wine_bars', 'title': 'Wine Bars'}, {'alias': 'cocktailbars', 'title': 'Cocktail Bars'}]",4.0,"{'latitude': 40.71827, 'longitude': -73.98806}",[],$$,"{'address1': '115 Delancey St', 'address2': None, 'address3': '', 'city': 'New York', 'zip_code': '10002', 'country': 'US', 'state': 'NY', 'display_address': ['115 Delancey St', 'New York, NY 10002']}",+13324560130,(332) 456-0130,285.16719563582393,"My new favorite bar!! 

The service here is awesome! The bartender I've had twice was extremely knowledgeable about the different beers on tap and was very...",Into this new beer bar on the bottom floor of essex market. They have a massive beer list that covers multiple countries and styles. And even if someone in...,"I have tried to like this place. I have been here at least 5 times, each time the service is worse. They really have no idea how to run a beer bar. The..."
49,iexl39DYyy_76Xq3ExaJkQ,excuse-my-french-new-york,Excuse My French,https://s3-media3.fl.yelpcdn.com/bphoto/TTBVbMP-n1qrnrkZec5puw/o.jpg,False,https://www.yelp.com/biz/excuse-my-french-new-york?adjust_creative=xC4n-h7ZGIsND4SXpQ_Fzg&utm_campaign=yelp_api_v3&utm_medium=api_v3_business_search&utm_source=xC4n-h7ZGIsND4SXpQ_Fzg,282,"[{'alias': 'bars', 'title': 'Bars'}, {'alias': 'tapas', 'title': 'Tapas Bars'}, {'alias': 'french', 'title': 'French'}]",4.5,"{'latitude': 40.71844, 'longitude': -73.98981}","['delivery', 'pickup']",$$,"{'address1': '96 Orchard St', 'address2': '', 'address3': '', 'city': 'New York', 'zip_code': '10002', 'country': 'US', 'state': 'NY', 'display_address': ['96 Orchard St', 'New York, NY 10002']}",+12127809600,(212) 780-9600,414.1510871916551,Went for Valentine's Day and it was just perfect! Only thing that wasn't 100% was the tartar. Still tasty but just had too much pickling flavor. Everything...,"Fancy, unique, and expensive French tapas with a story behind each specialty cocktail. My friend and I made a last minute reservation here last night and...","Definitely recommend making reservations because the place is very small. It has a cozy atmosphere!

We started off with some cocktails from their Winter..."
