,id,alias,name,image_url,is_closed,url,review_count,categories,rating,coordinates,transactions,price,location,phone,display_phone,distance,rev1,rev2,rev3,hours
45,DEHWHskp2gSAkfdylc4SNA,yatenga-french-bistro-and-bar-new-york,Yatenga French Bistro & Bar,https://s3-media4.fl.yelpcdn.com/bphoto/kwfY8Lf5mPzi4BjYVvWI5w/o.jpg,False,https://www.yelp.com/biz/yatenga-french-bistro-and-bar-new-york?adjust_creative=xC4n-h7ZGIsND4SXpQ_Fzg&utm_campaign=yelp_api_v3&utm_medium=api_v3_business_search&utm_source=xC4n-h7ZGIsND4SXpQ_Fzg,254,"[{'alias': 'french', 'title': 'French'}, {'alias': 'wine_bars', 'title': 'Wine Bars'}, {'alias': 'beerbar', 'title': 'Beer Bar'}]",4.0,"{'latitude': 40.8142691169743, 'longitude': -73.9441050339131}","['pickup', 'delivery']",$$,"{'address1': '2269 Adam Clayton Powell Jr Blvd', 'address2': '', 'address3': '', 'city': 'New York', 'zip_code': '10030', 'country': 'US', 'state': 'NY', 'display_address': ['2269 Adam Clayton Powell Jr Blvd', 'New York, NY 10030']}",+12126900699,(212) 690-0699,5026.56734949547,"Favorite place in Harlem!  We come for the delicious food, I always get the salmon which was so good last visit.  Big portion over tomato ratatouilles. My...",The food was good.  The leg of lamb was flavorful and perfectly cooked.  We also had the mussels with frites.  The sauce was delicious!  The calamari was...,We had the escargots and seasonal soup (chicken with potatoes and vegetables) and both were delicious. Our mains were great as well- duck breast and lamb...,"[{'open': [{'is_overnight': False, 'start': '1600', 'end': '2330', 'day': 0}, {'is_overnight': False, 'start': '1600', 'end': '2330', 'day': 1}, {'is_overnight': False, 'start': '1600', 'end': '2330', 'day': 2}, {'is_overnight': False, 'start': '1600', 'end': '2330', 'day': 3}, {'is_overnight': False, 'start': '1600', 'end': '2330', 'day': 4}, {'is_overnight': False, 'start': '1100', 'end': '2330', 'day': 5}, {'is_overnight': False, 'start': '1100', 'end': '2330', 'day': 6}], 'hours_type': 'REGULAR', 'is_open_now': True}]"
46,OkhbpTKJMb5_osTuynmT9Q,lukes-bar-and-grill-new-york-2,Luke's Bar and Grill,https://s3-media1.fl.yelpcdn.com/bphoto/FxymcHLJTmdtJKs5_PjONw/o.jpg,False,https://www.yelp.com/biz/lukes-bar-and-grill-new-york-2?adjust_creative=xC4n-h7ZGIsND4SXpQ_Fzg&utm_campaign=yelp_api_v3&utm_medium=api_v3_business_search&utm_source=xC4n-h7ZGIsND4SXpQ_Fzg,137,"[{'alias': 'tradamerican', 'title': 'American (Traditional)'}, {'alias': 'wine_bars', 'title': 'Wine Bars'}, {'alias': 'cocktailbars', 'title': 'Cocktail Bars'}]",3.5,"{'latitude': 40.77467, 'longitude': -73.95735}","['pickup', 'delivery']",$$,"{'address1': '1394 3rd Ave', 'address2': '', 'address3': '', 'city': 'New York', 'zip_code': '10075', 'country': 'US', 'state': 'NY', 'display_address': ['1394 3rd Ave', 'New York, NY 10075']}",+12122497070,(212) 249-7070,4304.6027876601165,"If you live in the neighborhood you know that Luke's is an institution.  Apart from having great food ( my favorite sliders) and ice cold beer, You feel at...","The food is really good here, and the drinks flow quite frequently, but the bartender/Chef is a real jerk and drinks while he's working.","Stopped for Sunday lunch after our visit to the Met. Lively bar crowd up front and dining room beyond. Two of us ordered Luke's Homemade Chili, with a side...","[{'open': [{'is_overnight': True, 'start': '1130', 'end': '0100', 'day': 0}, {'is_overnight': True, 'start': '1130', 'end': '0100', 'day': 1}, {'is_overnight': True, 'start': '1130', 'end': '0100', 'day': 2}, {'is_overnight': True, 'start': '1130', 'end': '0100', 'day': 3}, {'is_overnight': True, 'start': '1130', 'end': '0100', 'day': 4}, {'is_overnight': True, 'start': '1000', 'end': '0100', 'day': 5}, {'is_overnight': False, 'start': '1000', 'end': '2300', 'day': 6}], 'hours_type': 'REGULAR', 'is_open_now': True}]"
47,XOnspIaW6mYVmrvgqOaYSQ,lolos-seafood-shack-new-york,Lolo's Seafood Shack,https://s3-media2.fl.yelpcdn.com/bphoto/rD6VskdfpjsNa72AFrHDIg/o.jpg,False,https://www.yelp.com/biz/lolos-seafood-shack-new-york?adjust_creative=xC4n-h7ZGIsND4SXpQ_Fzg&utm_campaign=yelp_api_v3&utm_medium=api_v3_business_search&utm_source=xC4n-h7ZGIsND4SXpQ_Fzg,688,"[{'alias': 'seafood', 'title': 'Seafood'}, {'alias': 'bars', 'title': 'Bars'}]",4.0,"{'latitude': 40.80486, 'longitude': -73.95567}","['pickup', 'delivery']",$$,"{'address1': '303 W 116th St', 'address2': '', 'address3': '', 'city': 'New York', 'zip_code': '10026', 'country': 'US', 'state': 'NY', 'display_address': ['303 W 116th St', 'New York, NY 10026']}",+16466493356,(646) 649-3356,5027.919670387778,Love me some Lolo's- the review is for both delivery and dine in. Recently I have ordered delivery from Lolo's due to the current times and everything was...,I have only been here once but I definitely plan on coming back. It's a little different because I thought it was a traditional sit down but you order your...,"COVID-19 REVIEW

I'm going to start with some facts before we move on to opinions:

- unpeeled shrimp are weird looking
- half a pound of shrimp is not a...","[{'open': [{'is_overnight': False, 'start': '1200', 'end': '2200', 'day': 1}, {'is_overnight': False, 'start': '1200', 'end': '2200', 'day': 2}, {'is_overnight': False, 'start': '1200', 'end': '2200', 'day': 3}, {'is_overnight': False, 'start': '1200', 'end': '2200', 'day': 4}, {'is_overnight': False, 'start': '1200', 'end': '2200', 'day': 5}, {'is_overnight': False, 'start': '1200', 'end': '2100', 'day': 6}], 'hours_type': 'REGULAR', 'is_open_now': True}]"
48,M7Bl6U2EjxI-n0ksoYtZ8w,vero-new-york-2,Vero,https://s3-media3.fl.yelpcdn.com/bphoto/OMTOjWJ3i3bSLJjMNV0HLg/o.jpg,False,https://www.yelp.com/biz/vero-new-york-2?adjust_creative=xC4n-h7ZGIsND4SXpQ_Fzg&utm_campaign=yelp_api_v3&utm_medium=api_v3_business_search&utm_source=xC4n-h7ZGIsND4SXpQ_Fzg,296,"[{'alias': 'wine_bars', 'title': 'Wine Bars'}, {'alias': 'newamerican', 'title': 'American (New)'}]",3.5,"{'latitude': 40.77225, 'longitude': -73.95607}","['pickup', 'delivery']",$$,"{'address1': '1483 2nd Ave', 'address2': '', 'address3': '', 'city': 'New York', 'zip_code': '10075', 'country': 'US', 'state': 'NY', 'display_address': ['1483 2nd Ave', 'New York, NY 10075']}",+19175257373,(917) 525-7373,4244.721522285318,Love the new and improved Vero. I've been to the beautifully renovated restaurant a few times since the new ownership. It is a wonderful wine bar/...,Quick recap: awesome date spot. Good food. Decent prices. Service was a little slow but not terrible. Do not recommend getting mixed drinks here. It's a...,"Maybe this review is a waste of time but it's really meant to serve as a heads up for anyone who may find themselves in a similar situation to me.

The...","[{'open': [{'is_overnight': True, 'start': '1600', 'end': '0200', 'day': 0}, {'is_overnight': True, 'start': '1600', 'end': '0200', 'day': 1}, {'is_overnight': True, 'start': '1600', 'end': '0200', 'day': 2}, {'is_overnight': True, 'start': '1600', 'end': '0400', 'day': 3}, {'is_overnight': True, 'start': '1600', 'end': '0400', 'day': 4}, {'is_overnight': True, 'start': '1200', 'end': '0400', 'day': 5}, {'is_overnight': True, 'start': '1200', 'end': '0200', 'day': 6}], 'hours_type': 'REGULAR', 'is_open_now': True}]"
49,mWS4umRg2AyykyAClMrIRw,the-penrose-new-york,The Penrose,https://s3-media4.fl.yelpcdn.com/bphoto/qNLV1pybDp4Elzp3Ci_gzQ/o.jpg,False,https://www.yelp.com/biz/the-penrose-new-york?adjust_creative=xC4n-h7ZGIsND4SXpQ_Fzg&utm_campaign=yelp_api_v3&utm_medium=api_v3_business_search&utm_source=xC4n-h7ZGIsND4SXpQ_Fzg,1179,"[{'alias': 'gastropubs', 'title': 'Gastropubs'}, {'alias': 'bars', 'title': 'Bars'}, {'alias': 'breakfast_brunch', 'title': 'Breakfast & Brunch'}]",4.0,"{'latitude': 40.775427, 'longitude': -73.953115}",[],$$,"{'address1': '1590 2nd Ave', 'address2': '', 'address3': '', 'city': 'New York', 'zip_code': '10028', 'country': 'US', 'state': 'NY', 'display_address': ['1590 2nd Ave', 'New York, NY 10028']}",+12122032751,(212) 203-2751,3945.2775105673873,I came here after work on a Thursday night with my colleagues for drinks and dinner (we all got burgers). We couldn't be seated until the entire party...,A group of friends and I recently came in for brunch for a birthday and had a really nice time! After we were seated our waitress took our drink orders and...,"We were recommended to go here by two other people, so we had to go! We went twice actually - once for dinner and another for brunch. The decorations and...","[{'open': [{'is_overnight': True, 'start': '1100', 'end': '0400', 'day': 0}, {'is_overnight': True, 'start': '1100', 'end': '0400', 'day': 1}, {'is_overnight': True, 'start': '1100', 'end': '0400', 'day': 2}, {'is_overnight': True, 'start': '1100', 'end': '0400', 'day': 3}, {'is_overnight': True, 'start': '1100', 'end': '0400', 'day': 4}, {'is_overnight': True, 'start': '0930', 'end': '0400', 'day': 5}, {'is_overnight': True, 'start': '0930', 'end': '0400', 'day': 6}], 'hours_type': 'REGULAR', 'is_open_now': True}]"
