,id,alias,name,image_url,is_closed,url,review_count,categories,rating,coordinates,transactions,price,location,phone,display_phone,distance,rev1,rev2,rev3,hours
44,FR_E9_Z3WG5HjeIUyTKSWw,antonios-kitchen-east-elmhurst,Antonio's Kitchen,https://s3-media2.fl.yelpcdn.com/bphoto/SFwFGHd5bNeMgt_toZnc3g/o.jpg,False,https://www.yelp.com/biz/antonios-kitchen-east-elmhurst?adjust_creative=xC4n-h7ZGIsND4SXpQ_Fzg&utm_campaign=yelp_api_v3&utm_medium=api_v3_business_search&utm_source=xC4n-h7ZGIsND4SXpQ_Fzg,137,"[{'alias': 'italian', 'title': 'Italian'}, {'alias': 'wine_bars', 'title': 'Wine Bars'}, {'alias': 'pizza', 'title': 'Pizza'}]",3.5,"{'latitude': 40.7704153034747, 'longitude': -73.8933003575181}","['delivery', 'pickup']",$$,"{'address1': '76-08 21st Ave', 'address2': '', 'address3': '', 'city': 'East Elmhurst', 'zip_code': '11370', 'country': 'US', 'state': 'NY', 'display_address': ['76-08 21st Ave', 'East Elmhurst, NY 11370']}",+17187289200,(718) 728-9200,1481.7585980464337,"Came here for lunch and the pizza was soo good! 

Food was ready in minutes. 

Will most definately return.",Terrible. My partner and I went here on our break. She orders a pizza roll and I ordered a Sicilian slice. My slice wasn't in the oven for more than 1...,The food is phenomenal. I give it three stars since the small plate I always get every day has been reduced to a smaller square box. The amount of food from...,"[{'open': [{'is_overnight': False, 'start': '1000', 'end': '2200', 'day': 0}, {'is_overnight': False, 'start': '1000', 'end': '2200', 'day': 1}, {'is_overnight': False, 'start': '1000', 'end': '2200', 'day': 2}, {'is_overnight': False, 'start': '1000', 'end': '2200', 'day': 3}, {'is_overnight': False, 'start': '1000', 'end': '2300', 'day': 4}, {'is_overnight': False, 'start': '1000', 'end': '2300', 'day': 5}, {'is_overnight': False, 'start': '1000', 'end': '2100', 'day': 6}], 'hours_type': 'REGULAR', 'is_open_now': True}]"
45,JccD4NQaF3vZuGGnAKeB7A,sweetleaf-long-island-city-4,Sweetleaf,https://s3-media3.fl.yelpcdn.com/bphoto/AWyeha_eL2qJz_fJCIQCiw/o.jpg,False,https://www.yelp.com/biz/sweetleaf-long-island-city-4?adjust_creative=xC4n-h7ZGIsND4SXpQ_Fzg&utm_campaign=yelp_api_v3&utm_medium=api_v3_business_search&utm_source=xC4n-h7ZGIsND4SXpQ_Fzg,249,"[{'alias': 'coffee', 'title': 'Coffee & Tea'}, {'alias': 'cocktailbars', 'title': 'Cocktail Bars'}]",3.5,"{'latitude': 40.7469015944119, 'longitude': -73.9562634274872}","['delivery', 'pickup']",$$,"{'address1': '4615 Center Blvd', 'address2': '', 'address3': '', 'city': 'Long Island City', 'zip_code': '11109', 'country': 'US', 'state': 'NY', 'display_address': ['4615 Center Blvd', 'Long Island City, NY 11109']}",+13475271038,(347) 527-1038,5508.042809090021,"A decent coffee place with an ideal location.

I have passed this place several times on my way to work, despite having previously visited another chain in...","I have appreciated sweetleaf staying open during the Covid19 outbreak. I would hope, now that the state requires everyone to wear masks on public, that...","I go to sweetleaf almost everyday. Today it was cold so I sat down at a table to enjoy my coffee and brownie. A server came after 10 mins and said ""you...","[{'open': [{'is_overnight': False, 'start': '0800', 'end': '1600', 'day': 0}, {'is_overnight': False, 'start': '0800', 'end': '1600', 'day': 1}, {'is_overnight': False, 'start': '0800', 'end': '1600', 'day': 2}, {'is_overnight': False, 'start': '0800', 'end': '1600', 'day': 3}, {'is_overnight': False, 'start': '0800', 'end': '1600', 'day': 4}, {'is_overnight': False, 'start': '0800', 'end': '1600', 'day': 5}, {'is_overnight': False, 'start': '0800', 'end': '1600', 'day': 6}], 'hours_type': 'REGULAR', 'is_open_now': True}]"
46,4K7MI-RPMo3bbtDE9dayJw,delta-sky-club-east-elmhurst-3,Delta Sky Club,https://s3-media3.fl.yelpcdn.com/bphoto/Bmjxkiep6Rv4gvRpQ66h5Q/o.jpg,False,https://www.yelp.com/biz/delta-sky-club-east-elmhurst-3?adjust_creative=xC4n-h7ZGIsND4SXpQ_Fzg&utm_campaign=yelp_api_v3&utm_medium=api_v3_business_search&utm_source=xC4n-h7ZGIsND4SXpQ_Fzg,54,"[{'alias': 'airportlounges', 'title': 'Airport Lounges'}]",4.0,"{'latitude': 40.771688168234, 'longitude': -73.8655870139557}",[],$$,"{'address1': 'LaGuardia Airport', 'address2': None, 'address3': 'Terminal C', 'city': 'East Elmhurst', 'zip_code': '11371', 'country': 'US', 'state': 'NY', 'display_address': ['LaGuardia Airport', 'Terminal C', 'East Elmhurst, NY 11371']}",+17182891368,(718) 289-1368,3548.59745324124,"Delta Sky Club by C28 LaGuardia

After an entirely dismal experience at the club near the D gates, we traveled a bit to the club by C28, the tiny...","Pretty average lounge experience, but one of the only refuges in LaGuardia. 
Pros: Helpful staff, clean sitting area and bathrooms. Almost always enough...","Every time I visit, there are more people
In this lounge. How? Why? I could barely find an open seat today. They really need to figure out how to solve this...","[{'open': [{'is_overnight': False, 'start': '0500', 'end': '2200', 'day': 0}, {'is_overnight': False, 'start': '0500', 'end': '2200', 'day': 1}, {'is_overnight': False, 'start': '0500', 'end': '2200', 'day': 2}, {'is_overnight': False, 'start': '0500', 'end': '2200', 'day': 3}, {'is_overnight': False, 'start': '0500', 'end': '2200', 'day': 4}, {'is_overnight': False, 'start': '0500', 'end': '1900', 'day': 5}, {'is_overnight': False, 'start': '0500', 'end': '2200', 'day': 6}], 'hours_type': 'REGULAR', 'is_open_now': True}]"
47,eMoB_q8WIjgTogKaeNHKBA,jack-and-fannys-new-york,Jack and Fanny's,https://s3-media3.fl.yelpcdn.com/bphoto/5EzozTe53OyjCq1aFINBkg/o.jpg,False,https://www.yelp.com/biz/jack-and-fannys-new-york?adjust_creative=xC4n-h7ZGIsND4SXpQ_Fzg&utm_campaign=yelp_api_v3&utm_medium=api_v3_business_search&utm_source=xC4n-h7ZGIsND4SXpQ_Fzg,58,"[{'alias': 'bars', 'title': 'Bars'}, {'alias': 'italian', 'title': 'Italian'}]",4.0,"{'latitude': 40.77577, 'longitude': -73.95369}",[],$$,"{'address1': '1591 2nd Ave', 'address2': None, 'address3': '', 'city': 'New York', 'zip_code': '10028', 'country': 'US', 'state': 'NY', 'display_address': ['1591 2nd Ave', 'New York, NY 10028']}",+19172590028,(917) 259-0028,3984.4986513708945,"The nicest bartenders I've come across in a long time. Very sweet, patient, and great vibe amongst them. I would honestly come back just for them!","Had high hopes because my friend loves this bar but unfortunately I was not a fan. To start, there was only one bartender and over thirty people at the bar....","Was looking for a good place to watch football with some good food... WOW is all I can say! The ""Fra Diabolo Wings"" toasted garlic, chili parmesan dip is...","[{'open': [{'is_overnight': True, 'start': '1600', 'end': '0400', 'day': 0}, {'is_overnight': True, 'start': '1600', 'end': '0400', 'day': 1}, {'is_overnight': True, 'start': '1600', 'end': '0400', 'day': 2}, {'is_overnight': True, 'start': '1600', 'end': '0400', 'day': 3}, {'is_overnight': True, 'start': '1600', 'end': '0400', 'day': 4}, {'is_overnight': True, 'start': '1100', 'end': '0400', 'day': 5}, {'is_overnight': True, 'start': '1100', 'end': '0400', 'day': 6}], 'hours_type': 'REGULAR', 'is_open_now': False}]"
48,zDujEq9qZk13nBcG2PH4tA,il-falco-long-island-city,Il Falco,https://s3-media3.fl.yelpcdn.com/bphoto/FfOFtCAAdgDUbJT3vvMe8Q/o.jpg,False,https://www.yelp.com/biz/il-falco-long-island-city?adjust_creative=xC4n-h7ZGIsND4SXpQ_Fzg&utm_campaign=yelp_api_v3&utm_medium=api_v3_business_search&utm_source=xC4n-h7ZGIsND4SXpQ_Fzg,281,"[{'alias': 'italian', 'title': 'Italian'}, {'alias': 'venues', 'title': 'Venues & Event Spaces'}, {'alias': 'wine_bars', 'title': 'Wine Bars'}]",4.5,"{'latitude': 40.7476595714373, 'longitude': -73.9455319123659}","['delivery', 'pickup']",$$$,"{'address1': '21-50 44th Dr', 'address2': '', 'address3': '', 'city': 'Long Island City', 'zip_code': '11101', 'country': 'US', 'state': 'NY', 'display_address': ['21-50 44th Dr', 'Long Island City, NY 11101']}",+17187070009,(718) 707-0009,4795.208258517108,"I love these old school Italian places, especially when the chefs comes from the famed NYC restaurant Il Mulino.

If you're looking for a fancy decor, this...","Food delivery ordered carbonara, minestrone and caesar salad. Everything was bland. The worse was the caesar salad just pretty much had romaine and bread...","The appetizers & salads were really good, the entrees were good, but a bunch of us were disappointed in the sauces; best to get them on the side. The mixed...","[{'open': [{'is_overnight': False, 'start': '1700', 'end': '2115', 'day': 0}, {'is_overnight': False, 'start': '1130', 'end': '2200', 'day': 1}, {'is_overnight': False, 'start': '1130', 'end': '2200', 'day': 2}, {'is_overnight': False, 'start': '1130', 'end': '2200', 'day': 3}, {'is_overnight': False, 'start': '1130', 'end': '2300', 'day': 4}, {'is_overnight': False, 'start': '1700', 'end': '2300', 'day': 5}, {'is_overnight': False, 'start': '1530', 'end': '2100', 'day': 6}], 'hours_type': 'REGULAR', 'is_open_now': True}]"
49,DpZBA0-f7Um9lvnp1zZM2A,earls-beer-and-cheese-new-york,Earl's Beer & Cheese,https://s3-media3.fl.yelpcdn.com/bphoto/famNEa6UXueVsF51-9nDRg/o.jpg,False,https://www.yelp.com/biz/earls-beer-and-cheese-new-york?adjust_creative=xC4n-h7ZGIsND4SXpQ_Fzg&utm_campaign=yelp_api_v3&utm_medium=api_v3_business_search&utm_source=xC4n-h7ZGIsND4SXpQ_Fzg,598,"[{'alias': 'bars', 'title': 'Bars'}, {'alias': 'comfortfood', 'title': 'Comfort Food'}]",4.5,"{'latitude': 40.78729, 'longitude': -73.95152}","['delivery', 'pickup']",$$,"{'address1': '1259 Park Ave', 'address2': '', 'address3': '', 'city': 'New York', 'zip_code': '10029', 'country': 'US', 'state': 'NY', 'display_address': ['1259 Park Ave', 'New York, NY 10029']}",+12122891581,(212) 289-1581,3892.943660847009,"Best place on the upper east side, with a kitchen open late and early on weekends and beer cheese that's worth a trip out of your way to experience. 

Also...","Good local spot , the cheese and bread appetizer is good but overhyped . Small selection of wine and beer , friendly service. Prices are good , the spot is...",Beer is pretty good and they have pretty good happy hours too! The cheese is to DIE for it's so good. The bread it comes with too... bruh. The tomato soup...,"[{'open': [{'is_overnight': False, 'start': '1600', 'end': '0000', 'day': 0}, {'is_overnight': False, 'start': '1100', 'end': '0000', 'day': 1}, {'is_overnight': False, 'start': '1100', 'end': '0000', 'day': 2}, {'is_overnight': False, 'start': '1100', 'end': '0000', 'day': 3}, {'is_overnight': True, 'start': '1100', 'end': '0200', 'day': 4}, {'is_overnight': True, 'start': '1100', 'end': '0200', 'day': 5}, {'is_overnight': False, 'start': '1100', 'end': '0000', 'day': 6}], 'hours_type': 'REGULAR', 'is_open_now': True}]"
