,id,alias,name,image_url,is_closed,url,review_count,categories,rating,coordinates,transactions,location,phone,display_phone,distance,price,rev1,rev2,rev3,hours
15,jW22gmsZjh5hFJsC1qUDOA,the-baroness-bar-burgers-beer-long-island-city,The Baroness Bar Burgers + Beer,https://s3-media2.fl.yelpcdn.com/bphoto/K29B1Q_brq_lm5UMgp2CcQ/o.jpg,False,https://www.yelp.com/biz/the-baroness-bar-burgers-beer-long-island-city?adjust_creative=xC4n-h7ZGIsND4SXpQ_Fzg&utm_campaign=yelp_api_v3&utm_medium=api_v3_business_search&utm_source=xC4n-h7ZGIsND4SXpQ_Fzg,402,"[{'alias': 'wine_bars', 'title': 'Wine Bars'}, {'alias': 'burgers', 'title': 'Burgers'}, {'alias': 'beerbar', 'title': 'Beer Bar'}]",4.0,"{'latitude': 40.75169, 'longitude': -73.93992}",[],"{'address1': '41-26 Crescent St', 'address2': None, 'address3': '', 'city': 'Long Island City', 'zip_code': '11101', 'country': 'US', 'state': 'NY', 'display_address': ['41-26 Crescent St', 'Long Island City, NY 11101']}",+13476818207,(347) 681-8207,790.4314466361154,$$,"The Baroness is a saint of a burger slinging Queen. Anyone who says otherwise is just wrong. Never had a bad burger in 3 years, sides are incomparable and...","My first instinct was to give Baroness 1 star solely to provoke a response from the shit talking owner, but the reality is that I love this place.

The...","My first time trying this place and during this COVID 19 quarantine, I was craving a burger. This is only a block away from my apartment so this looked to...","[{'open': [{'is_overnight': False, 'start': '1600', 'end': '2200', 'day': 0}, {'is_overnight': False, 'start': '1200', 'end': '2200', 'day': 1}, {'is_overnight': False, 'start': '1200', 'end': '2200', 'day': 2}, {'is_overnight': False, 'start': '1200', 'end': '2200', 'day': 3}, {'is_overnight': False, 'start': '1200', 'end': '2200', 'day': 4}, {'is_overnight': False, 'start': '1200', 'end': '2200', 'day': 5}, {'is_overnight': False, 'start': '1200', 'end': '2200', 'day': 6}], 'hours_type': 'REGULAR', 'is_open_now': True}]"
16,OhfQPmvbkLoEYJGDpJ7bSw,casablanca-cocktail-lounge-brooklyn,Casablanca Cocktail Lounge,https://s3-media1.fl.yelpcdn.com/bphoto/9hswWY5SFFVINQB9fX-UQg/o.jpg,False,https://www.yelp.com/biz/casablanca-cocktail-lounge-brooklyn?adjust_creative=xC4n-h7ZGIsND4SXpQ_Fzg&utm_campaign=yelp_api_v3&utm_medium=api_v3_business_search&utm_source=xC4n-h7ZGIsND4SXpQ_Fzg,126,"[{'alias': 'cocktailbars', 'title': 'Cocktail Bars'}]",4.0,"{'latitude': 40.6826777021563, 'longitude': -73.9291463344934}",[],"{'address1': '300 Malcolm X Blvd', 'address2': '', 'address3': '', 'city': 'Brooklyn', 'zip_code': '11233', 'country': 'US', 'state': 'NY', 'display_address': ['300 Malcolm X Blvd', 'Brooklyn, NY 11233']}",,,6974.132437198989,$$,Stepped in this spot on the late late night tip (probably 2:30 am) on a Friday already probably wasted if we're being honest here. My impression was that...,"It was a Dark N Stormy night.  

No but seriously, it's dark and stormy outside.  

Waiting for my friend and decided to enjoy a cocktail. 

Ambiance is...","Only giving them 4 stars because they are cash only, and of course I didn't have much cash on me.  but THIS is the Friday night turn up! The djs were great,...","[{'open': [{'is_overnight': True, 'start': '1700', 'end': '0130', 'day': 1}, {'is_overnight': True, 'start': '1700', 'end': '0130', 'day': 2}, {'is_overnight': True, 'start': '1700', 'end': '0230', 'day': 3}, {'is_overnight': True, 'start': '1700', 'end': '0330', 'day': 4}, {'is_overnight': True, 'start': '1700', 'end': '0330', 'day': 5}, {'is_overnight': True, 'start': '1600', 'end': '0130', 'day': 6}], 'hours_type': 'REGULAR', 'is_open_now': True}]"
17,7kQW50g2S6GQAxTNkWeNWg,the-lookout-new-york,the Lookout,https://s3-media4.fl.yelpcdn.com/bphoto/3B9FhMLbF-Oo-Ohkfv8SiQ/o.jpg,False,https://www.yelp.com/biz/the-lookout-new-york?adjust_creative=xC4n-h7ZGIsND4SXpQ_Fzg&utm_campaign=yelp_api_v3&utm_medium=api_v3_business_search&utm_source=xC4n-h7ZGIsND4SXpQ_Fzg,27,"[{'alias': 'bars', 'title': 'Bars'}]",3.0,"{'latitude': 40.7053823001624, 'longitude': -74.0014100483191}",[],"{'address1': '89 South St', 'address2': '', 'address3': None, 'city': 'New York', 'zip_code': '10038', 'country': 'US', 'state': 'NY', 'display_address': ['89 South St', 'New York, NY 10038']}",,,7049.725337395013,,I love this spot in the summertime. The cocktails are always refreshing and it was usually crowded in there. Sometimes you wait forever for a bartender to...,Such a Great informal spot tucked under the Pier 17 venue and  right next to Jean Georges. It's an unassuming and very beach tropics  vibe. It's a Mexican...,I visited the Lookout on a Monday with a friend for an event being hosted at the space. This was the first time I've had the opportunity to visit the new...,"[{'open': [{'is_overnight': True, 'start': '1530', 'end': '0100', 'day': 0}, {'is_overnight': True, 'start': '1530', 'end': '0100', 'day': 1}, {'is_overnight': True, 'start': '1530', 'end': '0100', 'day': 2}, {'is_overnight': True, 'start': '1530', 'end': '0100', 'day': 3}, {'is_overnight': True, 'start': '1530', 'end': '0100', 'day': 4}, {'is_overnight': True, 'start': '1230', 'end': '0100', 'day': 5}], 'hours_type': 'REGULAR', 'is_open_now': True}]"
18,Qg3J6XPrD22CEFAqEEhWpw,the-pony-bar-new-york-2,The Pony Bar,https://s3-media3.fl.yelpcdn.com/bphoto/9MsM0J2odGahpttFOUghgA/o.jpg,False,https://www.yelp.com/biz/the-pony-bar-new-york-2?adjust_creative=xC4n-h7ZGIsND4SXpQ_Fzg&utm_campaign=yelp_api_v3&utm_medium=api_v3_business_search&utm_source=xC4n-h7ZGIsND4SXpQ_Fzg,355,"[{'alias': 'bars', 'title': 'Bars'}]",4.0,"{'latitude': 40.76974, 'longitude': -73.95425}",[],"{'address1': '1444 1st Ave', 'address2': '', 'address3': '', 'city': 'New York', 'zip_code': '10021', 'country': 'US', 'state': 'NY', 'display_address': ['1444 1st Ave', 'New York, NY 10021']}",+12122880090,(212) 288-0090,3123.7047384202056,$$,Met my husband here and forever grateful for pony bar for bringing us together! Will always be a special place for us!,Not that busy even on a Friday night but we enjoyed our time here! They even had a sour beer which I enjoyed and I like their wings--double fried! And the...,The build up on the  Salt and Pepper shakers and the Sriracha is GROSS and  the customer service  is the same as the condiment holder .... I had to ask for...,"[{'open': [{'is_overnight': False, 'start': '1500', 'end': '0000', 'day': 0}, {'is_overnight': False, 'start': '1500', 'end': '0000', 'day': 1}, {'is_overnight': False, 'start': '1500', 'end': '0000', 'day': 2}, {'is_overnight': True, 'start': '1500', 'end': '0130', 'day': 3}, {'is_overnight': True, 'start': '1500', 'end': '0330', 'day': 4}, {'is_overnight': True, 'start': '1200', 'end': '0330', 'day': 5}, {'is_overnight': False, 'start': '1200', 'end': '0000', 'day': 6}], 'hours_type': 'REGULAR', 'is_open_now': True}]"
19,nm5rcWNmfevNXLNQAITi5w,clinton-hall-new-york,Clinton Hall,https://s3-media1.fl.yelpcdn.com/bphoto/jkOeBmGbclLyY3zbOa7COw/o.jpg,False,https://www.yelp.com/biz/clinton-hall-new-york?adjust_creative=xC4n-h7ZGIsND4SXpQ_Fzg&utm_campaign=yelp_api_v3&utm_medium=api_v3_business_search&utm_source=xC4n-h7ZGIsND4SXpQ_Fzg,645,"[{'alias': 'bars', 'title': 'Bars'}, {'alias': 'newamerican', 'title': 'American (New)'}, {'alias': 'beergardens', 'title': 'Beer Gardens'}]",3.5,"{'latitude': 40.70803, 'longitude': -74.014869}","['pickup', 'delivery']","{'address1': '90 Washington St', 'address2': None, 'address3': '', 'city': 'New York', 'zip_code': '10006', 'country': 'US', 'state': 'NY', 'display_address': ['90 Washington St', 'New York, NY 10006']}",+12123636000,(212) 363-6000,7804.892487792076,$$,"+FOOD: Donut grilled cheese is out of this world. The fondue Burger isn't bad either. 
+GAMES: They had adult-sized games outside on the patio and I can...","Food, drink, and service was decent.  Nothing spectacular....

They also didn't have things like tea, which is a bit off.","I never had so many people slideee into my DMs in my life because of a grilled cheese sandwich!

I was surprised that the sandwich was sweeter than what I...","[{'open': [{'is_overnight': False, 'start': '1300', 'end': '2100', 'day': 2}, {'is_overnight': False, 'start': '1300', 'end': '2100', 'day': 3}, {'is_overnight': False, 'start': '1300', 'end': '2100', 'day': 4}, {'is_overnight': False, 'start': '1300', 'end': '2100', 'day': 5}, {'is_overnight': False, 'start': '1300', 'end': '2100', 'day': 6}], 'hours_type': 'REGULAR', 'is_open_now': True}]"
20,yXkibW4aTbHlmorIkGSg_Q,xiv-brooklyn,XIV,https://s3-media1.fl.yelpcdn.com/bphoto/mvqY-T24DxouoCq_OzxChg/o.jpg,False,https://www.yelp.com/biz/xiv-brooklyn?adjust_creative=xC4n-h7ZGIsND4SXpQ_Fzg&utm_campaign=yelp_api_v3&utm_medium=api_v3_business_search&utm_source=xC4n-h7ZGIsND4SXpQ_Fzg,83,"[{'alias': 'cocktailbars', 'title': 'Cocktail Bars'}, {'alias': 'cabaret', 'title': 'Cabaret'}]",4.5,"{'latitude': 40.7060529, 'longitude': -73.9233777}",[],"{'address1': '383 Troutman St', 'address2': None, 'address3': '', 'city': 'Brooklyn', 'zip_code': '11237', 'country': 'US', 'state': 'NY', 'display_address': ['383 Troutman St', 'Brooklyn, NY 11237']}",+18668114111,(866) 811-4111,4482.7036245725685,$$$,"One of the best theaters in New York. I came here for the first time last year to see one of their shows, I CANT GET ENOUGH! This company puts together some...","Cool to see how this company troupe is evolving. Having seen Nutcracker Rouge at I believe at Minetta Lane, I was curious to catch queen of hearts in...",This beautiful and majestic experience that is XIV. I discovered this when todaytix told me about their nutcracker rouge. Yesss!!! I have seen the...,"[{'open': [{'is_overnight': True, 'start': '1900', 'end': '0200', 'day': 3}, {'is_overnight': True, 'start': '1900', 'end': '0200', 'day': 4}, {'is_overnight': True, 'start': '1600', 'end': '0200', 'day': 5}, {'is_overnight': True, 'start': '1600', 'end': '0200', 'day': 6}], 'hours_type': 'REGULAR', 'is_open_now': False}]"
21,wmDx6a6HPvlq5lX3wH52EA,saint-vitus-brooklyn,Saint Vitus,https://s3-media4.fl.yelpcdn.com/bphoto/8LKt4SueFsmlvATqxAwnMw/o.jpg,False,https://www.yelp.com/biz/saint-vitus-brooklyn?adjust_creative=xC4n-h7ZGIsND4SXpQ_Fzg&utm_campaign=yelp_api_v3&utm_medium=api_v3_business_search&utm_source=xC4n-h7ZGIsND4SXpQ_Fzg,142,"[{'alias': 'bars', 'title': 'Bars'}, {'alias': 'musicvenues', 'title': 'Music Venues'}]",4.5,"{'latitude': 40.73678, 'longitude': -73.95517}",[],"{'address1': '1120 Manhattan Ave', 'address2': '', 'address3': '', 'city': 'Brooklyn', 'zip_code': '11222', 'country': 'US', 'state': 'NY', 'display_address': ['1120 Manhattan Ave', 'Brooklyn, NY 11222']}",,,1842.9982887212118,$,"This place is such a delight. Quick and attentive bartenders (pretty friendly too, given they have to put up with the general public), amazing and...","Saint Vitus is currently my favorite live music venue in New York. The location, tucked into a discrete block in Greenpoint, is accessible via the G train....","Went to Saint Vitus last night to see Marty Friedman play, with Immortal Guardian as the opener. 

Great sound for metal. The audio techs make sure it's...","[{'open': [{'is_overnight': True, 'start': '1800', 'end': '0200', 'day': 0}, {'is_overnight': True, 'start': '1800', 'end': '0200', 'day': 1}, {'is_overnight': True, 'start': '1800', 'end': '0200', 'day': 2}, {'is_overnight': True, 'start': '1800', 'end': '0200', 'day': 3}, {'is_overnight': True, 'start': '1800', 'end': '0400', 'day': 4}, {'is_overnight': True, 'start': '1800', 'end': '0400', 'day': 5}, {'is_overnight': True, 'start': '1800', 'end': '0200', 'day': 6}], 'hours_type': 'REGULAR', 'is_open_now': False}]"
22,gK-d-vOz9UmXIE_08jEOzg,the-bad-ass-astoria,The Bad Ass,https://s3-media2.fl.yelpcdn.com/bphoto/CwCB39b-lj14nq0eyH1YRA/o.jpg,False,https://www.yelp.com/biz/the-bad-ass-astoria?adjust_creative=xC4n-h7ZGIsND4SXpQ_Fzg&utm_campaign=yelp_api_v3&utm_medium=api_v3_business_search&utm_source=xC4n-h7ZGIsND4SXpQ_Fzg,4,"[{'alias': 'lounges', 'title': 'Lounges'}, {'alias': 'cocktailbars', 'title': 'Cocktail Bars'}]",4.0,"{'latitude': 40.77632, 'longitude': -73.91518}",[],"{'address1': '26-17 23rd Ave', 'address2': '', 'address3': None, 'city': 'Astoria', 'zip_code': '11105', 'country': 'US', 'state': 'NY', 'display_address': ['26-17 23rd Ave', 'Astoria, NY 11105']}",+17184408378,(718) 440-8378,3893.7333314486505,,"This place just opened in Astoria and after two weeks I decided to try it.
The space and the graffiti on the wall are cool things about the bar but, stops...","It's fine for what it is. 
They only serve drinks, so make sure you eat before hand. They do give you some snack mix if you ask for it and it's actually...",Super cute. Friendly staff. Tasty cocktails. Definitely a fabulous new neighborhood hotspot. I'm coming back.,
23,Uw7o4KfoNgABvCcBFNUewQ,crawl-brooklyn-brooklyn,Crawl Brooklyn,https://s3-media4.fl.yelpcdn.com/bphoto/d_qUPiYC3wvWjoRs7VFFMw/o.jpg,False,https://www.yelp.com/biz/crawl-brooklyn-brooklyn?adjust_creative=xC4n-h7ZGIsND4SXpQ_Fzg&utm_campaign=yelp_api_v3&utm_medium=api_v3_business_search&utm_source=xC4n-h7ZGIsND4SXpQ_Fzg,1,"[{'alias': 'barcrawl', 'title': 'Bar Crawl'}]",5.0,"{'latitude': 40.7103080749512, 'longitude': -73.9568710327148}",[],"{'address1': '', 'address2': None, 'address3': '', 'city': 'Brooklyn', 'zip_code': '11211', 'country': 'US', 'state': 'NY', 'display_address': ['Brooklyn, NY 11211']}",+19293240230,(929) 324-0230,4335.150246888581,,Amazing bar crawl experience in one of New York's best neighborhoods. Sarah takes the group on a great tour from bar to bar with great deals and even better...,No Review,No Review,"[{'open': [{'is_overnight': False, 'start': '1200', 'end': '2000', 'day': 0}, {'is_overnight': False, 'start': '1200', 'end': '2000', 'day': 1}, {'is_overnight': False, 'start': '1200', 'end': '2000', 'day': 2}, {'is_overnight': False, 'start': '1200', 'end': '2000', 'day': 3}, {'is_overnight': False, 'start': '1200', 'end': '0000', 'day': 4}, {'is_overnight': False, 'start': '1200', 'end': '0000', 'day': 5}, {'is_overnight': False, 'start': '1200', 'end': '2000', 'day': 6}], 'hours_type': 'REGULAR', 'is_open_now': True}]"
24,Sj3JYCbaEFrAqUzRrenQbg,jora-restaurant-and-bar-long-island-city,Jora Restaurant & Bar,https://s3-media3.fl.yelpcdn.com/bphoto/Fzckhw-nQGKVyBUKmsIfMA/o.jpg,False,https://www.yelp.com/biz/jora-restaurant-and-bar-long-island-city?adjust_creative=xC4n-h7ZGIsND4SXpQ_Fzg&utm_campaign=yelp_api_v3&utm_medium=api_v3_business_search&utm_source=xC4n-h7ZGIsND4SXpQ_Fzg,613,"[{'alias': 'peruvian', 'title': 'Peruvian'}, {'alias': 'cocktailbars', 'title': 'Cocktail Bars'}, {'alias': 'tapas', 'title': 'Tapas Bars'}]",4.5,"{'latitude': 40.7438054, 'longitude': -73.9515007}","['pickup', 'restaurant_reservation', 'delivery']","{'address1': '47-46 11th St', 'address2': '', 'address3': '', 'city': 'Long Island City', 'zip_code': '11101', 'country': 'US', 'state': 'NY', 'display_address': ['47-46 11th St', 'Long Island City, NY 11101']}",+17183922033,(718) 392-2033,1291.8313611569017,$$,"I came here for my birthday celebration and everything was amazing from the service down to the drinks and food. 

For appetizer, we had the jalea which...","I love coming to Jora, and was very excited to come back, but I've got to update my rating based on my most recent visit. 

I ordered a few dishes, but my...","First time here. Dropped in without a res--five of us at Saturday night 8:45 and we only waited 10 minutes for a table (how lucky of us lol)

Our server was...","[{'open': [{'is_overnight': False, 'start': '1500', 'end': '2100', 'day': 0}, {'is_overnight': False, 'start': '1500', 'end': '2100', 'day': 1}, {'is_overnight': False, 'start': '1500', 'end': '2100', 'day': 2}, {'is_overnight': False, 'start': '1500', 'end': '2100', 'day': 3}, {'is_overnight': False, 'start': '1500', 'end': '2100', 'day': 4}, {'is_overnight': False, 'start': '1200', 'end': '2100', 'day': 5}, {'is_overnight': False, 'start': '1200', 'end': '2100', 'day': 6}], 'hours_type': 'REGULAR', 'is_open_now': True}]"
25,9sU8ceKHiqNrLBMRM-aUkg,harriets-rooftop-and-lounge-brooklyn,Harriet's Rooftop & Lounge,https://s3-media2.fl.yelpcdn.com/bphoto/a_OOpSRGDchBQ5TYh5dWnQ/o.jpg,False,https://www.yelp.com/biz/harriets-rooftop-and-lounge-brooklyn?adjust_creative=xC4n-h7ZGIsND4SXpQ_Fzg&utm_campaign=yelp_api_v3&utm_medium=api_v3_business_search&utm_source=xC4n-h7ZGIsND4SXpQ_Fzg,46,"[{'alias': 'lounges', 'title': 'Lounges'}]",3.0,"{'latitude': 40.70184, 'longitude': -73.9958147}",[],"{'address1': '60 Furman St', 'address2': None, 'address3': None, 'city': 'Brooklyn', 'zip_code': '11201', 'country': 'US', 'state': 'NY', 'display_address': ['60 Furman St', 'Brooklyn, NY 11201']}",+13476962505,(347) 696-2505,6955.9931684038165,$$$,"love this place
bit should add more food...
will go back again
staff so nice amd the view is Best picture...",Had amazing nights here in the summer time. The Harriet's Rooftop has awesome views of the Fidi district's skyscrapers and the city as well as a full view...,"This is one of the worst hospitality treatments I have ever experienced. 
Up until receiving the bill, (I was overcharged 400$), the view was great and...","[{'open': [{'is_overnight': False, 'start': '1700', 'end': '0000', 'day': 0}, {'is_overnight': False, 'start': '1700', 'end': '0000', 'day': 1}, {'is_overnight': False, 'start': '1700', 'end': '0000', 'day': 2}, {'is_overnight': True, 'start': '1700', 'end': '0200', 'day': 3}, {'is_overnight': True, 'start': '1700', 'end': '0200', 'day': 4}, {'is_overnight': True, 'start': '1100', 'end': '0200', 'day': 5}, {'is_overnight': False, 'start': '1100', 'end': '0000', 'day': 6}], 'hours_type': 'REGULAR', 'is_open_now': True}]"
26,KqxBfDaww1j0qhgDGh-VSg,diamond-dogs-astoria,Diamond Dogs,https://s3-media4.fl.yelpcdn.com/bphoto/cp5C_NMqJEcof79o6fb7sw/o.jpg,False,https://www.yelp.com/biz/diamond-dogs-astoria?adjust_creative=xC4n-h7ZGIsND4SXpQ_Fzg&utm_campaign=yelp_api_v3&utm_medium=api_v3_business_search&utm_source=xC4n-h7ZGIsND4SXpQ_Fzg,133,"[{'alias': 'cocktailbars', 'title': 'Cocktail Bars'}, {'alias': 'beergardens', 'title': 'Beer Gardens'}]",4.0,"{'latitude': 40.76285, 'longitude': -73.92099}",[],"{'address1': '34-04 31st Ave', 'address2': '', 'address3': '', 'city': 'Astoria', 'zip_code': '11106', 'country': 'US', 'state': 'NY', 'display_address': ['34-04 31st Ave', 'Astoria, NY 11106']}",+19295220061,(929) 522-0061,2374.6062293441646,$$,"I've always been curious about the unmarked, dimly-lit bar that is Diamond Dogs. We came here last night and it was quite packed. They had an outdoor space...","Cool spot, it can get packed later on at night. But they have sole solid drinks and cool bartenders. 
cant wait time come back here and try some of the...","What a perfect spot..
I love a great cocktail and I surely was not dissapointed. Sweetheart is that BUD lite type of guy and the bartender(which if whom is...","[{'open': [{'is_overnight': True, 'start': '1600', 'end': '0300', 'day': 0}, {'is_overnight': True, 'start': '1600', 'end': '0300', 'day': 1}, {'is_overnight': True, 'start': '1600', 'end': '0400', 'day': 2}, {'is_overnight': True, 'start': '1600', 'end': '0400', 'day': 3}, {'is_overnight': True, 'start': '1600', 'end': '0400', 'day': 4}, {'is_overnight': True, 'start': '1600', 'end': '0400', 'day': 5}, {'is_overnight': True, 'start': '1600', 'end': '0300', 'day': 6}], 'hours_type': 'REGULAR', 'is_open_now': True}]"
27,QhbT2anIV8OoHc1WYKzPeg,the-gaslight-sunnyside,The Gaslight,https://s3-media2.fl.yelpcdn.com/bphoto/ucKZSRZLbXiFWmxu19j8Ug/o.jpg,False,https://www.yelp.com/biz/the-gaslight-sunnyside?adjust_creative=xC4n-h7ZGIsND4SXpQ_Fzg&utm_campaign=yelp_api_v3&utm_medium=api_v3_business_search&utm_source=xC4n-h7ZGIsND4SXpQ_Fzg,61,"[{'alias': 'pubs', 'title': 'Pubs'}]",3.5,"{'latitude': 40.743813, 'longitude': -73.920689}",[],"{'address1': '4317 Queens Blvd', 'address2': '', 'address3': '', 'city': 'Sunnyside', 'zip_code': '11104', 'country': 'US', 'state': 'NY', 'display_address': ['4317 Queens Blvd', 'Sunnyside, NY 11104']}",+17187299900,(718) 729-9900,1320.6649526593071,$,"What a great little local bar. 

Came here for a friends birthday, Emma helped us set up the entire backyard space and was so sweet and attentive to us!...","They pride themselves on their Guinness pours. And the pours were good. Also enjoyed the chance to sit outside. Though as with most of the city, no-smoking...","This is the worst place to go if you want to have a drink. It's a bar, but the bartender just doesn't have people skills!","[{'open': [{'is_overnight': True, 'start': '1200', 'end': '0400', 'day': 0}, {'is_overnight': True, 'start': '1200', 'end': '0400', 'day': 1}, {'is_overnight': True, 'start': '1200', 'end': '0400', 'day': 2}, {'is_overnight': True, 'start': '1200', 'end': '0400', 'day': 3}, {'is_overnight': True, 'start': '1200', 'end': '0400', 'day': 4}, {'is_overnight': True, 'start': '1200', 'end': '0400', 'day': 5}, {'is_overnight': True, 'start': '1200', 'end': '0400', 'day': 6}], 'hours_type': 'REGULAR', 'is_open_now': True}]"
28,Z3qCwMMDCvCZnaqzpbgE1A,baby-grand-brooklyn,Baby Grand,https://s3-media3.fl.yelpcdn.com/bphoto/-xsDuFNuJOsSa17N6o5YLQ/o.jpg,False,https://www.yelp.com/biz/baby-grand-brooklyn?adjust_creative=xC4n-h7ZGIsND4SXpQ_Fzg&utm_campaign=yelp_api_v3&utm_medium=api_v3_business_search&utm_source=xC4n-h7ZGIsND4SXpQ_Fzg,11,"[{'alias': 'karaoke', 'title': 'Karaoke'}, {'alias': 'bars', 'title': 'Bars'}]",4.5,"{'latitude': 40.721385, 'longitude': -73.945829}",[],"{'address1': '55 McGuinness Blvd S', 'address2': '', 'address3': None, 'city': 'Brooklyn', 'zip_code': '11222', 'country': 'US', 'state': 'NY', 'display_address': ['55 McGuinness Blvd S', 'Brooklyn, NY 11222']}",+13474639106,(347) 463-9106,2764.083995076194,,"Nice place to chill, get tipsy and sing! They have a ton of choices by artist and by song. Definitely something a person like me can appreciate because I...",They only have ONE Aaron Carter song and it's not even the good one. Not to mention they refused to let me submit a Smash Mouth Classic as an alternative...,Baby Grand is a place in it's own category if I had to describe it. Not your traditional bar in that you're in queue waiting a good while for the bartender...,"[{'open': [{'is_overnight': True, 'start': '1800', 'end': '0100', 'day': 0}, {'is_overnight': True, 'start': '1800', 'end': '0100', 'day': 1}, {'is_overnight': True, 'start': '1800', 'end': '0200', 'day': 2}, {'is_overnight': True, 'start': '1800', 'end': '0200', 'day': 3}, {'is_overnight': True, 'start': '1800', 'end': '0200', 'day': 4}, {'is_overnight': True, 'start': '1900', 'end': '0200', 'day': 5}, {'is_overnight': False, 'start': '1900', 'end': '0000', 'day': 6}], 'hours_type': 'REGULAR', 'is_open_now': False}]"
29,9jceg0585cKrwBLarT9ftQ,our-wicked-lady-brooklyn,Our Wicked Lady,https://s3-media4.fl.yelpcdn.com/bphoto/hPBflgP1lnCH-Uw5RL8LfA/o.jpg,False,https://www.yelp.com/biz/our-wicked-lady-brooklyn?adjust_creative=xC4n-h7ZGIsND4SXpQ_Fzg&utm_campaign=yelp_api_v3&utm_medium=api_v3_business_search&utm_source=xC4n-h7ZGIsND4SXpQ_Fzg,60,"[{'alias': 'bars', 'title': 'Bars'}]",4.5,"{'latitude': 40.709384, 'longitude': -73.93333}",[],"{'address1': '153 Morgan Ave', 'address2': '', 'address3': '', 'city': 'Brooklyn', 'zip_code': '11237', 'country': 'US', 'state': 'NY', 'display_address': ['153 Morgan Ave', 'Brooklyn, NY 11237']}",,,3986.598480142551,$$,"I love this place! I've seen a few shows here both downstairs and on the beautiful rooftop. Smart spirit selection, cool DJs, great food vendor...","Fun bar with live music, interesting cocktails, and a nice open space.

Didn't get a chance to check out the rooftop since it was December, but looks cool...","Really nice open space with a wonderful happy hour specials! 

The main specialty cocktails are delicious, and bartender was friendly. 

Great bar to go...","[{'open': [{'is_overnight': True, 'start': '1700', 'end': '0200', 'day': 0}, {'is_overnight': True, 'start': '1700', 'end': '0200', 'day': 1}, {'is_overnight': True, 'start': '1700', 'end': '0400', 'day': 2}, {'is_overnight': True, 'start': '1700', 'end': '0400', 'day': 3}, {'is_overnight': True, 'start': '1700', 'end': '0400', 'day': 4}, {'is_overnight': True, 'start': '1600', 'end': '0400', 'day': 5}, {'is_overnight': True, 'start': '1600', 'end': '0200', 'day': 6}], 'hours_type': 'REGULAR', 'is_open_now': True}]"
30,bRTwfq_U02QbS9DkcKav9A,nightlife-party-club-and-vip-bottle-services-new-york,"Nightlife, Party, Club & VIP Bottle Services",https://s3-media2.fl.yelpcdn.com/bphoto/sFO9073EzEB6X4IiGy5QIA/o.jpg,False,https://www.yelp.com/biz/nightlife-party-club-and-vip-bottle-services-new-york?adjust_creative=xC4n-h7ZGIsND4SXpQ_Fzg&utm_campaign=yelp_api_v3&utm_medium=api_v3_business_search&utm_source=xC4n-h7ZGIsND4SXpQ_Fzg,1,"[{'alias': 'danceclubs', 'title': 'Dance Clubs'}, {'alias': 'eventplanning', 'title': 'Party & Event Planning'}]",5.0,"{'latitude': 40.74389, 'longitude': -74.00614}",[],"{'address1': '453 W 17th St', 'address2': None, 'address3': '', 'city': 'New York', 'zip_code': '10011', 'country': 'US', 'state': 'NY', 'display_address': ['453 W 17th St', 'New York, NY 10011']}",+13476918663,(347) 691-8663,5891.467832461885,,I can't even begin to rave about how much my friends and I LOVE Taras. He is hands down the best nyc promoter in the whole world. He was very communicative...,No Review,No Review,"[{'open': [{'is_overnight': True, 'start': '0000', 'end': '0000', 'day': 0}, {'is_overnight': True, 'start': '0000', 'end': '0000', 'day': 1}, {'is_overnight': True, 'start': '0000', 'end': '0000', 'day': 2}, {'is_overnight': True, 'start': '0000', 'end': '0000', 'day': 3}, {'is_overnight': True, 'start': '0000', 'end': '0000', 'day': 4}, {'is_overnight': True, 'start': '0000', 'end': '0000', 'day': 5}, {'is_overnight': True, 'start': '0000', 'end': '0000', 'day': 6}], 'hours_type': 'REGULAR', 'is_open_now': True}]"
