,id,alias,name,image_url,is_closed,url,review_count,categories,rating,coordinates,transactions,price,location,phone,display_phone,distance,rev1,rev2,rev3,hours
45,mES7fZAk9HHDgkQLQYDqOQ,gorilla-club-new-york,Gorilla Club,,False,https://www.yelp.com/biz/gorilla-club-new-york?adjust_creative=xC4n-h7ZGIsND4SXpQ_Fzg&utm_campaign=yelp_api_v3&utm_medium=api_v3_business_search&utm_source=xC4n-h7ZGIsND4SXpQ_Fzg,1,"[{'alias': 'musicvenues', 'title': 'Music Venues'}]",4.0,"{'latitude': 40.717273, 'longitude': -74.005401}",[],,"{'address1': '74 Leonard St', 'address2': '', 'address3': '', 'city': 'New York', 'zip_code': '10013', 'country': 'US', 'state': 'NY', 'display_address': ['74 Leonard St', 'New York, NY 10013']}",,,1672.517449353667,"A fantastic place to get lost and go a little bit wild... You'll find me here each and every week -- I hear it's a short-term ""pop up club,"" which makes me...",No Review,No Review,
46,0BzxIsoRuFvxbMPl-iH70A,market-table-new-york,Market Table,https://s3-media2.fl.yelpcdn.com/bphoto/5QGSKBgY571xzvtR5LjSSQ/o.jpg,False,https://www.yelp.com/biz/market-table-new-york?adjust_creative=xC4n-h7ZGIsND4SXpQ_Fzg&utm_campaign=yelp_api_v3&utm_medium=api_v3_business_search&utm_source=xC4n-h7ZGIsND4SXpQ_Fzg,790,"[{'alias': 'newamerican', 'title': 'American (New)'}, {'alias': 'desserts', 'title': 'Desserts'}, {'alias': 'cocktailbars', 'title': 'Cocktail Bars'}]",4.0,"{'latitude': 40.7297659255873, 'longitude': -74.0037665277862}",[],$$$,"{'address1': '54 Carmine St', 'address2': '', 'address3': '', 'city': 'New York', 'zip_code': '10014', 'country': 'US', 'state': 'NY', 'display_address': ['54 Carmine St', 'New York, NY 10014']}",+12122552100,(212) 255-2100,2120.2724799370576,"We had Thanksgiving dinner here. They were extremely busy and around 30 min late seating us but given the day we understood.

The menu was 90pp and...","Dropped in to Market Table for a work lunch. Had some great eats (the burger was amazing), but dessert definitely stole the show. The deconstructed Smore...","Good place to eat in the village.

If there were half stars this would have been 4.5.

Cool ambiance.  Not too loud.  A little cramped (to be expected in...","[{'open': [{'is_overnight': False, 'start': '1130', 'end': '2200', 'day': 0}, {'is_overnight': False, 'start': '1130', 'end': '2300', 'day': 1}, {'is_overnight': False, 'start': '1130', 'end': '2300', 'day': 2}, {'is_overnight': False, 'start': '1130', 'end': '2300', 'day': 3}, {'is_overnight': False, 'start': '1130', 'end': '0000', 'day': 4}, {'is_overnight': False, 'start': '1000', 'end': '0000', 'day': 5}, {'is_overnight': False, 'start': '1000', 'end': '2200', 'day': 6}], 'hours_type': 'REGULAR', 'is_open_now': True}]"
47,E3MkTTS4ZDjWV9YT5i6eUg,houseman-new-york,Houseman,https://s3-media3.fl.yelpcdn.com/bphoto/ntnSnnzbyH8PM28BMmi9Ng/o.jpg,False,https://www.yelp.com/biz/houseman-new-york?adjust_creative=xC4n-h7ZGIsND4SXpQ_Fzg&utm_campaign=yelp_api_v3&utm_medium=api_v3_business_search&utm_source=xC4n-h7ZGIsND4SXpQ_Fzg,108,"[{'alias': 'newamerican', 'title': 'American (New)'}, {'alias': 'burgers', 'title': 'Burgers'}, {'alias': 'wine_bars', 'title': 'Wine Bars'}]",4.0,"{'latitude': 40.7257220530562, 'longitude': -74.0094019}","['pickup', 'delivery']",$$$,"{'address1': '508 Greenwich St', 'address2': '', 'address3': '', 'city': 'New York', 'zip_code': '10013', 'country': 'US', 'state': 'NY', 'display_address': ['508 Greenwich St', 'New York, NY 10013']}",+12126410654,(212) 641-0654,2251.259634457492,Visiting NY for the holiday and we found this spot while strolling through the area. Restaurant is very small but clean and unique. The atmosphere was...,"Houseman is a charming and quiet little restaurant in the neighborhood. I had been wanting to check it out for a while, especially since its burger received...",I have been here many times....my company has an apartment across the street and I come to NYC often for business. Tonight...I called for a carry out meal...,"[{'open': [{'is_overnight': False, 'start': '1130', 'end': '1430', 'day': 0}, {'is_overnight': False, 'start': '1700', 'end': '2300', 'day': 0}, {'is_overnight': False, 'start': '1130', 'end': '1430', 'day': 1}, {'is_overnight': False, 'start': '1700', 'end': '2300', 'day': 1}, {'is_overnight': False, 'start': '1130', 'end': '1430', 'day': 2}, {'is_overnight': False, 'start': '1700', 'end': '2300', 'day': 2}, {'is_overnight': False, 'start': '1130', 'end': '1430', 'day': 3}, {'is_overnight': False, 'start': '1700', 'end': '2300', 'day': 3}, {'is_overnight': False, 'start': '1130', 'end': '1430', 'day': 4}, {'is_overnight': False, 'start': '1700', 'end': '2300', 'day': 4}, {'is_overnight': False, 'start': '1700', 'end': '2300', 'day': 5}, {'is_overnight': False, 'start': '1700', 'end': '2200', 'day': 6}], 'hours_type': 'REGULAR', 'is_open_now': False}]"
48,Z3S0qvlgerRBGwXWsJ9SeA,passatempo-new-york,Passatempo,https://s3-media1.fl.yelpcdn.com/bphoto/5U3CWUpkeLu-nuVk7CEezA/o.jpg,False,https://www.yelp.com/biz/passatempo-new-york?adjust_creative=xC4n-h7ZGIsND4SXpQ_Fzg&utm_campaign=yelp_api_v3&utm_medium=api_v3_business_search&utm_source=xC4n-h7ZGIsND4SXpQ_Fzg,54,"[{'alias': 'italian', 'title': 'Italian'}, {'alias': 'coffee', 'title': 'Coffee & Tea'}, {'alias': 'wine_bars', 'title': 'Wine Bars'}]",4.5,"{'latitude': 40.715837, 'longitude': -73.964147}","['pickup', 'delivery']",$$,"{'address1': '79 Grand St', 'address2': None, 'address3': '', 'city': 'New York', 'zip_code': '11249', 'country': 'US', 'state': 'NY', 'display_address': ['79 Grand St', 'New York, NY 11249']}",+17183881999,(718) 388-1999,1804.9355425067695,"Perfect paninis and risotto - and great beer. The service at Passatempo is awesome, the people are super great and the risotto is crazy delicious. I live in...","(4.5 stars) 

We stumbled upon this restaurant on the way to Domino Park. When we looked in there were couples drinking mimosas, flowers on the table, and...","Came here with a friend for lunch and some laptop co-working. While the food was decent (we got a panini and chicken salad, both looked and tasted great) we...","[{'open': [{'is_overnight': False, 'start': '1100', 'end': '2200', 'day': 0}, {'is_overnight': False, 'start': '1100', 'end': '2200', 'day': 1}, {'is_overnight': False, 'start': '1100', 'end': '2200', 'day': 2}, {'is_overnight': False, 'start': '1100', 'end': '2200', 'day': 3}, {'is_overnight': False, 'start': '1100', 'end': '2200', 'day': 4}, {'is_overnight': False, 'start': '1100', 'end': '2200', 'day': 5}, {'is_overnight': False, 'start': '1100', 'end': '2200', 'day': 6}], 'hours_type': 'REGULAR', 'is_open_now': True}]"
49,qOomR3AwClOGpV1HdqOTFg,les-enfants-de-boheme-new-york,Les Enfants de Boheme,https://s3-media3.fl.yelpcdn.com/bphoto/42W1l0mDi94x8gDUgROoLw/o.jpg,False,https://www.yelp.com/biz/les-enfants-de-boheme-new-york?adjust_creative=xC4n-h7ZGIsND4SXpQ_Fzg&utm_campaign=yelp_api_v3&utm_medium=api_v3_business_search&utm_source=xC4n-h7ZGIsND4SXpQ_Fzg,241,"[{'alias': 'french', 'title': 'French'}, {'alias': 'cocktailbars', 'title': 'Cocktail Bars'}, {'alias': 'wine_bars', 'title': 'Wine Bars'}]",4.5,"{'latitude': 40.7136187, 'longitude': -73.9888503}",['restaurant_reservation'],$$,"{'address1': '177 Henry St', 'address2': '', 'address3': '', 'city': 'New York', 'zip_code': '10002', 'country': 'US', 'state': 'NY', 'display_address': ['177 Henry St', 'New York, NY 10002']}",+16464764843,(646) 476-4843,426.00896474512,"This is an amazing, amazing bistro! I would say that it is a typical Parisian bistro except it is much, much better. I would gladly walk from Montparnasse...","I really like this place. It's a relaxed, yet a lil fancy French restaurant in a location without many of them around. You can get full service at the bar...",Stopped by this cool little cafe earlier today to meet a friend. The host/waitress was super cool and very friendly. My friend and I ended up getting the...,"[{'open': [{'is_overnight': False, 'start': '1145', 'end': '2345', 'day': 0}, {'is_overnight': True, 'start': '1145', 'end': '0100', 'day': 1}, {'is_overnight': True, 'start': '1145', 'end': '0200', 'day': 2}, {'is_overnight': True, 'start': '1145', 'end': '0200', 'day': 3}, {'is_overnight': True, 'start': '1145', 'end': '0300', 'day': 4}, {'is_overnight': True, 'start': '1000', 'end': '0200', 'day': 5}, {'is_overnight': False, 'start': '1000', 'end': '0000', 'day': 6}], 'hours_type': 'REGULAR', 'is_open_now': True}]"
