,id,alias,name,image_url,is_closed,url,review_count,categories,rating,coordinates,transactions,location,phone,display_phone,distance,price,rev1,rev2,rev3
42,Y7YvvF10F7RNr888Pf2FUw,rockbar-manhattan,RockBar,https://s3-media4.fl.yelpcdn.com/bphoto/x_AvdBaW1YpEfiC276GWNg/o.jpg,False,https://www.yelp.com/biz/rockbar-manhattan?adjust_creative=xC4n-h7ZGIsND4SXpQ_Fzg&utm_campaign=yelp_api_v3&utm_medium=api_v3_business_search&utm_source=xC4n-h7ZGIsND4SXpQ_Fzg,57,"[{'alias': 'gaybars', 'title': 'Gay Bars'}]",3.5,"{'latitude': 40.7326850891113, 'longitude': -74.0097274780273}",[],"{'address1': '185 Christopher St', 'address2': '', 'address3': '', 'city': 'Manhattan', 'zip_code': '10014', 'country': 'US', 'state': 'NY', 'display_address': ['185 Christopher St', 'Manhattan, NY 10014']}",+12126751864,(212) 675-1864,2706.1039383495977,$,"Great spot for this being my first bar visit in NYC. It's a gay bar that was full of wonderful people. The crowd was so relax, friendly, and beautiful. Lots...","Absolute train wreck, very poorly managed. I actually had to leave due to awful it smells. Feels like you're in a dumpster",Absolutely LOVE that Rockbar has become our home bar away from home. Every time we've been there we have had such a great time!! Dijoun and Patrick have...
43,Ai9zcAveCf-eRPup4HIXhw,shortys-new-york-3,Shorty's,https://s3-media2.fl.yelpcdn.com/bphoto/4bvvoogYSK6PC2FY2MEgaw/o.jpg,False,https://www.yelp.com/biz/shortys-new-york-3?adjust_creative=xC4n-h7ZGIsND4SXpQ_Fzg&utm_campaign=yelp_api_v3&utm_medium=api_v3_business_search&utm_source=xC4n-h7ZGIsND4SXpQ_Fzg,274,"[{'alias': 'sandwiches', 'title': 'Sandwiches'}, {'alias': 'bars', 'title': 'Bars'}, {'alias': 'steak', 'title': 'Steakhouses'}]",4.0,"{'latitude': 40.7034454, 'longitude': -74.0110779}","['pickup', 'delivery']","{'address1': '62 Pearl St', 'address2': '', 'address3': '', 'city': 'New York', 'zip_code': '10004', 'country': 'US', 'state': 'NY', 'display_address': ['62 Pearl St', 'New York, NY 10004']}",+12124803900,(212) 480-3900,2597.5813454856557,$$,"I love Shorty's! I can't believe I haven't written a review before this. I absolutely love their Phillys. Not only are they authentic, but there is...",I like Shorty's for the happy hour. Strong....potent drinks. If it's really busy it can take forever to get a drink so you might wanna order your 2 rounds...,Unfortunately the AC problem has resurfaced. My favorite post-work hangout is unbearable due to broken central AC. Not good for the patrons or the staff....
44,6Ct7OeTRn4caY9g0swFBsw,la-contenta-new-york,La Contenta,https://s3-media2.fl.yelpcdn.com/bphoto/FwZAyPgdKdPGQ8aAGKh3-w/o.jpg,False,https://www.yelp.com/biz/la-contenta-new-york?adjust_creative=xC4n-h7ZGIsND4SXpQ_Fzg&utm_campaign=yelp_api_v3&utm_medium=api_v3_business_search&utm_source=xC4n-h7ZGIsND4SXpQ_Fzg,747,"[{'alias': 'mexican', 'title': 'Mexican'}, {'alias': 'bars', 'title': 'Bars'}, {'alias': 'breakfast_brunch', 'title': 'Breakfast & Brunch'}]",4.5,"{'latitude': 40.71873, 'longitude': -73.98691}","['pickup', 'delivery']","{'address1': '102 Norfolk St', 'address2': '', 'address3': '', 'city': 'New York', 'zip_code': '10002', 'country': 'US', 'state': 'NY', 'display_address': ['102 Norfolk St', 'New York, NY 10002']}",+12124324180,(212) 432-4180,270.8658224716849,$$,"Dark, fun little Mexican spot with a great drink menu. 

We had a great experience the night we went and we will definitely be back. My friend was late...","Pretty decent spot for mexican food with a great drinks menu. They have a happy hour but it seems like it ends at 6. Long story short, their food is really...",I think the best part of this place was that my water cup was never empty. They had someone on water refills like that was the most important thing!  No...
45,bJdS98j_HTfyg-xUlu6V5A,dark-horse-new-york,Dark Horse,https://s3-media3.fl.yelpcdn.com/bphoto/yQtU8ANOVRzYyJ3l3aVGiw/o.jpg,False,https://www.yelp.com/biz/dark-horse-new-york?adjust_creative=xC4n-h7ZGIsND4SXpQ_Fzg&utm_campaign=yelp_api_v3&utm_medium=api_v3_business_search&utm_source=xC4n-h7ZGIsND4SXpQ_Fzg,395,"[{'alias': 'tradamerican', 'title': 'American (Traditional)'}, {'alias': 'sportsbars', 'title': 'Sports Bars'}]",4.0,"{'latitude': 40.713718, 'longitude': -74.008036}","['pickup', 'delivery']","{'address1': '17 Murray St', 'address2': '', 'address3': '', 'city': 'New York', 'zip_code': '10007', 'country': 'US', 'state': 'NY', 'display_address': ['17 Murray St', 'New York, NY 10007']}",+12126083900,(212) 608-3900,1923.4292294727325,$$,I've been coming to this bar ever since Lily's closed down across the street (rip) and I love it. The bartenders are awesome and the food is great. 10/10...,"Decent sports bar that's half restaurant, half bar. They have drink specials, but the prices are mostly for crap beer and well drinks (HH beer prices...","What a great spot for a pint and bite in Murray Hill - I came in at lunchtime and there was a healthy, but not overwhelming crowd. It's the perfect,..."
46,gV7qwWgeRWCahbopsHFE0Q,art-strings-ensembles-manhattan-2,Art-Strings Ensembles,https://s3-media1.fl.yelpcdn.com/bphoto/Tnqy01z-2T943NjSPzcngQ/o.jpg,False,https://www.yelp.com/biz/art-strings-ensembles-manhattan-2?adjust_creative=xC4n-h7ZGIsND4SXpQ_Fzg&utm_campaign=yelp_api_v3&utm_medium=api_v3_business_search&utm_source=xC4n-h7ZGIsND4SXpQ_Fzg,2,"[{'alias': 'theater', 'title': 'Performing Arts'}, {'alias': 'musicians', 'title': 'Musicians'}, {'alias': 'jazzandblues', 'title': 'Jazz & Blues'}]",5.0,"{'latitude': 40.71, 'longitude': -74.01}",[],"{'address1': None, 'address2': None, 'address3': '', 'city': 'Manhattan', 'zip_code': '10008', 'country': 'US', 'state': 'NY', 'display_address': ['Manhattan, NY 10008']}",+16464700047,(646) 470-0047,2189.2680809478,,"Art-Strings Ensembles played at our wedding on April 22nd in Massapequa, Long Island. There aren't enough words to express our appreciation for their...","We had our wedding in September aboard the Atlantica Yacht. We found Art-Strings Ensembles through another site, gig masters, which is why I realized they...",No Review
47,tlS26A8avYnfVXQ0l0Gvww,the-grisly-pear-new-york,The Grisly Pear,https://s3-media1.fl.yelpcdn.com/bphoto/dyo7Tzqnu37SvLld6FgdrQ/o.jpg,False,https://www.yelp.com/biz/the-grisly-pear-new-york?adjust_creative=xC4n-h7ZGIsND4SXpQ_Fzg&utm_campaign=yelp_api_v3&utm_medium=api_v3_business_search&utm_source=xC4n-h7ZGIsND4SXpQ_Fzg,201,"[{'alias': 'pubs', 'title': 'Pubs'}, {'alias': 'tradamerican', 'title': 'American (Traditional)'}, {'alias': 'comedyclubs', 'title': 'Comedy Clubs'}]",3.5,"{'latitude': 40.729991, 'longitude': -74.000756}",[],"{'address1': '107 Macdougal St', 'address2': 'Ste A', 'address3': '', 'city': 'New York', 'zip_code': '10012', 'country': 'US', 'state': 'NY', 'display_address': ['107 Macdougal St', 'Ste A', 'New York, NY 10012']}",+12125293808,(212) 529-3808,1963.2305459823463,$$,"This is a small joint in the West Village, I guess you call it a diva bar (Scottish/Irish bar). Nothing special about the place but worth visiting because...",This was our first time in the Grisly Pear today and we absolutely loved hanging out here. Rich is an awesome bartender! He totally took care of us and he...,"The Grisly Pear Comedy Club is a special place in the heart of the West Village, NYC.  Not only was it featured on HBO's hit series ""Crashing"", but it has..."
48,9epyzBMgOVV71p22eYyjRA,highlands-nyc-new-york,Highlands NYC,https://s3-media1.fl.yelpcdn.com/bphoto/M5G3dADiJK99SjtqzgN98A/o.jpg,False,https://www.yelp.com/biz/highlands-nyc-new-york?adjust_creative=xC4n-h7ZGIsND4SXpQ_Fzg&utm_campaign=yelp_api_v3&utm_medium=api_v3_business_search&utm_source=xC4n-h7ZGIsND4SXpQ_Fzg,404,"[{'alias': 'gastropubs', 'title': 'Gastropubs'}, {'alias': 'scottish', 'title': 'Scottish'}, {'alias': 'whiskeybars', 'title': 'Whiskey Bars'}]",4.0,"{'latitude': 40.734345, 'longitude': -74.0010957}",[],"{'address1': '150 W 10th St', 'address2': '', 'address3': '', 'city': 'New York', 'zip_code': '10014', 'country': 'US', 'state': 'NY', 'display_address': ['150 W 10th St', 'New York, NY 10014']}",+12122292670,(212) 229-2670,2366.889937799669,$$,"Came here for a friend's birthday brunch which offers bottomless mimosas, bloody marys, moscow mule and aperol spritzin'. Service was great and do I enjoy...","""Its not what it used to be""

This gastropub for Scotch connoisseurs is a unique spot in the West Village. When it opened, it seemed to focus on being more...","Went here for the Beef Wellington. I guess I've watched too much Gordon Ramsey shows. It cost around $34.00 with tax. It was okay, nothing to write home to..."
49,FCqKzOUM6DAxjU_xkXdhzg,royale-new-york,Royale,https://s3-media3.fl.yelpcdn.com/bphoto/0T7kxjAVbnhk07kwI6zM7A/o.jpg,False,https://www.yelp.com/biz/royale-new-york?adjust_creative=xC4n-h7ZGIsND4SXpQ_Fzg&utm_campaign=yelp_api_v3&utm_medium=api_v3_business_search&utm_source=xC4n-h7ZGIsND4SXpQ_Fzg,467,"[{'alias': 'burgers', 'title': 'Burgers'}, {'alias': 'bars', 'title': 'Bars'}]",4.0,"{'latitude': 40.7258174842573, 'longitude': -73.9778455564146}","['pickup', 'delivery']","{'address1': '157 Ave C', 'address2': None, 'address3': '', 'city': 'New York', 'zip_code': '10009', 'country': 'US', 'state': 'NY', 'display_address': ['157 Ave C', 'New York, NY 10009']}",+12122546600,(212) 254-6600,1210.6605570561578,$$,I am a resident of the neighborhood .  I am pleased that Royale has remained open despite the hardships we are living under . I urge all that can to reached...,"This is base on a review from October 2012 , , decided to have to go to this place for the burgers  especially being a fan of The Movie  Pulp Fiction! Went...",Really enjoyed this place with a great outdoor patio. Ordered the four grilled cheese and onion rings (along with a couple of beers). I'm not much of a...
