,id,alias,name,image_url,is_closed,url,review_count,categories,rating,coordinates,transactions,price,location,phone,display_phone,distance,rev1,rev2,rev3,hours
0,iNJDjdm3C9pUTiEcSxOtCA,tom-and-jerrys-new-york,Tom & Jerry's,https://s3-media2.fl.yelpcdn.com/bphoto/D-GOZQsEv3QMJP5k4MNbYA/o.jpg,False,https://www.yelp.com/biz/tom-and-jerrys-new-york?adjust_creative=xC4n-h7ZGIsND4SXpQ_Fzg&utm_campaign=yelp_api_v3&utm_medium=api_v3_business_search&utm_source=xC4n-h7ZGIsND4SXpQ_Fzg,257,"[{'alias': 'bars', 'title': 'Bars'}]",4.0,"{'latitude': 40.724617, 'longitude': -73.993156}",[],$$,"{'address1': '288 Elizabeth St', 'address2': '', 'address3': '', 'city': 'New York', 'zip_code': '10012', 'country': 'US', 'state': 'NY', 'display_address': ['288 Elizabeth St', 'New York, NY 10012']}",+12122605045,(212) 260-5045,1103.6362293993163,"This is a great dive bar.

The service is incredible. The bartenders are so awesome.
 
The price point is great and have options for everyone. This is cash...","Solid happy hour with $6 drafts, and good drafts at it.

Friendly bartender. Cash only, which is meh.

A life-saving dive in an expensive, gentrified...","Dive bar with reasonable pricing in NY.  Good, quick service and the happy hour was good. $4 for a 1/2 pint... $6 for pints (during happy hour.) and...","[{'open': [{'is_overnight': True, 'start': '1200', 'end': '0400', 'day': 0}, {'is_overnight': True, 'start': '1200', 'end': '0400', 'day': 1}, {'is_overnight': True, 'start': '1200', 'end': '0400', 'day': 2}, {'is_overnight': True, 'start': '1200', 'end': '0400', 'day': 3}, {'is_overnight': True, 'start': '1200', 'end': '0400', 'day': 4}, {'is_overnight': True, 'start': '1200', 'end': '0400', 'day': 5}, {'is_overnight': True, 'start': '1200', 'end': '0400', 'day': 6}], 'hours_type': 'REGULAR', 'is_open_now': True}]"
1,7uJBW357VM1x57vBbILrgQ,clandestino-new-york,Clandestino,https://s3-media3.fl.yelpcdn.com/bphoto/cxbDjaRrYhYMDATd3kbgog/o.jpg,False,https://www.yelp.com/biz/clandestino-new-york?adjust_creative=xC4n-h7ZGIsND4SXpQ_Fzg&utm_campaign=yelp_api_v3&utm_medium=api_v3_business_search&utm_source=xC4n-h7ZGIsND4SXpQ_Fzg,104,"[{'alias': 'bars', 'title': 'Bars'}]",4.0,"{'latitude': 40.714775, 'longitude': -73.990852}",[],$$,"{'address1': '35 Canal St', 'address2': None, 'address3': '', 'city': 'New York', 'zip_code': '10002', 'country': 'US', 'state': 'NY', 'display_address': ['35 Canal St', 'New York, NY 10002']}",+12124755505,(212) 475-5505,488.2764345407232,"Was there on an off holiday night and still had great service, drinks and traditional barkeeping (like buybacks, they remember you, they make you slightly...","All form no function, and beyond rude. One person in my group ordered a dirty martini and that seemed to confuse the bartender. When asked for details he...","RUDE, INATTENTIVE BARTENDER! I've never had such an experience at a bar EVER. A chunky redhead bartender had the nerve to NOT bring the wine bottle that my...","[{'open': [{'is_overnight': True, 'start': '1900', 'end': '0400', 'day': 0}, {'is_overnight': True, 'start': '1900', 'end': '0400', 'day': 1}, {'is_overnight': True, 'start': '1900', 'end': '0400', 'day': 2}, {'is_overnight': True, 'start': '1900', 'end': '0400', 'day': 3}, {'is_overnight': True, 'start': '1600', 'end': '0400', 'day': 4}, {'is_overnight': True, 'start': '1600', 'end': '0400', 'day': 5}, {'is_overnight': True, 'start': '1600', 'end': '0400', 'day': 6}], 'hours_type': 'REGULAR', 'is_open_now': True}]"
2,c3Ww3pgeHjBi3ctkeUWrjQ,whiskey-tavern-new-york,Whiskey Tavern,https://s3-media1.fl.yelpcdn.com/bphoto/KU5JYSBFH2ABuf9JbPloOA/o.jpg,False,https://www.yelp.com/biz/whiskey-tavern-new-york?adjust_creative=xC4n-h7ZGIsND4SXpQ_Fzg&utm_campaign=yelp_api_v3&utm_medium=api_v3_business_search&utm_source=xC4n-h7ZGIsND4SXpQ_Fzg,783,"[{'alias': 'whiskeybars', 'title': 'Whiskey Bars'}]",4.5,"{'latitude': 40.71646, 'longitude': -73.99969}",[],$$,"{'address1': '79 Baxter St', 'address2': '', 'address3': '', 'city': 'New York', 'zip_code': '10013', 'country': 'US', 'state': 'NY', 'display_address': ['79 Baxter St', 'New York, NY 10013']}",+12123749119,(212) 374-9119,1197.2886342374723,I've heard and read a ton of great comments about Whiskey Tavern and so my friends and I finally went the other night and it did not disappoint. It is a...,"Truly overdue review for Whiskey Tavern. Yes, the best irish bar in the city is in Chinatown and if you disagree, go ahead, go to fucking Tir de Nog 40...","The only thing I need to mention is Alex (female) our server. Yes, you can have a great time here, but if she is waiting on you, you will have an especially...","[{'open': [{'is_overnight': True, 'start': '1100', 'end': '0400', 'day': 0}, {'is_overnight': True, 'start': '1100', 'end': '0400', 'day': 1}, {'is_overnight': True, 'start': '1100', 'end': '0400', 'day': 2}, {'is_overnight': True, 'start': '1100', 'end': '0400', 'day': 3}, {'is_overnight': True, 'start': '1100', 'end': '0400', 'day': 4}, {'is_overnight': True, 'start': '1100', 'end': '0400', 'day': 5}, {'is_overnight': True, 'start': '1200', 'end': '0400', 'day': 6}], 'hours_type': 'REGULAR', 'is_open_now': True}]"
3,tWr-p82DJd1mGjn2oE3bcg,tba-brooklyn-new-york,TBA Brooklyn,https://s3-media2.fl.yelpcdn.com/bphoto/0unQRx6Z-5-fljQs5nR9TA/o.jpg,False,https://www.yelp.com/biz/tba-brooklyn-new-york?adjust_creative=xC4n-h7ZGIsND4SXpQ_Fzg&utm_campaign=yelp_api_v3&utm_medium=api_v3_business_search&utm_source=xC4n-h7ZGIsND4SXpQ_Fzg,45,"[{'alias': 'danceclubs', 'title': 'Dance Clubs'}, {'alias': 'lounges', 'title': 'Lounges'}]",3.5,"{'latitude': 40.711256, 'longitude': -73.9663559}",[],$$,"{'address1': '395 Wythe Ave', 'address2': '', 'address3': '', 'city': 'New York', 'zip_code': '11249', 'country': 'US', 'state': 'NY', 'display_address': ['395 Wythe Ave', 'New York, NY 11249']}",+13477704760,(347) 770-4760,1723.3688890844437,"Laid back.

Can't go wrong with TBA. It has a very interesting vibe. Warehouse style space with a large bar and dance area - late night is always solid, and...",Came here for the live music. Cover was 20 bucks a person. I didn't want to pay for that but my date did so we went anyways. Drinks are fairly priced and...,"I came for a friend's birthday party during happy hour and was excited finally to visit this legendary spot.

The sound system is really, really good....","[{'open': [{'is_overnight': True, 'start': '1800', 'end': '0400', 'day': 1}, {'is_overnight': True, 'start': '1800', 'end': '0400', 'day': 2}, {'is_overnight': True, 'start': '1800', 'end': '0400', 'day': 3}, {'is_overnight': True, 'start': '1800', 'end': '0400', 'day': 4}, {'is_overnight': True, 'start': '2100', 'end': '0400', 'day': 5}, {'is_overnight': True, 'start': '2200', 'end': '0400', 'day': 6}], 'hours_type': 'REGULAR', 'is_open_now': False}]"
4,xoib7cempnEnobtE-EbV-Q,club-82-new-york,Club 82,https://s3-media3.fl.yelpcdn.com/bphoto/_78RCTt0AKOHBWqzpJRGUw/o.jpg,False,https://www.yelp.com/biz/club-82-new-york?adjust_creative=xC4n-h7ZGIsND4SXpQ_Fzg&utm_campaign=yelp_api_v3&utm_medium=api_v3_business_search&utm_source=xC4n-h7ZGIsND4SXpQ_Fzg,1,"[{'alias': 'bars', 'title': 'Bars'}]",4.0,"{'latitude': 40.7261847840178, 'longitude': -73.9895117038618}",[],,"{'address1': '82 E 4th St', 'address2': '', 'address3': '', 'city': 'New York', 'zip_code': '10003', 'country': 'US', 'state': 'NY', 'display_address': ['82 E 4th St', 'New York, NY 10003']}",+12126744413,(212) 674-4413,1114.760949500299,"The first time, and to date, last time I was there I had a GREAT time. I'd love to do that again real soon this year and many more times this year too.",No Review,No Review,"[{'open': [{'is_overnight': True, 'start': '0900', 'end': '0400', 'day': 0}, {'is_overnight': True, 'start': '0900', 'end': '0400', 'day': 1}, {'is_overnight': True, 'start': '0900', 'end': '0400', 'day': 2}, {'is_overnight': True, 'start': '0900', 'end': '0400', 'day': 3}, {'is_overnight': True, 'start': '0900', 'end': '0400', 'day': 4}, {'is_overnight': True, 'start': '0900', 'end': '0400', 'day': 5}, {'is_overnight': True, 'start': '0900', 'end': '0400', 'day': 6}], 'hours_type': 'REGULAR', 'is_open_now': True}]"
5,_MCfOOcGd4AYTuwH0NR6lg,sweet-and-vicious-new-york,Sweet & Vicious,https://s3-media4.fl.yelpcdn.com/bphoto/uWKzforFUUXgTbK-e4VpnQ/o.jpg,False,https://www.yelp.com/biz/sweet-and-vicious-new-york?adjust_creative=xC4n-h7ZGIsND4SXpQ_Fzg&utm_campaign=yelp_api_v3&utm_medium=api_v3_business_search&utm_source=xC4n-h7ZGIsND4SXpQ_Fzg,548,"[{'alias': 'bars', 'title': 'Bars'}]",3.0,"{'latitude': 40.72136, 'longitude': -73.99426}",[],$$,"{'address1': '5 Spring St', 'address2': '', 'address3': '', 'city': 'New York', 'zip_code': '10012', 'country': 'US', 'state': 'NY', 'display_address': ['5 Spring St', 'New York, NY 10012']}",+12123347915,(212) 334-7915,903.2271539218615,"Where can I start... 

Not only was I blown away by the genre bending and inspiring selection of music, but the management is what's prompting this glowing...",Walked over here from dinner in Little Italy. Nice place to get the night started. Age-wise it might be a early-mid 20's vibe in there. More of a pull up...,"Loved this bar! I had never been, but it's a favorite among a couple of my friends. We had another friend in town and decided to meet up here earlier in the...","[{'open': [{'is_overnight': True, 'start': '1400', 'end': '0400', 'day': 0}, {'is_overnight': True, 'start': '1400', 'end': '0400', 'day': 1}, {'is_overnight': True, 'start': '1400', 'end': '0400', 'day': 2}, {'is_overnight': True, 'start': '1400', 'end': '0400', 'day': 3}, {'is_overnight': True, 'start': '1400', 'end': '0400', 'day': 4}, {'is_overnight': True, 'start': '1400', 'end': '0400', 'day': 5}, {'is_overnight': True, 'start': '1400', 'end': '0400', 'day': 6}], 'hours_type': 'REGULAR', 'is_open_now': True}]"
6,i9lb9COb9MyX22vm2Mx6Kg,the-unmasked-valentine-masquerade-ball-new-york,The Unmasked Valentine Masquerade Ball,https://s3-media2.fl.yelpcdn.com/bphoto/4czBW8xyDaE6nKsEjZlOSg/o.jpg,False,https://www.yelp.com/biz/the-unmasked-valentine-masquerade-ball-new-york?adjust_creative=xC4n-h7ZGIsND4SXpQ_Fzg&utm_campaign=yelp_api_v3&utm_medium=api_v3_business_search&utm_source=xC4n-h7ZGIsND4SXpQ_Fzg,1,"[{'alias': 'danceclubs', 'title': 'Dance Clubs'}]",4.0,"{'latitude': 40.7205085754395, 'longitude': -73.9971008300781}",[],,"{'address1': '389 Broome St', 'address2': '', 'address3': 'Goldbar', 'city': 'New York', 'zip_code': '10013', 'country': 'US', 'state': 'NY', 'display_address': ['389 Broome St', 'Goldbar', 'New York, NY 10013']}",,,1065.9566711270534,"I had a ball!!! Actually,  the ball wasn't as fun as I anticipated.  The venue was narrow and short and the drinks were very expensive.  However, everyone...",No Review,No Review,
7,-dQexkmhlgbiKvZ94jBmjQ,dear-irving-new-york,Dear Irving,https://s3-media3.fl.yelpcdn.com/bphoto/OElWI1r3u6qkAiu0_MxXmg/o.jpg,False,https://www.yelp.com/biz/dear-irving-new-york?adjust_creative=xC4n-h7ZGIsND4SXpQ_Fzg&utm_campaign=yelp_api_v3&utm_medium=api_v3_business_search&utm_source=xC4n-h7ZGIsND4SXpQ_Fzg,643,"[{'alias': 'venues', 'title': 'Venues & Event Spaces'}, {'alias': 'cocktailbars', 'title': 'Cocktail Bars'}, {'alias': 'lounges', 'title': 'Lounges'}]",4.0,"{'latitude': 40.7360568971331, 'longitude': -73.9872401005554}",[],$$$,"{'address1': '55 Irving Pl', 'address2': '', 'address3': '', 'city': 'New York', 'zip_code': '10003', 'country': 'US', 'state': 'NY', 'display_address': ['55 Irving Pl', 'New York, NY 10003']}",,,2165.7651453086974,"My night started off being greeted by the most perfect service angel I've ever had the pleasure of knowing, Jamie. She sold me the Grove Groove which put me...",Great upscale drinks spot! Came here with another couple on a Thursday night around 6:30 and it was packed! I suggest making a reservation through Resy if...,"I loved the drinks. I loved the vibe. The space is beautiful and I always like a place that has a call button for service! 

I didn't realize it was a...","[{'open': [{'is_overnight': True, 'start': '1700', 'end': '0200', 'day': 0}, {'is_overnight': True, 'start': '1700', 'end': '0200', 'day': 1}, {'is_overnight': True, 'start': '1700', 'end': '0200', 'day': 2}, {'is_overnight': True, 'start': '1700', 'end': '0200', 'day': 3}, {'is_overnight': True, 'start': '1700', 'end': '0200', 'day': 4}, {'is_overnight': True, 'start': '1700', 'end': '0200', 'day': 5}, {'is_overnight': True, 'start': '1700', 'end': '0100', 'day': 6}], 'hours_type': 'REGULAR', 'is_open_now': False}]"
8,vkQSMwAf5yqDw9HfEQYgzw,the-flower-shop-new-york-2,The Flower Shop,https://s3-media2.fl.yelpcdn.com/bphoto/raG7FHaFJ2ZGvBK2fG2TJQ/o.jpg,False,https://www.yelp.com/biz/the-flower-shop-new-york-2?adjust_creative=xC4n-h7ZGIsND4SXpQ_Fzg&utm_campaign=yelp_api_v3&utm_medium=api_v3_business_search&utm_source=xC4n-h7ZGIsND4SXpQ_Fzg,123,"[{'alias': 'newamerican', 'title': 'American (New)'}, {'alias': 'pubs', 'title': 'Pubs'}]",4.0,"{'latitude': 40.71807, 'longitude': -73.99213}","['delivery', 'pickup']",$$,"{'address1': '107 Eldridge St', 'address2': '', 'address3': None, 'city': 'New York', 'zip_code': '10002', 'country': 'US', 'state': 'NY', 'display_address': ['107 Eldridge St', 'New York, NY 10002']}",+12122574072,(212) 257-4072,593.5382537054661,"I became hip to this too-cool-for-school bar when they first opened, when everyone who was somebody could be found here on a weekend night. Don't worry...","Came for an event specifically for people NOT to use their smartphones.  I was in a downstairs area, no one served me even when I went up to the bar area....","Got the fried chicken and the cauliflower steak.

The fried chicken was honesty really good, one of the better ones I've had in the city. I would rate it as...","[{'open': [{'is_overnight': False, 'start': '1700', 'end': '0000', 'day': 0}, {'is_overnight': False, 'start': '1700', 'end': '0000', 'day': 1}, {'is_overnight': False, 'start': '1700', 'end': '0000', 'day': 2}, {'is_overnight': True, 'start': '1700', 'end': '0200', 'day': 3}, {'is_overnight': True, 'start': '1700', 'end': '0200', 'day': 4}, {'is_overnight': True, 'start': '1600', 'end': '0200', 'day': 5}, {'is_overnight': False, 'start': '1700', 'end': '0000', 'day': 6}], 'hours_type': 'REGULAR', 'is_open_now': False}]"
9,nsnPyoDYc_fYCxZfgKdzmw,82-stanton-new-york-6,82 Stanton,https://s3-media2.fl.yelpcdn.com/bphoto/XXSewYUvinBNgaMkY7qjCw/o.jpg,False,https://www.yelp.com/biz/82-stanton-new-york-6?adjust_creative=xC4n-h7ZGIsND4SXpQ_Fzg&utm_campaign=yelp_api_v3&utm_medium=api_v3_business_search&utm_source=xC4n-h7ZGIsND4SXpQ_Fzg,12,"[{'alias': 'bars', 'title': 'Bars'}, {'alias': 'newamerican', 'title': 'American (New)'}, {'alias': 'burgers', 'title': 'Burgers'}]",4.5,"{'latitude': 40.721701, 'longitude': -73.988817}","['delivery', 'pickup']",$$,"{'address1': '82 Stanton St', 'address2': '', 'address3': None, 'city': 'New York', 'zip_code': '10002', 'country': 'US', 'state': 'NY', 'display_address': ['82 Stanton St', 'New York, NY 10002']}",+12124732010,(212) 473-2010,628.68283985426,"5 stars all the way!!!

I looked near and high for a bar to hold my 25th birthday dinner, but being a December baby, everywhere had insane minimums and/or...","Came here with a friend for their happy hour specials which includes wine, draft, and margaritas under $8 and sliders for $3. 

Their happy hour ends at 7...","Stopped by here for brunch when we were walking in the lower east side and saw a sign for $25 entree and 2 drinks! 

At 3pm it was popping inside! Lots of...","[{'open': [{'is_overnight': True, 'start': '1500', 'end': '0030', 'day': 0}, {'is_overnight': True, 'start': '1500', 'end': '0030', 'day': 1}, {'is_overnight': True, 'start': '1500', 'end': '0100', 'day': 2}, {'is_overnight': True, 'start': '1500', 'end': '0200', 'day': 3}, {'is_overnight': True, 'start': '1500', 'end': '0200', 'day': 4}, {'is_overnight': True, 'start': '1100', 'end': '0200', 'day': 5}, {'is_overnight': True, 'start': '1100', 'end': '0030', 'day': 6}], 'hours_type': 'REGULAR', 'is_open_now': True}]"
10,J0toV5NSvtQ0gmfZtswTdw,the-hard-swallow-new-york,The Hard Swallow,https://s3-media2.fl.yelpcdn.com/bphoto/TDc-DUVgTSiT-Hrsmg09yQ/o.jpg,False,https://www.yelp.com/biz/the-hard-swallow-new-york?adjust_creative=xC4n-h7ZGIsND4SXpQ_Fzg&utm_campaign=yelp_api_v3&utm_medium=api_v3_business_search&utm_source=xC4n-h7ZGIsND4SXpQ_Fzg,42,"[{'alias': 'divebars', 'title': 'Dive Bars'}, {'alias': 'newamerican', 'title': 'American (New)'}]",4.5,"{'latitude': 40.7278, 'longitude': -73.9848}","['delivery', 'pickup']",$,"{'address1': '140 1st Ave', 'address2': None, 'address3': '', 'city': 'New York', 'zip_code': '10009', 'country': 'US', 'state': 'NY', 'display_address': ['140 1st Ave', 'New York, NY 10009']}",+12122560124,(212) 256-0124,1247.5266496655752,"So much has changed in the EV in the last 15 years, but Cheap Shots, I mean Spanky and Darla's, I mean Big Lee's Saloon, I mean The Hard Swallow, remains to...","This bar changed hands many many times and you know what,They got it right..
Excellent cool atmosphere Great music when I was there by 80's icon DJ...",Decent local dive bar with a long bar on the left and counter on the opposite wall.  I did not see any tables.  Music today was moderately loud rock....,"[{'open': [{'is_overnight': True, 'start': '1200', 'end': '0400', 'day': 0}, {'is_overnight': True, 'start': '1200', 'end': '0400', 'day': 1}, {'is_overnight': True, 'start': '1200', 'end': '0400', 'day': 2}, {'is_overnight': True, 'start': '1200', 'end': '0400', 'day': 3}, {'is_overnight': True, 'start': '1200', 'end': '0400', 'day': 4}, {'is_overnight': True, 'start': '1200', 'end': '0400', 'day': 5}, {'is_overnight': True, 'start': '1200', 'end': '0400', 'day': 6}], 'hours_type': 'REGULAR', 'is_open_now': True}]"
11,LyQbiCA-3mXqR6WhO-3s8A,windmill-new-york,Windmill,https://s3-media4.fl.yelpcdn.com/bphoto/lRYHP5UDiLnpSbo6HY7JWA/o.jpg,False,https://www.yelp.com/biz/windmill-new-york?adjust_creative=xC4n-h7ZGIsND4SXpQ_Fzg&utm_campaign=yelp_api_v3&utm_medium=api_v3_business_search&utm_source=xC4n-h7ZGIsND4SXpQ_Fzg,18,"[{'alias': 'cocktailbars', 'title': 'Cocktail Bars'}, {'alias': 'french', 'title': 'French'}]",4.5,"{'latitude': 40.71996, 'longitude': -73.9849}",[],,"{'address1': '43 Clinton St', 'address2': '', 'address3': None, 'city': 'New York', 'zip_code': '10002', 'country': 'US', 'state': 'NY', 'display_address': ['43 Clinton St', 'New York, NY 10002']}",,,374.48328467126527,"Windmill is a stylish little LES bar from established bartender Sother Teague (Amor y Amargo) and the folks behind Le French Diner, an intimate restaurant...","Cocktails were good, but this is a ""cash only"" bar.... 
It was a Friday night we just drank and chilled till we were the only group left in the bar. 
The...","Taking over the now defunct Galeria space is Windmill--a bar with roots stemming from Amor y Amargo as well as Le French Diner on Orchard Street.

It's a...",
12,dL8gadXiTWIoWzVReq_BGw,bob-bar-new-york,bOb Bar,https://s3-media1.fl.yelpcdn.com/bphoto/yiJrGxdaKlq3xYtAsvIqOg/o.jpg,False,https://www.yelp.com/biz/bob-bar-new-york?adjust_creative=xC4n-h7ZGIsND4SXpQ_Fzg&utm_campaign=yelp_api_v3&utm_medium=api_v3_business_search&utm_source=xC4n-h7ZGIsND4SXpQ_Fzg,739,"[{'alias': 'lounges', 'title': 'Lounges'}]",3.5,"{'latitude': 40.72241, 'longitude': -73.9899}",[],$$,"{'address1': '235 Eldridge St', 'address2': '', 'address3': '', 'city': 'New York', 'zip_code': '10002', 'country': 'US', 'state': 'NY', 'display_address': ['235 Eldridge St', 'New York, NY 10002']}",+12125291807,(212) 529-1807,747.968503105131,Bob bar is full of excitement and brings me a bundle of joy each time i go. Drinks are moderately priced and there is plenty of room to get down and let...,"Music was ON POINT

we came all the way from AZ to celebrate my cousins 21st.. and this could not have been a better spot. Drink prices were decent,...",I'd heard great things about bOb Bar. A friend of a friend had celebrated her birthday here and raved about the vibes and old school music they played. So...,"[{'open': [{'is_overnight': True, 'start': '1900', 'end': '0400', 'day': 2}, {'is_overnight': True, 'start': '1900', 'end': '0400', 'day': 3}, {'is_overnight': True, 'start': '1900', 'end': '0400', 'day': 4}, {'is_overnight': True, 'start': '1900', 'end': '0400', 'day': 5}], 'hours_type': 'REGULAR', 'is_open_now': False}]"
13,wJHtwCLNpV_0tL68ogvQkg,bedlam-new-york,Bedlam,https://s3-media2.fl.yelpcdn.com/bphoto/m_yIojHdGEYTV1JXKSGzpg/o.jpg,False,https://www.yelp.com/biz/bedlam-new-york?adjust_creative=xC4n-h7ZGIsND4SXpQ_Fzg&utm_campaign=yelp_api_v3&utm_medium=api_v3_business_search&utm_source=xC4n-h7ZGIsND4SXpQ_Fzg,79,"[{'alias': 'danceclubs', 'title': 'Dance Clubs'}, {'alias': 'cocktailbars', 'title': 'Cocktail Bars'}]",3.0,"{'latitude': 40.72178, 'longitude': -73.98021}",[],$$,"{'address1': '40 Ave C', 'address2': '', 'address3': '', 'city': 'New York', 'zip_code': '10009', 'country': 'US', 'state': 'NY', 'display_address': ['40 Ave C', 'New York, NY 10009']}",+16468700150,(646) 870-0150,728.790483557698,"How can you not like a place with a moose head?

I have lived in this city for YEARS and I have never heard (or seen) of this place. That said, I feel like...","Went for Dixie's Tupperware Party and had a fantastic night! Staff was super friendly, they had reasonable drink prices, and a clean (but small) bathroom....",The place looks super cool. Full of weird stuff and some taxidermy. The only thing I would change is the bathroom walls would be covered in death...,"[{'open': [{'is_overnight': True, 'start': '2100', 'end': '0100', 'day': 0}, {'is_overnight': True, 'start': '2100', 'end': '0100', 'day': 2}, {'is_overnight': True, 'start': '2100', 'end': '0100', 'day': 3}, {'is_overnight': True, 'start': '2000', 'end': '0400', 'day': 4}, {'is_overnight': True, 'start': '2000', 'end': '0400', 'day': 5}, {'is_overnight': True, 'start': '1915', 'end': '0200', 'day': 6}], 'hours_type': 'REGULAR', 'is_open_now': False}]"
14,kt77PF-PfvsY5aGv0UGeNA,juke-bar-new-york,Juke Bar,https://s3-media2.fl.yelpcdn.com/bphoto/Lap49bQ0shhDDu-PV0lC_g/o.jpg,False,https://www.yelp.com/biz/juke-bar-new-york?adjust_creative=xC4n-h7ZGIsND4SXpQ_Fzg&utm_campaign=yelp_api_v3&utm_medium=api_v3_business_search&utm_source=xC4n-h7ZGIsND4SXpQ_Fzg,262,"[{'alias': 'bars', 'title': 'Bars'}]",4.5,"{'latitude': 40.731098, 'longitude': -73.985611}",['pickup'],$$,"{'address1': '196 2nd Ave', 'address2': None, 'address3': '', 'city': 'New York', 'zip_code': '10003', 'country': 'US', 'state': 'NY', 'display_address': ['196 2nd Ave', 'New York, NY 10003']}",+12122287464,(212) 228-7464,1609.621146891412,"I just loved it at Juke Bar! 

Cool patrons, stiff drinks and an amazing DJ who understood his audience. Even the flooded toilet leaving us with just the...","The bar is fun, great time. It's got a large bar, dancing, seating.. it's got it all. It was a busy halloween night and the sympathetic bartender offered me...",Came here for an informal engagement party and had so much fun! We were in a semi-private area close to the bar. Service was great and they had some good...,"[{'open': [{'is_overnight': True, 'start': '1700', 'end': '0200', 'day': 0}, {'is_overnight': True, 'start': '1700', 'end': '0200', 'day': 1}, {'is_overnight': True, 'start': '1700', 'end': '0200', 'day': 2}, {'is_overnight': True, 'start': '1700', 'end': '0200', 'day': 3}, {'is_overnight': True, 'start': '1700', 'end': '0400', 'day': 4}, {'is_overnight': True, 'start': '1700', 'end': '0400', 'day': 5}, {'is_overnight': True, 'start': '1700', 'end': '0200', 'day': 6}], 'hours_type': 'REGULAR', 'is_open_now': False}]"
15,kofuepCrLJ4kWHGx-775DQ,downtime-bar-new-york,Downtime Bar,https://s3-media4.fl.yelpcdn.com/bphoto/MXKuyL4A2_is2vyUF-TmzA/o.jpg,False,https://www.yelp.com/biz/downtime-bar-new-york?adjust_creative=xC4n-h7ZGIsND4SXpQ_Fzg&utm_campaign=yelp_api_v3&utm_medium=api_v3_business_search&utm_source=xC4n-h7ZGIsND4SXpQ_Fzg,12,"[{'alias': 'cocktailbars', 'title': 'Cocktail Bars'}]",2.0,"{'latitude': 40.72228, 'longitude': -73.98311}",[],,"{'address1': '25 Avenue B', 'address2': None, 'address3': '', 'city': 'New York', 'zip_code': '10009', 'country': 'US', 'state': 'NY', 'display_address': ['25 Avenue B', 'New York, NY 10009']}",+16468820593,(646) 882-0593,658.4238832164262,Not so great with the drinks. Overpriced. Bad tasting. Bad entertainment. I won't be back.,I went for a Tribute Society event on a Friday night and it was such a nice time. The event was held in the basement and it was so nicely decorated. The...,Great Bar and I've always had a great time here. Music is pretty good and drinks are resona,"[{'open': [{'is_overnight': True, 'start': '2000', 'end': '0200', 'day': 0}, {'is_overnight': True, 'start': '2000', 'end': '0200', 'day': 1}, {'is_overnight': True, 'start': '2000', 'end': '0200', 'day': 2}, {'is_overnight': True, 'start': '2000', 'end': '0200', 'day': 3}, {'is_overnight': True, 'start': '2000', 'end': '0400', 'day': 4}, {'is_overnight': True, 'start': '2000', 'end': '0400', 'day': 5}], 'hours_type': 'REGULAR', 'is_open_now': False}]"
