,id,alias,name,image_url,is_closed,url,review_count,categories,rating,coordinates,transactions,price,location,phone,display_phone,distance,rev1,rev2,rev3,hours
45,AfDdPCfFDmN2Idgr1HHqNw,marshall-stack-new-york,Marshall Stack,https://s3-media3.fl.yelpcdn.com/bphoto/CNt32SKTdzfJAyqNeK-5Kw/o.jpg,False,https://www.yelp.com/biz/marshall-stack-new-york?adjust_creative=xC4n-h7ZGIsND4SXpQ_Fzg&utm_campaign=yelp_api_v3&utm_medium=api_v3_business_search&utm_source=xC4n-h7ZGIsND4SXpQ_Fzg,224,"[{'alias': 'bars', 'title': 'Bars'}]",4.0,"{'latitude': 40.720737, 'longitude': -73.989944}",[],$$,"{'address1': '66 Rivington St', 'address2': None, 'address3': '', 'city': 'New York', 'zip_code': '10002', 'country': 'US', 'state': 'NY', 'display_address': ['66 Rivington St', 'New York, NY 10002']}",+12122284667,(212) 228-4667,587.2203717245894,Been coming here for years. Amazing amount of natural lighting (huge windows) and selection of beers. Bartenders are great and extremely chill. It's my go...,:-) chill spot for a beer. Friendly bartenders. Great  cheap tater tots. Cool vibe. Jukebox with lots of rock,"Cool, laid-back little bar in the Lower East Side. The it's music-themed, as implied by the name - with a jukebox, old-school stools and rock-n-roll...","[{'open': [{'is_overnight': True, 'start': '1600', 'end': '0200', 'day': 0}, {'is_overnight': True, 'start': '1600', 'end': '0200', 'day': 1}, {'is_overnight': True, 'start': '1600', 'end': '0200', 'day': 2}, {'is_overnight': True, 'start': '1600', 'end': '0200', 'day': 3}, {'is_overnight': True, 'start': '1600', 'end': '0400', 'day': 4}, {'is_overnight': True, 'start': '1300', 'end': '0400', 'day': 5}, {'is_overnight': True, 'start': '1300', 'end': '0200', 'day': 6}], 'hours_type': 'REGULAR', 'is_open_now': True}]"
46,rArW8jrENhzt4IPONH941g,the-55-bar-new-york,The 55 Bar,https://s3-media3.fl.yelpcdn.com/bphoto/GzoLBckltU4K14bkCdbZ8A/o.jpg,False,https://www.yelp.com/biz/the-55-bar-new-york?adjust_creative=xC4n-h7ZGIsND4SXpQ_Fzg&utm_campaign=yelp_api_v3&utm_medium=api_v3_business_search&utm_source=xC4n-h7ZGIsND4SXpQ_Fzg,161,"[{'alias': 'jazzandblues', 'title': 'Jazz & Blues'}, {'alias': 'divebars', 'title': 'Dive Bars'}]",4.0,"{'latitude': 40.73378, 'longitude': -74.00224}",[],$$,"{'address1': '55 Christopher St', 'address2': None, 'address3': '', 'city': 'New York', 'zip_code': '10001', 'country': 'US', 'state': 'NY', 'display_address': ['55 Christopher St', 'New York, NY 10001']}",+12129299883,(212) 929-9883,2376.3839424713833,"This bar felt like a big hug. I passed it on the way to Jeffrey's Grocery and after dinner came in with my friend. It's a jazz dive bar, in New York. I...","Please also see other 3 star (and below) reviews to confirm that my negative experience with this bar isn't isolated.

Music is usually pretty good (as is...","Music good, bartender not so good. No prices posted on drinks but he quoted one price before I ordered and then quoted a higher price on the bill. He forgot...","[{'open': [{'is_overnight': True, 'start': '1400', 'end': '0400', 'day': 0}, {'is_overnight': True, 'start': '1400', 'end': '0400', 'day': 1}, {'is_overnight': True, 'start': '1400', 'end': '0400', 'day': 2}, {'is_overnight': True, 'start': '1400', 'end': '0400', 'day': 3}, {'is_overnight': True, 'start': '1400', 'end': '0400', 'day': 4}, {'is_overnight': True, 'start': '1400', 'end': '0400', 'day': 5}, {'is_overnight': True, 'start': '1400', 'end': '0400', 'day': 6}], 'hours_type': 'REGULAR', 'is_open_now': True}]"
47,oEKwNY91NifS_QekSe40ig,j-i-a-new-york,J I A,https://s3-media2.fl.yelpcdn.com/bphoto/r7umwsjFgFuF_2mbxQawjQ/o.jpg,False,https://www.yelp.com/biz/j-i-a-new-york?adjust_creative=xC4n-h7ZGIsND4SXpQ_Fzg&utm_campaign=yelp_api_v3&utm_medium=api_v3_business_search&utm_source=xC4n-h7ZGIsND4SXpQ_Fzg,13,"[{'alias': 'cocktailbars', 'title': 'Cocktail Bars'}, {'alias': 'lounges', 'title': 'Lounges'}]",1.5,"{'latitude': 40.7197913049117, 'longitude': -73.9880412963844}",[],$$,"{'address1': '105 Rivington St', 'address2': None, 'address3': None, 'city': 'New York', 'zip_code': '10002', 'country': 'US', 'state': 'NY', 'display_address': ['105 Rivington St', 'New York, NY 10002']}",+16468820021,(646) 882-0021,410.67279854402926,Threw our company holiday party here just last night. It is one of the most unique spaces I've seen and very fun vibe! Whole team had such a great time and...,"Went here for a free party my friend was spinning at. I found out when I showed up that free meant a 1k minimum because ""they need to make sure we spend...","So let's say you have a fantastic plan for New Years Eve.  Friends from all over the country fly in for a reunion, you've found the perfect dress/shoe...","[{'open': [{'is_overnight': True, 'start': '2300', 'end': '0400', 'day': 2}, {'is_overnight': True, 'start': '2300', 'end': '0400', 'day': 4}, {'is_overnight': True, 'start': '2300', 'end': '0400', 'day': 5}], 'hours_type': 'REGULAR', 'is_open_now': False}]"
48,fJdfXAVAKpNI-GoLA6U3Lg,grey-lady-new-york,Grey Lady,https://s3-media3.fl.yelpcdn.com/bphoto/uCGsNlyGb4qXJAC2oI0GSA/o.jpg,False,https://www.yelp.com/biz/grey-lady-new-york?adjust_creative=xC4n-h7ZGIsND4SXpQ_Fzg&utm_campaign=yelp_api_v3&utm_medium=api_v3_business_search&utm_source=xC4n-h7ZGIsND4SXpQ_Fzg,340,"[{'alias': 'seafood', 'title': 'Seafood'}, {'alias': 'bars', 'title': 'Bars'}]",3.5,"{'latitude': 40.718893, 'longitude': -73.990238}","['delivery', 'pickup']",$$,"{'address1': '77 Delancey St', 'address2': '', 'address3': '', 'city': 'New York', 'zip_code': '10002', 'country': 'US', 'state': 'NY', 'display_address': ['77 Delancey St', 'New York, NY 10002']}",+16465805239,(646) 580-5239,469.69488737276816,"Grey Lady has a rustic feel with a cool décor, blue-gray leather couch, classic white-marble bar, a handful of wooden tables and black-and-white photos of...","Had a really bad experience booking an event here for my birthday, booked an event with a minimum spend only to find out when I got there that I only had...","I'm not one to normally review bars, because frankly, I could care less. But the treatment I received from the staff Saturday was unacceptable! 

Before I...","[{'open': [{'is_overnight': False, 'start': '1600', 'end': '0000', 'day': 0}, {'is_overnight': True, 'start': '1200', 'end': '0200', 'day': 1}, {'is_overnight': True, 'start': '1200', 'end': '0200', 'day': 2}, {'is_overnight': True, 'start': '1200', 'end': '0400', 'day': 3}, {'is_overnight': True, 'start': '1200', 'end': '0400', 'day': 4}, {'is_overnight': True, 'start': '1100', 'end': '0400', 'day': 5}, {'is_overnight': False, 'start': '1100', 'end': '0000', 'day': 6}], 'hours_type': 'REGULAR', 'is_open_now': True}]"
49,wLvcBF3tbvu5h6XDYfm7DA,burp-castle-new-york,Burp Castle,https://s3-media3.fl.yelpcdn.com/bphoto/3aqHNbGm3mRGIjclVq0CaA/o.jpg,False,https://www.yelp.com/biz/burp-castle-new-york?adjust_creative=xC4n-h7ZGIsND4SXpQ_Fzg&utm_campaign=yelp_api_v3&utm_medium=api_v3_business_search&utm_source=xC4n-h7ZGIsND4SXpQ_Fzg,554,"[{'alias': 'pubs', 'title': 'Pubs'}, {'alias': 'lounges', 'title': 'Lounges'}]",4.0,"{'latitude': 40.7283252192663, 'longitude': -73.9886448736218}",[],$$,"{'address1': '41 E 7th St', 'address2': '', 'address3': '', 'city': 'New York', 'zip_code': '10003', 'country': 'US', 'state': 'NY', 'display_address': ['41 E 7th St', 'New York, NY 10003']}",+12129824576,(212) 982-4576,1327.3611144599408,"Been wanting to come here for a while. Finally got the chance recently. 

The atmosphere is unique and the service is attentive. (Note that the staff insist...",The concept is really cool and maybe a main reason this place is still doing business. But I got the feeling it wasn't as great as it used to be. Came on a...,"Whisper 

The shush bar was quite a trip.  We entered this beer bar knowing what to expect but this was a bit over the top.  

People were putting medieval...","[{'open': [{'is_overnight': False, 'start': '1700', 'end': '0000', 'day': 0}, {'is_overnight': False, 'start': '1700', 'end': '0000', 'day': 1}, {'is_overnight': False, 'start': '1700', 'end': '0000', 'day': 2}, {'is_overnight': False, 'start': '1700', 'end': '0000', 'day': 3}, {'is_overnight': True, 'start': '1700', 'end': '0200', 'day': 4}, {'is_overnight': True, 'start': '1600', 'end': '0200', 'day': 5}, {'is_overnight': False, 'start': '1600', 'end': '0000', 'day': 6}], 'hours_type': 'REGULAR', 'is_open_now': False}]"
