,id,alias,name,image_url,is_closed,url,review_count,categories,rating,coordinates,transactions,price,location,phone,display_phone,distance,rev1,rev2,rev3
42,PSqS84Hwqus6ombPXSwbZg,brooklyn-house-of-comedy-brooklyn,Brooklyn House of Comedy,,False,https://www.yelp.com/biz/brooklyn-house-of-comedy-brooklyn?adjust_creative=xC4n-h7ZGIsND4SXpQ_Fzg&utm_campaign=yelp_api_v3&utm_medium=api_v3_business_search&utm_source=xC4n-h7ZGIsND4SXpQ_Fzg,1,"[{'alias': 'comedyclubs', 'title': 'Comedy Clubs'}, {'alias': 'karaoke', 'title': 'Karaoke'}]",3.0,"{'latitude': 40.68372, 'longitude': -73.95382}",[],,"{'address1': '1165 Bedford Ave', 'address2': '', 'address3': None, 'city': 'Brooklyn', 'zip_code': '11216', 'country': 'US', 'state': 'NY', 'display_address': ['1165 Bedford Ave', 'Brooklyn, NY 11216']}",+17187379250,(718) 737-9250,2347.9916669146583,"Cash only!?! Venues still do this but I guess they had to get their money. There's a bar as you enter, don't get turned around when you see Inkwell it's the...",No Review,No Review
43,43_d9tQwmxJh4t6pBtCBag,the-gold-room-brooklyn-2,The Gold Room,https://s3-media2.fl.yelpcdn.com/bphoto/TBsvX5aBzkTSfXNToqdraw/o.jpg,False,https://www.yelp.com/biz/the-gold-room-brooklyn-2?adjust_creative=xC4n-h7ZGIsND4SXpQ_Fzg&utm_campaign=yelp_api_v3&utm_medium=api_v3_business_search&utm_source=xC4n-h7ZGIsND4SXpQ_Fzg,53,"[{'alias': 'tradamerican', 'title': 'American (Traditional)'}, {'alias': 'cocktailbars', 'title': 'Cocktail Bars'}]",4.0,"{'latitude': 40.66202, 'longitude': -73.95353}","['pickup', 'delivery']",$$,"{'address1': '429 Rogers Ave', 'address2': '', 'address3': None, 'city': 'Brooklyn', 'zip_code': '11225', 'country': 'US', 'state': 'NY', 'display_address': ['429 Rogers Ave', 'Brooklyn, NY 11225']}",+17186187130,(718) 618-7130,4006.00051408767,"Ordered from Uber Eats, food was great- had the eek wings and the whiting, shrimp combo.
Nice presentation, food was just what I needed and fast...",Do NOT COME HERE HUNGRY. I came happy house time  I got in the door less than half hour after opening and my entry made for three customers. I was warmly...,"Came here for this restaurants Taco Tuesday. I ordered shrimp, chicken, and fish tacos. My friend ordered all fish tacos due to her being allergic to..."
44,2XxYcbw8kpHlRzCrixMY7Q,ponyboy-brooklyn,Ponyboy,https://s3-media2.fl.yelpcdn.com/bphoto/tIg1XpnfxaGJBUs8L5d0CA/o.jpg,False,https://www.yelp.com/biz/ponyboy-brooklyn?adjust_creative=xC4n-h7ZGIsND4SXpQ_Fzg&utm_campaign=yelp_api_v3&utm_medium=api_v3_business_search&utm_source=xC4n-h7ZGIsND4SXpQ_Fzg,23,"[{'alias': 'seafood', 'title': 'Seafood'}, {'alias': 'cocktailbars', 'title': 'Cocktail Bars'}]",3.5,"{'latitude': 40.72398, 'longitude': -73.95077}","['pickup', 'delivery']",,"{'address1': '632 Manhattan Ave', 'address2': '', 'address3': None, 'city': 'Brooklyn', 'zip_code': '11222', 'country': 'US', 'state': 'NY', 'display_address': ['632 Manhattan Ave', 'Brooklyn, NY 11222']}",,,3946.5820917337223,"I stumbled upon this bar without any anticipations about what kind of bar this would be. It's very euro, and it was a really fun change of pace. The front...","Cuter than Manhattan Inn, and has a nice back area for dancing/hanging out. However ... cocktails are $15 and that's a little insane, even for ~*rapidly...",Super crowded on the weekends even when it's early (10 pm). They only have one bar towards the front and a dance area with with reservation tables in the...
45,raASjJPE1UAXzG5Ql_paDA,bonus-room-flushing,Bonus Room,https://s3-media2.fl.yelpcdn.com/bphoto/m_jSg1CYupSeiJlnniL1Xw/o.jpg,False,https://www.yelp.com/biz/bonus-room-flushing?adjust_creative=xC4n-h7ZGIsND4SXpQ_Fzg&utm_campaign=yelp_api_v3&utm_medium=api_v3_business_search&utm_source=xC4n-h7ZGIsND4SXpQ_Fzg,40,"[{'alias': 'bars', 'title': 'Bars'}]",4.0,"{'latitude': 40.696118, 'longitude': -73.90466}",[],$$,"{'address1': '991 Wyckoff Ave', 'address2': '', 'address3': '', 'city': 'Flushing', 'zip_code': '11385', 'country': 'US', 'state': 'NY', 'display_address': ['991 Wyckoff Ave', 'Flushing, NY 11385']}",+19293378151,(929) 337-8151,2055.2257608653895,Dive Bar alert! Very lively on a Friday night. We had a couple of Lagunitas and played hours of pool. Bathroom was.....Divey. You know the ones with...,"Let's just say this bar caters to whom they feel like serving. 
I was meeting a group of friends and the service sucked , they didn't have any of the drinks...",So some guys thought it was funny to pick on me for being Jewish and the bar tenders did nothing but tell me I was in the wrong for being Jewish
46,VX9XPnQ3-k7vdGKLxu1qBw,hunky-dory-brooklyn,Hunky Dory,https://s3-media3.fl.yelpcdn.com/bphoto/Rpfrd3DzvvlS2z0tSl2lZw/o.jpg,False,https://www.yelp.com/biz/hunky-dory-brooklyn?adjust_creative=xC4n-h7ZGIsND4SXpQ_Fzg&utm_campaign=yelp_api_v3&utm_medium=api_v3_business_search&utm_source=xC4n-h7ZGIsND4SXpQ_Fzg,69,"[{'alias': 'coffee', 'title': 'Coffee & Tea'}, {'alias': 'breakfast_brunch', 'title': 'Breakfast & Brunch'}, {'alias': 'cocktailbars', 'title': 'Cocktail Bars'}]",4.0,"{'latitude': 40.67308, 'longitude': -73.95695}",[],$$,"{'address1': '747 Franklin Ave', 'address2': '', 'address3': None, 'city': 'Brooklyn', 'zip_code': '11238', 'country': 'US', 'state': 'NY', 'display_address': ['747 Franklin Ave', 'Brooklyn, NY 11238']}",+15164182063,(516) 418-2063,3239.152420324616,"A perfect spot to grab low-key cocktails, brunch, lunch, or dinner. Truly one of a kind and such an asset to the neighborhood! Plenty of seating with a...","My husband and I have breakfast here once a week. It's an incredible addition to the neighborhood with friendly management, amazing hospitality, and...","For the last year, Hunky Dory has been an amazing a addition to the already great options on Franklin Ave - especially for take out/delivery. The breakfast..."
47,d7_W8J8T0PESBsILMsGKGQ,sea-wolf-brooklyn,Sea Wolf,https://s3-media2.fl.yelpcdn.com/bphoto/p-BHa6lSSUvV4CjFw1a9qg/o.jpg,False,https://www.yelp.com/biz/sea-wolf-brooklyn?adjust_creative=xC4n-h7ZGIsND4SXpQ_Fzg&utm_campaign=yelp_api_v3&utm_medium=api_v3_business_search&utm_source=xC4n-h7ZGIsND4SXpQ_Fzg,450,"[{'alias': 'cocktailbars', 'title': 'Cocktail Bars'}, {'alias': 'seafood', 'title': 'Seafood'}, {'alias': 'tradamerican', 'title': 'American (Traditional)'}]",4.0,"{'latitude': 40.70683, 'longitude': -73.9228}",['delivery'],$$,"{'address1': '19 Wyckoff Ave', 'address2': '', 'address3': '', 'city': 'Brooklyn', 'zip_code': '11237', 'country': 'US', 'state': 'NY', 'display_address': ['19 Wyckoff Ave', 'Brooklyn, NY 11237']}",+17183663272,(718) 366-3272,1643.9395481060812,"I went to Sea Wolf on a weekend. It was packed! We waited bout 20-30 minutes, but were allowed to go to the bar. The hostess was so sweet and very...","Dear Sea Wolf,

This food was amazing! I worked at Fish 101 in Encinitas, California last year and to see ""San Diego Style"" Tacos pop up first thing on the...",This is the WORST service I have ever encountered in NYC. The food came out before the utensils. By the time I was able to flag someone down to tell them I...
48,GYdwGPsfXuJ_ZablxsP7CQ,the-big-whiskey-brooklyn,The Big Whiskey,https://s3-media4.fl.yelpcdn.com/bphoto/257liPfkR_-vt59ee-0Ddg/o.jpg,False,https://www.yelp.com/biz/the-big-whiskey-brooklyn?adjust_creative=xC4n-h7ZGIsND4SXpQ_Fzg&utm_campaign=yelp_api_v3&utm_medium=api_v3_business_search&utm_source=xC4n-h7ZGIsND4SXpQ_Fzg,44,"[{'alias': 'whiskeybars', 'title': 'Whiskey Bars'}, {'alias': 'beerbar', 'title': 'Beer Bar'}]",4.0,"{'latitude': 40.7109427935129, 'longitude': -73.9503494722379}",[],$$,"{'address1': '524 Grand St', 'address2': '', 'address3': None, 'city': 'Brooklyn', 'zip_code': '11211', 'country': 'US', 'state': 'NY', 'display_address': ['524 Grand St', 'Brooklyn, NY 11211']}",+13477254386,(347) 725-4386,2733.9305869856894,"Great service, friendly staff and delicious food and drinks! Don't miss out on shuffleboard in the basement!","Whiskey, sports and board games, what more could I ask for? 

I met a friend here and we had a really great time. For a Sunday evening, it was quite busy,...","Stopped by here over the weekend to watch the UNC/Duke football game with a friend and has a blast. The bar wasn't super packed, the bar tenders are great,..."
49,6y9dn43PLwnLdNvQSO4ISw,tooker-alley-brooklyn,Tooker Alley,https://s3-media4.fl.yelpcdn.com/bphoto/omozBevTX8NhM-G9MiSOeg/o.jpg,False,https://www.yelp.com/biz/tooker-alley-brooklyn?adjust_creative=xC4n-h7ZGIsND4SXpQ_Fzg&utm_campaign=yelp_api_v3&utm_medium=api_v3_business_search&utm_source=xC4n-h7ZGIsND4SXpQ_Fzg,165,"[{'alias': 'lounges', 'title': 'Lounges'}, {'alias': 'cocktailbars', 'title': 'Cocktail Bars'}]",4.0,"{'latitude': 40.6727982, 'longitude': -73.9624634}",[],$$,"{'address1': '793 Washington Ave', 'address2': '', 'address3': '', 'city': 'Brooklyn', 'zip_code': '11238', 'country': 'US', 'state': 'NY', 'display_address': ['793 Washington Ave', 'Brooklyn, NY 11238']}",+13479554743,(347) 955-4743,3619.6991806738984,"Can't believe I never rated this place.  I have been here many times and remember when it opened years ago!  Nice vibe,great drinks.  For when you want your...","If you are on a date, this is a cute spot to check it out. They have an indoor area and also an outdoor area. We sat inside, there's a good distance between...",This is a nice place to sit outside and have a great cocktail. The drink menu is extensive but everything is well categorized and has detailed descriptions....
