,id,alias,name,image_url,is_closed,url,review_count,categories,rating,coordinates,transactions,location,phone,display_phone,distance,price,rev1,rev2,rev3,hours
46,71HLFDV5yIX8l7WqP7Km5g,westlight-brooklyn,Westlight,https://s3-media2.fl.yelpcdn.com/bphoto/lzri0sGYecEv2Bsnhf-lkg/o.jpg,False,https://www.yelp.com/biz/westlight-brooklyn?adjust_creative=xC4n-h7ZGIsND4SXpQ_Fzg&utm_campaign=yelp_api_v3&utm_medium=api_v3_business_search&utm_source=xC4n-h7ZGIsND4SXpQ_Fzg,481,"[{'alias': 'tapasmallplates', 'title': 'Tapas/Small Plates'}, {'alias': 'cocktailbars', 'title': 'Cocktail Bars'}, {'alias': 'wine_bars', 'title': 'Wine Bars'}]",3.5,"{'latitude': 40.722299, 'longitude': -73.956691}",[],"{'address1': '111 N 12th St', 'address2': '', 'address3': None, 'city': 'Brooklyn', 'zip_code': '11249', 'country': 'US', 'state': 'NY', 'display_address': ['111 N 12th St', 'Brooklyn, NY 11249']}",+17183077100,(718) 307-7100,3069.954844446023,$$$,"This place can get very busy before sunset. You can get a table inside (wait or reservation), or order at the bar and sneak outside for that instagram...","Decided to spend the Saturday shopping in Williamsburg and heard amazing things about this rooftop bar.
The William Vale hotel is beautiful, when you go...","Pretty sweet and swank spot in Williamsburg.  Pricey, as you would expect from a Brooklyn hotel rooftop bar with epic views, but when you pop in and it is...","[{'open': [{'is_overnight': False, 'start': '0700', 'end': '2300', 'day': 0}, {'is_overnight': False, 'start': '0700', 'end': '2300', 'day': 1}, {'is_overnight': False, 'start': '1200', 'end': '2300', 'day': 2}, {'is_overnight': False, 'start': '0700', 'end': '2300', 'day': 3}, {'is_overnight': False, 'start': '0700', 'end': '0000', 'day': 4}, {'is_overnight': False, 'start': '0700', 'end': '0000', 'day': 5}, {'is_overnight': False, 'start': '0700', 'end': '2300', 'day': 6}], 'hours_type': 'REGULAR', 'is_open_now': True}]"
47,WcFSkRTQ5pYqIppWeLVq2g,comic-strip-live-new-york-4,Comic Strip Live,https://s3-media4.fl.yelpcdn.com/bphoto/7lvzMtJjYYMc-f1UYRjo5A/o.jpg,False,https://www.yelp.com/biz/comic-strip-live-new-york-4?adjust_creative=xC4n-h7ZGIsND4SXpQ_Fzg&utm_campaign=yelp_api_v3&utm_medium=api_v3_business_search&utm_source=xC4n-h7ZGIsND4SXpQ_Fzg,253,"[{'alias': 'comedyclubs', 'title': 'Comedy Clubs'}]",3.5,"{'latitude': 40.774787100239, 'longitude': -73.9537973403931}",[],"{'address1': '1568 2nd Ave', 'address2': '', 'address3': '', 'city': 'New York', 'zip_code': '10028', 'country': 'US', 'state': 'NY', 'display_address': ['1568 2nd Ave', 'New York, NY 10028']}",+12128619386,(212) 861-9386,3609.4815002905634,$$,I've gone here for over 35 years and have always enjoyed the shows. The comics are always good to great and the staff is very nice. There are no bad seats....,"Best comedy club in NYC in my opinion. I've been to a number, and this is hands down my favorite and the one where I always return.

The venue has improved...",My first time ever at a comedy club. My girlfriend and I got seats right up at the front and of course the compare picked her out the minute he got on stage...,"[{'open': [{'is_overnight': True, 'start': '1200', 'end': '0400', 'day': 0}, {'is_overnight': True, 'start': '1200', 'end': '0400', 'day': 1}, {'is_overnight': True, 'start': '1200', 'end': '0400', 'day': 2}, {'is_overnight': True, 'start': '1200', 'end': '0400', 'day': 3}, {'is_overnight': True, 'start': '1200', 'end': '0400', 'day': 4}, {'is_overnight': True, 'start': '1200', 'end': '0400', 'day': 5}, {'is_overnight': True, 'start': '1200', 'end': '0400', 'day': 6}], 'hours_type': 'REGULAR', 'is_open_now': True}]"
48,1o4dZQszEUtL-w2xR1JaGA,friends-and-lovers-brooklyn,Friends and Lovers,https://s3-media2.fl.yelpcdn.com/bphoto/2pRbXT_7HbA8Zd5oBYDohQ/o.jpg,False,https://www.yelp.com/biz/friends-and-lovers-brooklyn?adjust_creative=xC4n-h7ZGIsND4SXpQ_Fzg&utm_campaign=yelp_api_v3&utm_medium=api_v3_business_search&utm_source=xC4n-h7ZGIsND4SXpQ_Fzg,77,"[{'alias': 'bars', 'title': 'Bars'}, {'alias': 'musicvenues', 'title': 'Music Venues'}]",4.0,"{'latitude': 40.678536, 'longitude': -73.958437}",[],"{'address1': '641 Classon Ave', 'address2': '', 'address3': '', 'city': 'Brooklyn', 'zip_code': '11238', 'country': 'US', 'state': 'NY', 'display_address': ['641 Classon Ave', 'Brooklyn, NY 11238']}",+19179793060,(917) 979-3060,7640.681665564798,$$,Came specifically to see the Side Ponytail comedy show that's free every Wednesday night and last Saturday of the month. Pretty cool venue although it was...,"I've come here for a few events and it's OK. There's a room with a stage separated from the main bar area, beer selection was small but varied and the...","I really enjoy the vibe here. It's a super dive bar. Music is usually great: pop, r&b, some 90s, hip-hop. And the bartender is generous with her pour....","[{'open': [{'is_overnight': True, 'start': '1700', 'end': '0200', 'day': 0}, {'is_overnight': True, 'start': '1700', 'end': '0200', 'day': 1}, {'is_overnight': True, 'start': '1700', 'end': '0200', 'day': 2}, {'is_overnight': True, 'start': '1700', 'end': '0200', 'day': 3}, {'is_overnight': True, 'start': '1700', 'end': '0400', 'day': 4}, {'is_overnight': True, 'start': '1700', 'end': '0400', 'day': 5}, {'is_overnight': True, 'start': '1700', 'end': '0200', 'day': 6}], 'hours_type': 'REGULAR', 'is_open_now': True}]"
49,mwZvC4kXYcFh8-dMF5D-mA,sunshine-laundromat-and-pinball-brooklyn,Sunshine Laundromat & Pinball,https://s3-media4.fl.yelpcdn.com/bphoto/hFswIhjkQivekBy4Trp0GQ/o.jpg,False,https://www.yelp.com/biz/sunshine-laundromat-and-pinball-brooklyn?adjust_creative=xC4n-h7ZGIsND4SXpQ_Fzg&utm_campaign=yelp_api_v3&utm_medium=api_v3_business_search&utm_source=xC4n-h7ZGIsND4SXpQ_Fzg,114,"[{'alias': 'arcades', 'title': 'Arcades'}, {'alias': 'beerbar', 'title': 'Beer Bar'}, {'alias': 'laundromat', 'title': 'Laundromat'}]",4.5,"{'latitude': 40.7293128967285, 'longitude': -73.9535903930664}",[],"{'address1': '860 Manhattan Ave', 'address2': '', 'address3': '', 'city': 'Brooklyn', 'zip_code': '11222', 'country': 'US', 'state': 'NY', 'display_address': ['860 Manhattan Ave', 'Brooklyn, NY 11222']}",+17184752055,(718) 475-2055,2285.7172423518005,$$,"Laundry attendants are always polite, and they do a great job too! A lot of wash and fold services shrink your stuff, but these people are great! 

I also...",I like quirky stuff and I love pinball so Sunshine Laundromat & Pinball easily earns 4 stars in my book. Upon arrival I was a little disappointed that the...,"I found this place on Yelp, and when I was the photos, I knew I had to make a visit to this place! 

This place is a laundromat on the front side and a...","[{'open': [{'is_overnight': True, 'start': '0700', 'end': '0200', 'day': 0}, {'is_overnight': True, 'start': '0700', 'end': '0200', 'day': 1}, {'is_overnight': True, 'start': '0700', 'end': '0200', 'day': 2}, {'is_overnight': True, 'start': '0700', 'end': '0200', 'day': 3}, {'is_overnight': True, 'start': '0700', 'end': '0400', 'day': 4}, {'is_overnight': True, 'start': '0700', 'end': '0400', 'day': 5}, {'is_overnight': True, 'start': '0800', 'end': '0200', 'day': 6}], 'hours_type': 'REGULAR', 'is_open_now': True}]"
