,id,alias,name,image_url,is_closed,url,review_count,categories,rating,coordinates,transactions,price,location,phone,display_phone,distance,rev1,rev2,rev3,hours
15,wXCb19BZ1xEcd8JnYh-h3w,mile-17-bar-and-restaurant-new-york,Mile 17 Bar & Restaurant,https://s3-media1.fl.yelpcdn.com/bphoto/ab-f4fzdOAFblqDWRb22jg/o.jpg,False,https://www.yelp.com/biz/mile-17-bar-and-restaurant-new-york?adjust_creative=xC4n-h7ZGIsND4SXpQ_Fzg&utm_campaign=yelp_api_v3&utm_medium=api_v3_business_search&utm_source=xC4n-h7ZGIsND4SXpQ_Fzg,81,"[{'alias': 'sportsbars', 'title': 'Sports Bars'}, {'alias': 'newamerican', 'title': 'American (New)'}, {'alias': 'breakfast_brunch', 'title': 'Breakfast & Brunch'}]",4.0,"{'latitude': 40.769802, 'longitude': -73.9542}","['pickup', 'delivery']",$$,"{'address1': '1446 1st Ave', 'address2': None, 'address3': '', 'city': 'New York', 'zip_code': '10021', 'country': 'US', 'state': 'NY', 'display_address': ['1446 1st Ave', 'New York, NY 10021']}",+12127721734,(212) 772-1734,4144.1833909889165,Quick recap: came here before the corona lifestyle and this place is a cool clean local bar. Banging food. Very surprised. Solid beer selection as well....,Came here again for some apps and drinks and Mile 17 did not disappoint! The service is speedy and the apps are so filling and tasty. Got the mozzarella...,I've been here a few times just for drinks. Good sports bar option in the area! They have a couple of board games as well which we love - mancala brought...,"[{'open': [{'is_overnight': True, 'start': '1100', 'end': '0400', 'day': 0}, {'is_overnight': True, 'start': '1100', 'end': '0400', 'day': 1}, {'is_overnight': True, 'start': '1100', 'end': '0400', 'day': 2}, {'is_overnight': True, 'start': '1100', 'end': '0400', 'day': 3}, {'is_overnight': True, 'start': '1100', 'end': '0400', 'day': 4}, {'is_overnight': True, 'start': '1100', 'end': '0400', 'day': 5}, {'is_overnight': True, 'start': '1100', 'end': '0400', 'day': 6}], 'hours_type': 'REGULAR', 'is_open_now': True}]"
16,hM7R5VWO1q5gk3q5mNiBEA,elis-essentials-and-wine-bar-new-york,Eli's Essentials and Wine Bar,https://s3-media4.fl.yelpcdn.com/bphoto/4TLZhaBx894pX_BXdIO6Vw/o.jpg,False,https://www.yelp.com/biz/elis-essentials-and-wine-bar-new-york?adjust_creative=xC4n-h7ZGIsND4SXpQ_Fzg&utm_campaign=yelp_api_v3&utm_medium=api_v3_business_search&utm_source=xC4n-h7ZGIsND4SXpQ_Fzg,86,"[{'alias': 'cafes', 'title': 'Cafes'}, {'alias': 'wine_bars', 'title': 'Wine Bars'}]",2.5,"{'latitude': 40.7839, 'longitude': -73.95677}",[],$$,"{'address1': '1270 Madison Ave', 'address2': '', 'address3': '', 'city': 'New York', 'zip_code': '10028', 'country': 'US', 'state': 'NY', 'display_address': ['1270 Madison Ave', 'New York, NY 10028']}",+16467553999,(646) 755-3999,4264.132952324152,"I really enjoy coming here when staying in the area, I often visit this charming neighborhood.  As a few points of reference, Eli's is now where the old...",Omg! Worst Customer service by far! Notorious rude and disrespectful staff. I came to get a after work snack. Walked in feeling hopeful and out feeling...,This cafe has an average rating of 2.5 stars for a reason. It's pity because the location and interior of it is great. But that's what happens when the...,"[{'open': [{'is_overnight': False, 'start': '0700', 'end': '2200', 'day': 0}, {'is_overnight': False, 'start': '0700', 'end': '2200', 'day': 1}, {'is_overnight': False, 'start': '0700', 'end': '2200', 'day': 2}, {'is_overnight': False, 'start': '0700', 'end': '2200', 'day': 3}, {'is_overnight': False, 'start': '0700', 'end': '2200', 'day': 4}, {'is_overnight': False, 'start': '0700', 'end': '2200', 'day': 5}, {'is_overnight': False, 'start': '0700', 'end': '2200', 'day': 6}], 'hours_type': 'REGULAR', 'is_open_now': True}]"
17,l76zEciK7TQpEuGfznI4HQ,lenox-saphire-harlem-new-york,Lenox Saphire Harlem,https://s3-media4.fl.yelpcdn.com/bphoto/9QiT_UbX3ikAA3rWf0GdRA/o.jpg,False,https://www.yelp.com/biz/lenox-saphire-harlem-new-york?adjust_creative=xC4n-h7ZGIsND4SXpQ_Fzg&utm_campaign=yelp_api_v3&utm_medium=api_v3_business_search&utm_source=xC4n-h7ZGIsND4SXpQ_Fzg,310,"[{'alias': 'breakfast_brunch', 'title': 'Breakfast & Brunch'}, {'alias': 'bars', 'title': 'Bars'}, {'alias': 'senegalese', 'title': 'Senegalese'}]",2.5,"{'latitude': 40.8092674, 'longitude': -73.9445031}","['pickup', 'delivery']",$$,"{'address1': '127 Lenox Ave', 'address2': '', 'address3': '', 'city': 'New York', 'zip_code': '10026', 'country': 'US', 'state': 'NY', 'display_address': ['127 Lenox Ave', 'New York, NY 10026']}",+12128669700,(212) 866-9700,4630.387696946101,This was my first time and it was a good experience. My friend and I got there around 5pm on a Friday and it was moderately crowded. The bathroom did not...,"The experience here may depend on the hour, the season, or the occasion, because the last time I was here late (but not THAT late) one summer night, it was...",I was invited to meet up with a friend after work on a Monday evening for a small bite to eat and a quick drink.....I arrived at the establishment at around...,"[{'open': [{'is_overnight': False, 'start': '0700', 'end': '0000', 'day': 0}, {'is_overnight': False, 'start': '0700', 'end': '0000', 'day': 1}, {'is_overnight': False, 'start': '0700', 'end': '0000', 'day': 2}, {'is_overnight': False, 'start': '0700', 'end': '0000', 'day': 3}, {'is_overnight': True, 'start': '0700', 'end': '0400', 'day': 4}, {'is_overnight': True, 'start': '0800', 'end': '0400', 'day': 5}, {'is_overnight': False, 'start': '0800', 'end': '0000', 'day': 6}], 'hours_type': 'REGULAR', 'is_open_now': True}]"
18,NESMnB6RYx9lPbWLLswFLA,american-legion-post-398-new-york,American Legion Post 398,https://s3-media2.fl.yelpcdn.com/bphoto/7I2AhxgYqdf0OuawTgVFeA/o.jpg,False,https://www.yelp.com/biz/american-legion-post-398-new-york?adjust_creative=xC4n-h7ZGIsND4SXpQ_Fzg&utm_campaign=yelp_api_v3&utm_medium=api_v3_business_search&utm_source=xC4n-h7ZGIsND4SXpQ_Fzg,34,"[{'alias': 'jazzandblues', 'title': 'Jazz & Blues'}, {'alias': 'divebars', 'title': 'Dive Bars'}]",4.0,"{'latitude': 40.81397, 'longitude': -73.94676}",[],$,"{'address1': '248 W 132nd St', 'address2': '', 'address3': '', 'city': 'New York', 'zip_code': '10027', 'country': 'US', 'state': 'NY', 'display_address': ['248 W 132nd St', 'New York, NY 10027']}",+12122839701,(212) 283-9701,5142.918894650511,"This is it!

Excellent jazz - EXACTLY what I was looking for in Harlem. Thursdays and Sundays starting @7p - I was told to arrive over an hour early to get...",Came here to listen to jazz and was pleasantly surprised by how good all the musicians and singers were. The drinks are cheap ($5) and the fried chicken was...,"waited 2 hours for food. staff was annoyed that we asked twice about our order. If you're up fo that, go-- the music is great.",
19,nF-EOBd_H1fX50iT1EIVZA,pil-pil-new-york,Pil Pil,https://s3-media2.fl.yelpcdn.com/bphoto/uUoSkLJGMDaHv6SP2X2fwg/o.jpg,False,https://www.yelp.com/biz/pil-pil-new-york?adjust_creative=xC4n-h7ZGIsND4SXpQ_Fzg&utm_campaign=yelp_api_v3&utm_medium=api_v3_business_search&utm_source=xC4n-h7ZGIsND4SXpQ_Fzg,591,"[{'alias': 'tapas', 'title': 'Tapas Bars'}, {'alias': 'breakfast_brunch', 'title': 'Breakfast & Brunch'}, {'alias': 'wine_bars', 'title': 'Wine Bars'}]",4.0,"{'latitude': 40.7728412, 'longitude': -73.9558687}","['pickup', 'delivery']",$$,"{'address1': '265 E 78th St', 'address2': '', 'address3': '', 'city': 'New York', 'zip_code': '10075', 'country': 'US', 'state': 'NY', 'display_address': ['265 E 78th St', 'New York, NY 10075']}",+12129883788,(212) 988-3788,4208.907414987391,Ordered take out from pil pil during the quarantine. Amazing service and even better food! We will be ordering from them again next week. Can't wait to try...,I've been looking for something refreshing for brunch that didn't have super long wait times and Pil Pil was it! Pil Pil's brunch menu has 4 options of...,"Happy hour prices were dope.
Sangria wasn't the best I had, but definitely very wine-y. 
The place was super cool and I'd def recommend going!","[{'open': [{'is_overnight': False, 'start': '1200', 'end': '0000', 'day': 0}, {'is_overnight': False, 'start': '1200', 'end': '0000', 'day': 1}, {'is_overnight': False, 'start': '1200', 'end': '0000', 'day': 2}, {'is_overnight': True, 'start': '1200', 'end': '0100', 'day': 3}, {'is_overnight': True, 'start': '1200', 'end': '0200', 'day': 4}, {'is_overnight': True, 'start': '1100', 'end': '0200', 'day': 5}, {'is_overnight': False, 'start': '1100', 'end': '0000', 'day': 6}], 'hours_type': 'REGULAR', 'is_open_now': True}]"
20,oNJOIxuZlrTYFWwAFMTdkQ,tre-otto-new-york-2,Tre Otto,https://s3-media1.fl.yelpcdn.com/bphoto/Hty1YZzO8k133y5GfJTJhw/o.jpg,False,https://www.yelp.com/biz/tre-otto-new-york-2?adjust_creative=xC4n-h7ZGIsND4SXpQ_Fzg&utm_campaign=yelp_api_v3&utm_medium=api_v3_business_search&utm_source=xC4n-h7ZGIsND4SXpQ_Fzg,169,"[{'alias': 'bars', 'title': 'Bars'}, {'alias': 'italian', 'title': 'Italian'}]",3.5,"{'latitude': 40.788425, 'longitude': -73.953643}","['pickup', 'delivery', 'restaurant_reservation']",$$,"{'address1': '1410 Madison Ave', 'address2': '', 'address3': '', 'city': 'New York', 'zip_code': '10029', 'country': 'US', 'state': 'NY', 'display_address': ['1410 Madison Ave', 'New York, NY 10029']}",+12128608880,(212) 860-8880,4091.484641992124,"On my way from The Museum Mile, we saw an inviting sign. The sign said Happy Hour! It worked, I was even happier than before I entered.  We ordered the red...","When I first walked in, I was pleasantly surprised with the ambiance as there are plenty of comfortable, booth style seats available which I find very...","Very convenient  local eatery...
Pretty nice inside and confortable..
Service is on the slow side but I was the only table of customers, 
The menu is very...","[{'open': [{'is_overnight': False, 'start': '1130', 'end': '2200', 'day': 0}, {'is_overnight': False, 'start': '1130', 'end': '2200', 'day': 1}, {'is_overnight': False, 'start': '1130', 'end': '2200', 'day': 2}, {'is_overnight': False, 'start': '1130', 'end': '2200', 'day': 3}, {'is_overnight': False, 'start': '1130', 'end': '2200', 'day': 4}, {'is_overnight': False, 'start': '1500', 'end': '2200', 'day': 5}, {'is_overnight': False, 'start': '1500', 'end': '2200', 'day': 6}], 'hours_type': 'REGULAR', 'is_open_now': True}]"
21,oqeeOpA2S6U02nUGa8Ot7g,alison-new-york,Alison,https://s3-media2.fl.yelpcdn.com/bphoto/1SCZPlbun-60g0Z_C953Ag/o.jpg,False,https://www.yelp.com/biz/alison-new-york?adjust_creative=xC4n-h7ZGIsND4SXpQ_Fzg&utm_campaign=yelp_api_v3&utm_medium=api_v3_business_search&utm_source=xC4n-h7ZGIsND4SXpQ_Fzg,29,"[{'alias': 'beerbar', 'title': 'Beer Bar'}, {'alias': 'tradamerican', 'title': 'American (Traditional)'}]",4.5,"{'latitude': 40.7909561630924, 'longitude': -73.9469904452562}","['pickup', 'delivery']",$$,"{'address1': '1651 Lexington Ave', 'address2': '', 'address3': None, 'city': 'New York', 'zip_code': '10029', 'country': 'US', 'state': 'NY', 'display_address': ['1651 Lexington Ave', 'New York, NY 10029']}",+16468761054,(646) 876-1054,3648.866359778653,I came here before shelter until place for brunch with my mom. I had the chicken sandwich and she had the French toast. Everything was wonderful. I've been...,"What great addition to the neighborhood.  This cozy spot has been open since September 2019, which still makes them the new kid on the block, but their food...","This is a cute new-ish brunch spot that I will be sure to return to. The space is pretty open and felt very warm and welcoming. 

The food itself is...","[{'open': [{'is_overnight': False, 'start': '1600', 'end': '2130', 'day': 0}, {'is_overnight': False, 'start': '1600', 'end': '2130', 'day': 1}, {'is_overnight': False, 'start': '1600', 'end': '2130', 'day': 2}, {'is_overnight': False, 'start': '1600', 'end': '2130', 'day': 3}, {'is_overnight': False, 'start': '1600', 'end': '2130', 'day': 4}, {'is_overnight': False, 'start': '1600', 'end': '2130', 'day': 5}, {'is_overnight': False, 'start': '1600', 'end': '2130', 'day': 6}], 'hours_type': 'REGULAR', 'is_open_now': True}]"
22,eDfJOJcQynmEjSoVfmJkqg,mels-burger-bar-new-york-3,Mel's Burger Bar,https://s3-media2.fl.yelpcdn.com/bphoto/ZXIlbHjSo00IDFvNpBASnA/o.jpg,False,https://www.yelp.com/biz/mels-burger-bar-new-york-3?adjust_creative=xC4n-h7ZGIsND4SXpQ_Fzg&utm_campaign=yelp_api_v3&utm_medium=api_v3_business_search&utm_source=xC4n-h7ZGIsND4SXpQ_Fzg,334,"[{'alias': 'burgers', 'title': 'Burgers'}, {'alias': 'sportsbars', 'title': 'Sports Bars'}, {'alias': 'breakfast_brunch', 'title': 'Breakfast & Brunch'}]",3.5,"{'latitude': 40.771, 'longitude': -73.95636}","['pickup', 'delivery']",$$,"{'address1': '1450 Second Ave', 'address2': '', 'address3': '', 'city': 'New York', 'zip_code': '10021', 'country': 'US', 'state': 'NY', 'display_address': ['1450 Second Ave', 'New York, NY 10021']}",+12124521304,(212) 452-1304,4290.917071431717,"PURCHASED: All-you-can-eat and drink College Football Championship Special 
TOTAL: ~$30

PROS:
+ All-you-can-eat: Mouth-watering sliders and wings (BBQ,...",Thank you for staying open for delivery during these trying times! This is exactly the kind of food I've been missing. The two times I've gotten it...,Came to Mel's with my boyfriend last night as we were trying to satisfy BAD burger cravings! The restaurant was about half full (8:30pm on a Monday night)...,"[{'open': [{'is_overnight': False, 'start': '1200', 'end': '2100', 'day': 0}, {'is_overnight': False, 'start': '1200', 'end': '2100', 'day': 1}, {'is_overnight': False, 'start': '1200', 'end': '2100', 'day': 2}, {'is_overnight': False, 'start': '1200', 'end': '2100', 'day': 3}, {'is_overnight': False, 'start': '1200', 'end': '2100', 'day': 4}, {'is_overnight': False, 'start': '1200', 'end': '2100', 'day': 5}, {'is_overnight': False, 'start': '1200', 'end': '2100', 'day': 6}], 'hours_type': 'REGULAR', 'is_open_now': True}]"
23,LP1CLHgZKA6oOJ737Pr74A,reifs-tavern-new-york,Reif's Tavern,https://s3-media2.fl.yelpcdn.com/bphoto/pg_Sk-WDkOolYofuAXhmOg/o.jpg,False,https://www.yelp.com/biz/reifs-tavern-new-york?adjust_creative=xC4n-h7ZGIsND4SXpQ_Fzg&utm_campaign=yelp_api_v3&utm_medium=api_v3_business_search&utm_source=xC4n-h7ZGIsND4SXpQ_Fzg,55,"[{'alias': 'pubs', 'title': 'Pubs'}, {'alias': 'sportsbars', 'title': 'Sports Bars'}]",4.0,"{'latitude': 40.78142, 'longitude': -73.94857}",[],$,"{'address1': '302 E 92nd St', 'address2': '', 'address3': '', 'city': 'New York', 'zip_code': '10128', 'country': 'US', 'state': 'NY', 'display_address': ['302 E 92nd St', 'New York, NY 10128']}",+12124260519,(212) 426-0519,3549.624530362849,"Typical old school hole-in-the-wall dive bar with a very chill atmosphere.

As you walk in you have your bar area with bar stools, and also room for...","I love the backyard for grilling. I've been here on many occasions where people had parties here and it reminded me of some of my college years, where you...",I love it here. Classic dive bar with great prices and strong pours. No food BUT there is a backyard with a grill so you can bring your own stuff. I used to...,"[{'open': [{'is_overnight': True, 'start': '1200', 'end': '0400', 'day': 0}, {'is_overnight': True, 'start': '1200', 'end': '0400', 'day': 1}, {'is_overnight': True, 'start': '1200', 'end': '0400', 'day': 2}, {'is_overnight': True, 'start': '1200', 'end': '0400', 'day': 3}, {'is_overnight': True, 'start': '1200', 'end': '0400', 'day': 4}, {'is_overnight': True, 'start': '1200', 'end': '0400', 'day': 5}, {'is_overnight': True, 'start': '1200', 'end': '0400', 'day': 6}], 'hours_type': 'REGULAR', 'is_open_now': True}]"
24,ca5mjbnCm2c8E6AFIb59Rw,luzzos-neapolitan-pizza-and-wine-bar-long-island-city-2,Luzzo's Neapolitan Pizza & Wine Bar,https://s3-media3.fl.yelpcdn.com/bphoto/qOcFgPyXM8wQhvM1fih1ww/o.jpg,False,https://www.yelp.com/biz/luzzos-neapolitan-pizza-and-wine-bar-long-island-city-2?adjust_creative=xC4n-h7ZGIsND4SXpQ_Fzg&utm_campaign=yelp_api_v3&utm_medium=api_v3_business_search&utm_source=xC4n-h7ZGIsND4SXpQ_Fzg,83,"[{'alias': 'pizza', 'title': 'Pizza'}, {'alias': 'wine_bars', 'title': 'Wine Bars'}, {'alias': 'italian', 'title': 'Italian'}]",4.0,"{'latitude': 40.7492468, 'longitude': -73.9420071}","['pickup', 'delivery']",$$,"{'address1': '42-60 Crescent St', 'address2': '', 'address3': None, 'city': 'Long Island City', 'zip_code': '11101', 'country': 'US', 'state': 'NY', 'display_address': ['42-60 Crescent St', 'Long Island City, NY 11101']}",+17184330555,(718) 433-0555,4474.460773861547,"This is our go to place for pizza in the area.
We've probably been here a handful of times, we walk in, ask for seats and we're seated. We've always sat...",Pizza was actually very good and panna cotta but I took away a star for the service - hostess seemed annoyed and server was fine but nothing special...,I would've given it 5 stars but I have this thing about mushrooms. Specifically when they are listed on the menu as wild and what you get are the standard...,"[{'open': [{'is_overnight': False, 'start': '1200', 'end': '1945', 'day': 0}, {'is_overnight': False, 'start': '1200', 'end': '1945', 'day': 1}, {'is_overnight': False, 'start': '1200', 'end': '1945', 'day': 2}, {'is_overnight': False, 'start': '1200', 'end': '1945', 'day': 3}, {'is_overnight': False, 'start': '1200', 'end': '1945', 'day': 4}, {'is_overnight': False, 'start': '1200', 'end': '1945', 'day': 5}, {'is_overnight': False, 'start': '1200', 'end': '1945', 'day': 6}], 'hours_type': 'REGULAR', 'is_open_now': True}]"
25,FidqU8k0cBVAt_I_YLTOSQ,mott-haven-bar-and-grill-bronx,Mott Haven Bar and Grill,https://s3-media3.fl.yelpcdn.com/bphoto/r3GgmKlRW_DgjSl4oV1QaA/o.jpg,False,https://www.yelp.com/biz/mott-haven-bar-and-grill-bronx?adjust_creative=xC4n-h7ZGIsND4SXpQ_Fzg&utm_campaign=yelp_api_v3&utm_medium=api_v3_business_search&utm_source=xC4n-h7ZGIsND4SXpQ_Fzg,219,"[{'alias': 'bars', 'title': 'Bars'}, {'alias': 'tradamerican', 'title': 'American (Traditional)'}]",3.5,"{'latitude': 40.80826, 'longitude': -73.93043}","['pickup', 'delivery']",$$,"{'address1': '1 Bruckner Blvd', 'address2': '', 'address3': '', 'city': 'Bronx', 'zip_code': '10454', 'country': 'US', 'state': 'NY', 'display_address': ['1 Bruckner Blvd', 'Bronx, NY 10454']}",+17186652001,(718) 665-2001,3815.6743476314055,"Great customer service and music selection (Afro beats). Love the manager she's great; sooo kind and personable! 

Love the event space in the back. I keep...","Worst experience ever!!! Very unsaintary. I took my younger sibling out for brunch and she order a well done burger. After taking a bite and half, it was...","Out of convenience to where we were staying, this was the spot to check out. They're usually open until midnight but do double check. Oh and they have happy...","[{'open': [{'is_overnight': False, 'start': '1100', 'end': '2300', 'day': 0}, {'is_overnight': False, 'start': '1100', 'end': '2300', 'day': 1}, {'is_overnight': False, 'start': '1100', 'end': '0000', 'day': 2}, {'is_overnight': False, 'start': '1100', 'end': '0000', 'day': 3}, {'is_overnight': False, 'start': '1100', 'end': '0000', 'day': 4}, {'is_overnight': False, 'start': '1100', 'end': '0000', 'day': 5}, {'is_overnight': False, 'start': '1100', 'end': '2300', 'day': 6}], 'hours_type': 'REGULAR', 'is_open_now': True}]"
26,SgirMmcbICpaUzzmq1pkog,embassy-lounge-queens-long-island-city,Embassy Lounge Queens,,False,https://www.yelp.com/biz/embassy-lounge-queens-long-island-city?adjust_creative=xC4n-h7ZGIsND4SXpQ_Fzg&utm_campaign=yelp_api_v3&utm_medium=api_v3_business_search&utm_source=xC4n-h7ZGIsND4SXpQ_Fzg,1,"[{'alias': 'danceclubs', 'title': 'Dance Clubs'}, {'alias': 'latin', 'title': 'Latin American'}, {'alias': 'sandwiches', 'title': 'Sandwiches'}]",1.0,"{'latitude': 40.7443412, 'longitude': -73.9315646}",[],$$,"{'address1': '33-02 Queens Blvd', 'address2': '', 'address3': None, 'city': 'Long Island City', 'zip_code': '11101', 'country': 'US', 'state': 'NY', 'display_address': ['33-02 Queens Blvd', 'Long Island City, NY 11101']}",+17186620226,(718) 662-0226,4401.780354336642,Horrible club. Super annoyingly loud music and the DJs were obnoxious with the mike.. shady guy taking money at the door promising a good time... 1am in the...,No Review,No Review,
27,9iy3nkrH5JJqQYcKYnfQtQ,el-chicanto-new-york,El Chicanto,,False,https://www.yelp.com/biz/el-chicanto-new-york?adjust_creative=xC4n-h7ZGIsND4SXpQ_Fzg&utm_campaign=yelp_api_v3&utm_medium=api_v3_business_search&utm_source=xC4n-h7ZGIsND4SXpQ_Fzg,2,"[{'alias': 'bars', 'title': 'Bars'}]",1.0,"{'latitude': 40.7957, 'longitude': -73.943237}",[],,"{'address1': '154 East 112th St', 'address2': '', 'address3': '', 'city': 'New York', 'zip_code': '10029', 'country': 'US', 'state': 'NY', 'display_address': ['154 East 112th St', 'New York, NY 10029']}",,,3596.057960439131,"This is a horrible place to live near.  Patrons, if you have a heart, and would not like a noise polluting place like this next to where you live.  Then...","I agree with the previous reviewer, they are breaking the law blasting music all night every night!!! Do the neighborhood a favor and boycott this place so...",No Review,
28,ozbbKSRgZItJ7Rt_37flPw,fox-sports-bar-new-york,Fox Sports Bar,https://s3-media4.fl.yelpcdn.com/bphoto/R9tWTR42uXnSj195Cqk8oQ/o.jpg,False,https://www.yelp.com/biz/fox-sports-bar-new-york?adjust_creative=xC4n-h7ZGIsND4SXpQ_Fzg&utm_campaign=yelp_api_v3&utm_medium=api_v3_business_search&utm_source=xC4n-h7ZGIsND4SXpQ_Fzg,11,"[{'alias': 'sportsbars', 'title': 'Sports Bars'}, {'alias': 'newamerican', 'title': 'American (New)'}]",1.5,"{'latitude': 40.7612228393555, 'longitude': -73.8737258911133}",[],$$,"{'address1': '', 'address2': '', 'address3': '', 'city': 'New York', 'zip_code': '11369', 'country': 'US', 'state': 'NY', 'display_address': ['New York, NY 11369']}",,,3535.4315007072673,"Things are lost in translation at the Fox Sports Bar.

First off, for a 'sports bar', there was a noticeable lack of sports being shown on the tiny, fuzzy...","The United gates don't have any post-security bars, so one must properly time the security line and walk to gate with the imbibement of beverages....",I was expecting better but there seems to be a shortage of staff. Don't expect to be seated -- Just find a seat and grab it. There are many tables and...,
29,Q6quwwLiwx_47SRd3tItvA,schallers-stube-sausage-bar-new-york,Schaller's Stube Sausage Bar,https://s3-media3.fl.yelpcdn.com/bphoto/pKZ6bv7V1Oz8K8q0Yp5AXA/o.jpg,False,https://www.yelp.com/biz/schallers-stube-sausage-bar-new-york?adjust_creative=xC4n-h7ZGIsND4SXpQ_Fzg&utm_campaign=yelp_api_v3&utm_medium=api_v3_business_search&utm_source=xC4n-h7ZGIsND4SXpQ_Fzg,193,"[{'alias': 'german', 'title': 'German'}, {'alias': 'hotdog', 'title': 'Hot Dogs'}, {'alias': 'beerbar', 'title': 'Beer Bar'}]",4.0,"{'latitude': 40.777544, 'longitude': -73.951607}","['pickup', 'delivery']",$$,"{'address1': '1652 2nd Ave', 'address2': '', 'address3': '', 'city': 'New York', 'zip_code': '10028', 'country': 'US', 'state': 'NY', 'display_address': ['1652 2nd Ave', 'New York, NY 10028']}",+16467264355,(646) 726-4355,3795.8100443033513,"I was hungry walking back from the bar to our friend's apartment, and Schaller's Stube Sausage Bar came highly recommended by her. I am a huge sausage...","Up on 86th and 2nd, easy to miss, right next door to the highly rated bakery called Two Little Red Hens.  This Sausage Bar is where Schallers serves up...","Great place to eat burgers under the weather because they really care as well. I'm
Glad we ate there, me and my kids were happy to enjoy it. Thank you guys.","[{'open': [{'is_overnight': False, 'start': '1100', 'end': '2100', 'day': 0}, {'is_overnight': False, 'start': '1100', 'end': '2100', 'day': 1}, {'is_overnight': False, 'start': '1100', 'end': '2100', 'day': 2}, {'is_overnight': False, 'start': '1100', 'end': '2100', 'day': 3}, {'is_overnight': False, 'start': '1100', 'end': '2100', 'day': 4}, {'is_overnight': False, 'start': '1100', 'end': '2100', 'day': 5}, {'is_overnight': False, 'start': '1200', 'end': '1800', 'day': 6}], 'hours_type': 'REGULAR', 'is_open_now': True}]"
30,fowyb5DnUydqFodInCQyQQ,centro-pizza-bar-and-italian-kitchen-long-island-city,Centro Pizza Bar & Italian Kitchen,https://s3-media2.fl.yelpcdn.com/bphoto/LEnLZZlSgwt00cUQ_o87ww/o.jpg,False,https://www.yelp.com/biz/centro-pizza-bar-and-italian-kitchen-long-island-city?adjust_creative=xC4n-h7ZGIsND4SXpQ_Fzg&utm_campaign=yelp_api_v3&utm_medium=api_v3_business_search&utm_source=xC4n-h7ZGIsND4SXpQ_Fzg,121,"[{'alias': 'pizza', 'title': 'Pizza'}, {'alias': 'italian', 'title': 'Italian'}, {'alias': 'beerbar', 'title': 'Beer Bar'}]",3.5,"{'latitude': 40.74489, 'longitude': -73.95301}","['pickup', 'delivery']",$,"{'address1': '47-23 Vernon Blvd', 'address2': '', 'address3': None, 'city': 'Long Island City', 'zip_code': '11101', 'country': 'US', 'state': 'NY', 'display_address': ['47-23 Vernon Blvd', 'Long Island City, NY 11101']}",+17183611965,(718) 361-1965,5460.927632194372,We have been ordering from Centro for years. I just wanted to say think you to all of the people at Centro who have given consistently great Pizza and other...,"Centro Pizza is my favorite local eatery in LIC. Simply put, the staff is by far the most pleasant, friendly and accomodating of any restaurant in the...",Today was my first day eating at centro I always passed by it. i never went in until today and I can definitely say that I don't regret it at all I do...,"[{'open': [{'is_overnight': False, 'start': '1000', 'end': '2200', 'day': 0}, {'is_overnight': False, 'start': '1000', 'end': '2200', 'day': 1}, {'is_overnight': False, 'start': '1000', 'end': '2200', 'day': 2}, {'is_overnight': False, 'start': '1000', 'end': '2200', 'day': 3}, {'is_overnight': False, 'start': '1000', 'end': '2300', 'day': 4}, {'is_overnight': False, 'start': '1000', 'end': '2300', 'day': 5}, {'is_overnight': False, 'start': '1000', 'end': '2200', 'day': 6}], 'hours_type': 'REGULAR', 'is_open_now': True}]"
